"","budget","revenue","title","overview","popularity","vote_count","release_date","status","runtime","production_companies","production_countries"
"260",0,0,"Let's Not Panic","When an asteroid threatens to hit New York, Sadie, a neurotic and anxious 20-something, embarks on a quest from Brooklyn to Manhattan to reunite with her therapist, who she is in love with. She believes they can finally be together in a post-apocalyptic world since the rules keeping them apart will cease to exist.",0.025844,0,"2015-04-17","Released",11,", , ",", , "
"261",0,0,"Water Path for a Fish","It's a starry night in a poor neighborhood in Latin America. Óscar is sleeping in his room when a sudden wind wakes him up. From his window he sees a little goldfish in a dirty puddle gasping for air. Óscar will try to save the goldfish through a rampant adventure full of mysterious challenges.",0.051777,1,"2015-04-14","Released",7,"Folimage, Digitzfilm, Tomavistas, S.L., Planet Nemo Animation, ","Colombia, France, Spain, "
"262",0,0,"The Aviatrix","In 1928, Lady Heath became the first person to fly solo from Cape Town to London. Eighty-five years later, Tracey Curtis-Taylor set out in a vintage biplane to fly that adventure again. Following Tracey as she retraces the journey, The Aviatrix is more than just a film about the rapture of flying – it’s a story about living life on your own terms and having the courage and determination to realise your greatest dreams.",0.026508,0,"2015-04-22","Released",60,"Nylon Films, ","Sudan, South Africa, United Kingdom, Uganda, Egypt, Tanzania, Zimbabwe, Kenya, Botswana, "
"263",0,0,"Mission NinetyTwo: Part II - Energy","Forest Scientist Sonia is thrown between an international mafia gang and multinational energy enterprises as she secretly conducts research in a restricted area in the Canadian wilderness. With two disgraced police officers she unravels a worldwide conspiracy. Sonia's curiosity comes at a price. She loses everything and has to decide whether to run and hide, or to get even with her seemingly invincible opponents, turns Sonia into an avenger to find the last piece of the missing puzzle.",0.147353,0,"2015-02-15","Released",NA,", , ",", , "
"264",0,0,"Frozen Fever","On Anna's birthday, Elsa and Kristoff are determined to give her the best celebration ever, but Elsa's icy powers may put more than just the party at risk.",9.777585,820,"2015-03-09","Released",8,"Walt Disney Pictures, Walt Disney Animation Studios, ","United States of America, "
"265",0,0,"Dissonance","A pianist plays in a huge theatre on a cylindrical piano, which is rotated by his dwarf assistant. The theatre is part of a huge, spherical city. Upon waking, he turns out to be a street musician, who has a restraining order, but wants to teach his daughter how to play the piano.",0.90205,9,"2015-02-09","Released",15,"Detailfilm, FrameboX, ","Germany, "
"266",200000,0,"Caffeinated","This documentary explores a vivid and unmatched perspective to the existence of coffee in our daily lives. Expanding production to United States, Italy, India, Guatemala, Honduras and Nicaragua, the film takes coffee enthusiasts on a trip that will transcend their knowledge of the beverage and get them close to a human reality they haven't experienced before.",0.662364,0,"2015-01-31","Released",80,"Running Reel Films, Evoke Mediaworks, ","United Kingdom, United States of America, Colombia, Ethiopia, Guatemala, Honduras, India, Italy, Lithuania, Mexico, Nicaragua, South Korea, Sweden, Switzerland, Turkey, "
"267",10000000,0,"Admiral","When the young republic of The Netherlands is attacked by England, France and Germany and faces its own civil war no less, only one man, Michael de Ruyter, can lead the county's strongest weapon, the Dutch fleet.",5.778497,60,"2015-01-29","Released",128,"Ciné Cri De Coeur, Farmhouse Film, ","Belgium, Netherlands, "
"268",0,0,"Last Days in the Desert","On his way out of the wilderness, Jesus struggles with the Devil over the fate of a family in crisis, setting himself up for a dramatic test.",7.112734,52,"2016-05-13","Released",98,"Ironwood Entertainment, Mockingbird Pictures, Division Films, ","United States of America, "
"269",0,59700000,"Shaun the Sheep Movie","When Shaun decides to take the day off and have some fun, he gets a little more action than he bargained for. A mix up with the Farmer, a caravan and a very steep hill lead them all to the Big City and it's up to Shaun and the flock to return everyone safely to the green grass of home.",12.179949,551,"2015-02-05","Released",85,"Aardman Animations, Anton Capital Entertainment (ACE), StudioCanal, ","France, United Kingdom, "
"270",0,0,"Miles","Blurring the boundaries between humanity and technology in the teenage off-roading world of central California.",0.020215,0,"2015-01-10","Released",7,", , ","United States of America, "
"271",0,0,"True Places Never Are","A boy trapped in sadness discovers a mysterious hole in one of the old books his grandfather left behind.",0.015315,0,"2015-01-01","Released",6,", , ","United States of America, "
"272",81000000,414351546,"Kingsman: The Secret Service","The story of a super-secret spy organization that recruits an unrefined but promising street kid into the agency's ultra-competitive training program just as a global threat emerges from a twisted tech genius.",28.241973,7974,"2015-01-24","Released",129,"TSG Entertainment, Marv Films, Cloudy Productions, 20th Century Fox, ","United Kingdom, United States of America, "
"273",13000,0,"Audax","A shamed ex-freighter captain takes one last shot at redemption, only to find he is a puppet for a grander scheme.",0.032382,0,"2014-11-28","Released",90,"Clastic Pictures, ","United Kingdom, "
"274",10,0,"<U+041D><U+0435> <U+0431><U+043E><U+0439><U+0441><U+044F>, <U+044F> <U+0441> <U+0442><U+043E><U+0431><U+043E><U+0439>! 1919","",0.02792,0,"2014-11-20","Released",NA,"Central Partnership, ","Russia, Azerbaijan, "
"275",0,0,"Electric July","In the burning heat of July, Thomas and Victor, two 14 years old teenagers, are bored to death and want to escape. Victor decides to take Thomas to an abandoned bridge. He will have to confront his fears and desires.",0.34146,1,"2014-11-28","Released",24,"La Femis, Femis, La, ","France, "
"276",0,0,"Kajaki","British soldiers guarding the Kajaki Dam set out to rescue a three-man team after one of them loses a leg to a landmine.",5.947156,117,"2014-11-12","Released",108,"Head Gear Films, Lipsync Productions, Metrol Technology, MENA Film, Pukka Films, ","United Kingdom, "
"277",125000000,752100229,"The Hunger Games: Mockingjay - Part 1","Katniss Everdeen reluctantly becomes the symbol of a mass rebellion against the autocratic Capitol.",38.619773,7668,"2014-11-18","Released",123,"Lionsgate, Color Force, ","United States of America, "
"278",132000000,373552094,"Penguins of Madagascar","Skipper, Kowalski, Rico and Private join forces with undercover organization The North Wind to stop the villainous Dr. Octavius Brine from destroying the world as we know it.",24.501779,1709,"2014-11-22","Released",92,"DreamWorks Animation, ","United States of America, "
"279",165000000,675120017,"Interstellar","Interstellar chronicles the adventures of a group of explorers who make use of a newly discovered wormhole to surpass the limitations on human space travel and conquer the vast distances involved in an interstellar voyage.",39.214067,14137,"2014-11-05","Released",169,"Paramount, Legendary Entertainment, Syncopy, Lynda Obst Productions, Warner Bros. Pictures, ","Canada, United States of America, United Kingdom, "
"280",0,0,"Ocean","Tamara Drakulic sets off with her fiancé on a cargo ship headed to Hawaii to scatter her friend Tony’s ashes into the Pacific Ocean. After crossing the Atlantic Ocean, ancient limit to what was once the known world, the ship reaches the Caribbean Island of Guadalupe.",0.015385,0,"2014-10-25","Released",70,"Cinnamon Production, Monkey Production, ","Guadaloupe, Serbia, France, "
"281",0,0,"From A to B","Three estranged childhood friends (Omar, Ramy, Jay), travel on a road trip from Abu Dhabi to Beirut in memory of their lost friend. If what happens en route doesn't make them crazy, it might just bring them closer.",0.763509,5,"2015-01-08","Released",108,", , ","Lebanon, United Arab Emirates, Jordan, "
"282",165000000,657818612,"Big Hero 6","The special bond that develops between plus-sized inflatable robot Baymax, and prodigy Hiro Hamada, who team up with a group of friends to form a band of high-tech heroes.",28.972359,7986,"2014-10-24","Released",102,"Walt Disney Animation Studios, Walt Disney Pictures, ","United States of America, "
"283",21000000,0,"Robot Overlords","Earth has been conquered by robots from another galaxy and the human survivors must stay in their homes, or risk incineration.",6.496947,133,"2015-01-29","Released",90,"Umbra Telegraph Pictures, British Film Institute (BFI), Northern Ireland Screen, Pinewood Studios, British Film Company, Tempo Productions Limited, ","United Kingdom, "
"284",0,0,"The Dancer","A short life of a dance.",0.370251,0,"2014-10-01","Released",35,"Cinetech Film, ","Georgia, Russia, "
"285",0,0,"Wisla","",0.049412,1,"2014-09-27","Released",NA,"parma films, ","Poland, "
"286",0,0,"Bang Bang!","A girl gets mixed up with a spy trying to clear his name. A chance encounter of the unassuming bank receptionist Harleen Sahni with the charming yet mysterious Rajveer Nanda, results in an on-rush of ditched planes, car chases, shoot-outs, bombing raids and general global mayhem. But as the transcontinental chase ensues with Rajveer convincing Harleen that he's the good guy, can she really trust him, and will trust matter when the bullets start flying?",4.753349,89,"2014-10-02","Released",153,"Bollywood Hollywood Production, Fox Star Studios, Milk & Honey Pictures, ","India, "
"287",0,0,"Wildlike","Fourteen-year-old Mackenzie is sent to live with her uncle in Juneau when her mother can’t care for her anymore. The living situation quickly takes a turn for the worse, and she runs away to rejoin her mother in Seattle. While on her dangerous journey of sleeping in cars and breaking into hotel rooms, she’s drawn to Rene, a lonesome backpacker looking for tranquility in the wilderness.",2.288486,53,"2014-09-25","Released",104,"Tandem Pictures, Greenmachine Film, ","United States of America, "
"288",0,0,"Rurouni Kenshin: The Legend Ends","Shishio has set sail in his ironclad ship to bring down the Meiji government and return Japan to chaos, carrying Kaoru with him. In order to stop him in time, Kenshin trains with his old master to learn his final technique.",7.011184,118,"2014-09-13","Released",135,"Shueisha, Amuse, Warner Bros. Pictures, ","Japan, "
"289",0,0,"Broken Face","Loik, a disfigured sailor, is posted to a remote lighthouse with Morlaix, a tyrannical head keeper. But soon, the two men find themselves besieged by a strange storm.",0.039427,0,"2014-10-03","Released",17,", , ","Canada, "
"290",0,0,"Barbie and the Secret Door","It's the ultimate fairytale musical! Barbie stars as Alexa, a shy princess who discovers a secret door in her kingdom and enters a whimsical land filled with magical creatures and surprises. Inside, Alexa meets Romy and Nori, a mermaid and a fairy, who explain that a spoiled ruler named Malucia is trying to take all the magic in the land. To her surprise, Alexa has magical powers in this world, and her new friends are certain that only she can restore their magic. Discover what happens when Alexa finds the courage to stand up for what's right and learns that the power of friendship is far more precious than magic.",2.857499,44,"2014-08-30","Released",81,"Mattel Playground Productions, ","United States of America, "
"291",3400000,0,"Extinction","The amazing footage you will see in this documentary was recorded during an expedition to the Amazon in South America. It has been assembled as per the camera time codes. It has not been altered or tampered with in any way and after extensive testing has been considered absolutely genuine. What you will see will change the way you view the natural world. Are you ready for that? For in the heart of the rainforest, a team of researchers led by the respected Professor John Howson strived to protect endangered and vulnerable species from extinction. But their guides abandoned them after a series of strange and unexplainable events and the team soon got hopelessly lost in the jungle. When events took a horrifying turn, the team realized that they were in the hunting grounds of an apex predator. And now they were the ones on the endangered species list.",1.528313,14,"2014-08-24","Released",100,"Dark Art Films, Hollywood Vision, Pinnacle Media, ","United Kingdom, "
"292",4500000,0,"True Blue Story","A coming of age story taking place in a small Soviet town in early 70s...",0.57045,3,"2015-05-21","Released",100,"Real Dakota, ","Russia, "
"293",0,0,"Star Wars Rebels: Spark of Rebellion","A Long Time Ago In A Galaxy Far, Far Away… Against the might of the Galactic Empire, an unlikely band of heroes emerges to renew the fight for freedom.  Five years before the events of Star Wars Episode IV: A New Hope, the reigning evil Empire continues to tighten its grip of power and fear throughout the cosmos. But even amidst the tyranny and oppression of these dark days, a glimmer of light emerges. Meet the ragtag crew of the starship Ghost: Twi’lek pilot Hera, street-smart pickpocket Ezra, team leader Kanan, alien enforcer Zeb, explosives expert Sabine, and Chopper, the cantankerous Droid. Together, they embark on action-packed adventures, battle ruthless villains, and ignite the very first Spark Of Rebellion against a surging tide of Stormtroopers, TIE fighters and the mysterious Inquisitor.",3.37504,37,"2014-10-03","Released",44,", , ",", , "
"294",0,0,"Cursed","Cursed is about a villainess who enjoys bringing chaos and disaster. But when something crosses her way of evil-doing, things turn out for the unexpected.",0.026354,0,"2015-08-27","Released",5,"Studio AFK, ","Netherlands, "
"295",0,0,"Ribbit","A frog who hates the water and jumping wishes that he could be like the other animals in the Amazon rainforest.",2.303794,16,"2014-06-21","Released",88,"KRU Studios, ","United States of America, Malaysia, "
"296",0,0,"Slave Girls on the Moon","Chloe Trustcott's friend is sent into the future, the year 8888 and is sent to prison> Chloe must go to the future and get sent to o prison also so that she can break her friend out.",0.012942,0,"2014-06-21","Released",73,", , ",", , "
"297",0,0,"How (Not) to Rob a Train","Never forget how to play make believe games. Or tie your friend to (disused) railway tracks in the name of fun. Or plant (cardboard) explosives on said tracks to steal lots and lots of money from a (2D) train. Or save the boy you love from certain (?) death. Always remember how (not) to rob a train.",0.035556,0,"2014-06-17","Released",4,", , ","Canada, United Kingdom, "
"298",0,0,"Street Fighter: Assassin's Fist","",1.176723,1,"2014-05-23","Released",NA,", , ",", , "
"299",145000000,609123048,"How to Train Your Dragon 2","The thrilling second chapter of the epic How To Train Your Dragon trilogy brings back the fantastical world of Hiccup and Toothless five years later. While Astrid, Snotlout and the rest of the gang are challenging each other to dragon races (the island's new favorite contact sport), the now inseparable pair journey through the skies, charting unmapped territories and exploring new worlds. When one of their adventures leads to the discovery of a secret ice cave that is home to hundreds of new wild dragons and the mysterious Dragon Rider, the two friends find themselves at the center of a battle to protect the peace.",22.599657,4019,"2014-06-12","Released",102,"Mad Hatter Entertainment, DreamWorks Animation, ","United States of America, "
"300",0,0,"Bear Story","An old bear goes out every day to a busy street corner. Through a tin marionette theater of his own making, the bear will tell us his life story.",1.320792,36,"2014-05-08","Released",11,"Punkrobot, ","Chile, "
"301",0,0,"The Nut Job","Surly, a curmudgeon, independent squirrel is banished from his park and forced to survive in the city. Lucky for him, he stumbles on the one thing that may be able to save his life, and the rest of park community, as they gear up for winter - Maury's Nut Store.",9.020937,416,"2014-01-17","Released",85,"Open Road Films, Gulfstream Pictures, Red Rover International, ToonBox Entertainment, ","Canada, South Korea, "
"302",150000000,1274219009,"Frozen","Young princess Anna of Arendelle dreams about finding true love at her sister Elsa’s coronation. Fate takes her on a dangerous journey in an attempt to end the eternal winter that has fallen over the kingdom. She's accompanied by ice delivery man Kristoff, his reindeer Sven, and snowman Olaf. On an adventure where she will find out what friendship, courage, family, and true love really means.",31.477303,7082,"2013-11-27","Released",102,"Walt Disney Pictures, Walt Disney Animation Studios, ","United States of America, "
"303",0,0,"Zip & Zap and the Marble Gang","Zip and Zap, two mischievous twins, were placed in the Esperanza, a school where the games are prohibited. There will found the Club of Marble, child resistance to challenge the authority of adults. Thanks to her intelligence, her courage and her unwavering faith in friendship, Zip and Zap and the rest of the club will discover a mysterious secret that is hidden in the school and live the most exciting adventure of their lives.",2.661335,20,"2013-10-04","Released",92,"Capelight Pictures, Buena Vista Internacional, ","Spain, "
"304",6500000,3721345,"Ragnarok","Archaeologist Sigurd Svendsen discovers that the Oseberg ship hides a secret from the Viking Age. Along with his two children put Sigurd out on a quest to find the truth. The mystery leads them into ""No Man's Land"" between Norway and Russia where no man traveling in modern times. Old runes take on new meaning when the secret they uncover is more frightening than anyone could have imagined.",6.136969,77,"2013-11-11","Released",120,"Ghost VFX, Fantefilm, Film i Väst, ","Norway, "
"305",0,0,"Clouds","Clouds is a young girl's imaginative narrative about where the 'clouds' come from.",0.010683,0,"2013-10-01","Released",5,"Supinfocom, DSK Supinfocom, ","India, "
"306",0,0,"Boy & the World","Suffering because of his father departure to the big city, a boy leaves his village and discovers a fantastic world dominated by bug-engines and strange beings. An unusual animation with various artistic techniques that portrays the issues of the modern world through the eyes of a child.",4.022889,87,"2014-01-17","Released",80,"Filme de Papel, ","Brazil, "
"307",5000000,6833445,"The Green Inferno","A group of student activists travel from New York City to the Amazon to save the rainforest.  However, once they arrive in this vast green landscape, they soon discover that they are not alone… and that no good deed goes unpunished.",7.159085,485,"2014-09-04","Released",100,"Sobras International Pictures, Worldview Entertainment, Dragonfly Entertainment, Top Hat Releasing, BH Tilt, ","Canada, Chile, United States of America, "
"308",0,0,"Lego Star Wars: The Yoda Chronicles - Menace of the Sith","Darth Sidious shows off the new Sith clone JEK who is an extremely powerful weapon. But JEK wants to be his own master and suddenly, both the Jedi and the Sith try to win him over. It now remains to be seen which side he chooses.",0.613434,5,"2013-09-04","Released",22,"Wil Film, ","Denmark, "
"309",0,4878242,"Tracks","Accompanied only by her faithful dog and four camels, an Australian satisfies her craving for solitude by embarking on a solo trip across the desert from Alice Springs to the Indian Ocean.",0.249891,233,"2014-03-06","Released",112,"Screen Australia, See-Saw Films, ","Australia, "
"310",0,0,"The Good Life","Sylvain and Pierre have been running from the law ever since a custody battle with their mother pushed their father Yves into hiding ten years ago. But now that they’re older, the two brothers are road-weary and eager to take advantage of the perks of young adulthood. When the authorities discover their whereabouts, they are forced to move yet again and Pierre, the elder, disappears. Alone with his father on an island in the Loire River, Sylvain meets Gilda: his first girl, his first crush, and the first stop on his way to “the good life” – his own.",0.386691,8,"2013-08-27","Released",93,"Mezzanine Films, ","France, "
"311",20000,0,"Awesome Movie","A group of friends and the insanity that occurs over the course of a summer.  Tim is devastated after being dumped by his longtime girlfriend of two years. With the help of his animated friends; Mils (The Stoner), Chris (The Geek) and Dax (The Alpha Male), Tim will pursue a new relationship, learn more about himself, and continue on his path to becoming a man.",0.017226,0,"2013-06-01","Released",97,"N-meN production, Highly Sober Productions, ","United States of America, "
"312",12000000,17654912,"Nebraska","An aging, booze-addled father takes a trip from Montana to Nebraska with his estranged son in order to claim what he believes to be a million-dollar sweepstakes prize.",8.240248,788,"2013-09-21","Released",115,"Paramount Vantage, Bona Fide Productions, ","United States of America, "
"313",0,0,"Spilling the Nerds","When two kidz succumb to a mysterious substance, a group of friends become entangled in its sudden and unpredictable repercussions.",0.009412,0,"2013-05-14","Released",3,", , ",", , "
"314",0,0,"Lego Star Wars: The Yoda Chronicles - The Phantom Clone","Grievous lures Yoda away from the Jedi Temple and steals the Padawans light sabers. Dooku plans to use the crystals inside the light sabers to make Sith clones. It is up to Yoda and the Padawans to prevent Dooku from carrying out his plan.",0.817923,7,"2013-05-04","Released",22,"Wil Film, ","Denmark, "
"315",50,0,"Hooks for Hands: Tastefully Remastered","The spectacular complete edition of the Hooks For Hands Thrillogy gloriously George Lucas'd to perfection.",0.013971,0,"2013-04-26","Released",36,", , ",", , "
"316",0,0,"Don't Let Me Go","An ailing father, who is about to undergo a potentially life-threatening surgery, takes his teenage kids into the woods to try and recapture their early closeness, before he and his wife divorced and everything changed. But the three are swept into a supernatural adventure, in which only their Father, Chris, ""The Healer,"" has the ability to control their destinies. Lost in a haunted forest from which there seems no escape except death, this moving and sensitive script tells a beautiful story of a family's tragedy &amp; resilience",0.236197,2,"2013-04-06","Released",89,"Smiley Productions, ","United States of America, "
"317",0,0,"The River","On a sweltering hot day, a very pregnant Maria, desperate for a cooling swim, encounters obstacles on her path to the river.",0.617672,1,"2013-04-05","Released",12,", , ",", , "
"318",0,0,"Maidentrip","14-year-old Laura Dekker sets out on a two-year voyage in pursuit of her dream to become the youngest person ever to sail around the world alone.",1.657966,30,"2014-01-17","Released",82,"CoPilot Pictures, ","United States of America, "
"319",135000000,585178928,"The Croods","The Croods is a prehistoric comedy adventure that follows the world's first family as they embark on a journey of a lifetime when the cave that has always shielded them from danger is destroyed. Traveling across a spectacular landscape, the Croods discover an incredible new world filled with fantastic creatures -- and their outlook is changed forever.",13.519624,2988,"2013-03-20","Released",98,"DreamWorks Animation, ","United States of America, "
"320",200000000,491868548,"Oz: The Great and Powerful","Oscar Diggs, a small-time circus illusionist and con-artist, is whisked from Kansas to the Land of Oz where the inhabitants assume he's the great wizard of prophecy, there to save Oz from the clutches of evil.",11.513209,4077,"2013-03-07","Released",130,"Roth Films, Walt Disney Pictures, ","United States of America, "
"321",0,0,"Anina","Anina Yatay Salas is a ten-year-old whose name spells trouble: those three palindromes in a row are an ongoing source of teasing at school. When a playground fight results in mysterious punishment, Anina will learn to put her problems in perspective and empathize with others in this sweet little daydream of a tale.",1.644236,22,"2015-04-02","Released",80,"ANTORCHA FILMS, Rain Dogs Cine, Palermo Estudio, ","Uruguay, "
"322",0,0,"Ruby Red","Gwendolyn Shepherd is a normal 16-year-old, but her family holds a secret: A time-travel gene is expressed in the clan inherited, but not every member of the family is blessed with. Everyone is certain that Gwen's cousin Charlotte has the gene.  However, someday Gwendolyn suddenly finds herself in London at the end of the 19th century and realizes that it her, who was born a time traveler. While she is not very enthusiastic about it she will do everything possible to solve the ancient mysteries of the red ruby.",10.460797,464,"2013-03-14","Released",122,"Tele München Fernseh Produktionsgesellschaft (TMG), Bayerischer Banken-Fonds, Lieblingsfilm, mem-film, Geißendörfer Film- und Fernsehproduktion (GFF), ","Germany, "
"323",0,0,"Snow Guardians","A beautifully filmed documentary about the life and work of Ski Patrol at several Montana Ski Resorts and the Search and Rescue teams that respond to winter emergencies in the backcountry.",0.012619,0,"2014-01-01","Released",51,"F9photo, ","United States of America, "
