"","budget","revenue","title","overview","popularity","vote_count","release_date","status","runtime","production_companies","production_countries"
"1",0,0,"Avatar 5","Plot unknown.",1.586992,2,"2025-12-17","In Production",NA,"Ingenious Film Partners, Dune Entertainment, Lightstorm Entertainment, 20th Century Fox, ","United States of America, "
"2",0,0,"Luna Park","A group of renegade space workers venture to the moon to steal an energy source.",0.059746,0,"2020-12-31","Planned",NA,"Skydance Media, Dutch Oven, New Regency Pictures, ","United States of America, "
"3",0,0,"Micro","A group of graduate students are lured to Hawaii to work for a mysterious biotech company — only to find themselves miniaturized and cast out into the rainforest, with nothing but their scientific expertise and wits to protect them.",0.108056,0,"2019-12-31","Planned",NA,"Amblin Entertainment, ",", , "
"4",60000000,0,"Monster Hunter","Plot unknown. Feature film based on the video game series by Capcom, in which the player takes the role of a hunter in a fantasy environment and completes quests by hunting out specific kinds of monsters to kill or capture.",0.419023,0,"2019-12-31","Planned",NA,", , ",", , "
"5",5600000,0,"<U+58F2><U+6625><U+5A66><U+306F><U+30A2><U+30EB><U+30D5><U+30A1><U+30D9><U+30C3><U+30C8><U+3092><U+66F8><U+304F>","Visionary director Satoru Kurogawa returns to the world of animation with his feature-length debut",0.206349,0,"2019-07-12","Released",128,"LOUDSHOUT, ",", , "
"6",0,0,"Klonoa","Klonoa, a kind and good-hearted ""Dream Traveler"" protects the dreams of various worlds along with his friends Hewpoe, Lolo, Popka, and more.",0.190056,0,"2019-01-01","Planned",NA,"Henshin, ","United States of America, "
"7",0,0,"Untitled Lani Pixels Project","Evil forces have invaded an isolated island and have targeted Patrick and Susan's grandfather, Mr. Campbell. Guided by Jack, a charming Irish rogue, the siblings end up on a dangerous journey filled with magic and mystery.",0.551912,0,"2019-01-01","In Production",NA,"Lani Pixels, ","Denmark, "
"8",0,0,"Walking to Paris","The 27 year old Romanian sculptor Constantin Brancusi walked from Romania to Paris in 1903 and 1904 as a preparation and prelude to becoming the most important sculptor of the 20th century. Brancusi leaves his small village of Hobitza, south of the Carpathian Mountains and walks through Romania, Hungary, Austria, Germany, Switzerland, and parts of France to arrive in Paris, the metropolis of world culture for the first three decades of the 1900s. He walks in spring, summer, winter and autumn, treading the landscape away from the beaten track, experiencing sights, having adventures, suffering hardships, looking, touching and feeling the world as a preparation of what is to come for him.",2.528849,0,"2018-12-31","Post Production",NA,"Cinatura, Abis Studi, Catherine Dussart Productions (CDP), ","United Kingdom, "
"9",0,0,"Captain Morten and the Spider Queen","A young boy learns to take control over his life when he is shrunk to the size of an insect and has to sail his own toy boat through a flooded café. Morten has to be shrunk down before he can grow up.",0.680305,0,"2018-08-30","Post Production",75,"Calon, Grid Animation, Nukufilm, ","Estonia, Ireland, United Kingdom, "
"10",0,0,"The Story of Jonah — A Lesson in Courage and Mercy","",0.532719,0,"2018-07-10","Post Production",NA,", , ",", , "
"11",0,0,"Cranium Intel II: Magnetic Contamination","The sequel to the sci-trilogy based on the Military Execution Saga novel series.",0.52986,0,"2018-07-04","Released",180,", , ",", , "
"12",19116000,0,"The Man Who Killed Don Quixote","An advertising executive jumps back and forth in time between 21st century London and 17th century La Mancha, where Don Quixote mistakes him for Sancho Panza.",11.086657,11,"2018-06-25","Released",132,"Tornasol Films, Entre Chien et Loup, Recorded Picture Company (RPC), Amazon Studios, Alacran Pictures, Eurimages, Movistar+, Proximus, Televisión Española, Ukbar Filmes, Wallimage, ","Belgium, France, Portugal, Spain, United Kingdom, United States of America, "
"13",0,0,"Solo: A Star Wars Story","Through a series of daring escapades deep within a dark and dangerous criminal underworld, Han Solo meets his mighty future copilot Chewbacca and encounters the notorious gambler Lando Calrissian.",68.64972,42,"2018-05-23","Released",135,"Lucasfilm, Walt Disney Pictures, Allison Shearmur Productions, Imagine Entertainment, ","United States of America, "
"14",0,0,"Yomeddine","A Coptic leper and his orphaned apprentice leave the confines of the leper colony for the first time and embark on a journey across Egypt to search for what is left of their families.",3.393895,0,"2018-05-09","Post Production",97,"Desert Highway Pictures, Film Clinic, ","Austria, Egypt, United States of America, "
"15",0,0,"The Mystery of Burma: Beyond the Dote-Hta-Waddy","",1.451396,0,"2018-05-04","Released",NA,"Golden Hour Entertainment, Arkar Production, ","Myanmar, "
"16",300000000,1820052471,"Avengers: Infinity War","As the Avengers and their allies have continued to protect the world from threats too large for any one hero to handle, a new danger has emerged from the cosmic shadows: Thanos. A despot of intergalactic infamy, his goal is to collect all six Infinity Stones, artifacts of unimaginable power, and use them to inflict his twisted will on all of reality. Everything the Avengers have fought for has led up to this moment - the fate of Earth and existence itself has never been more uncertain.",483.692239,3893,"2018-04-25","Released",149,"Walt Disney Pictures, Marvel Studios, ","United States of America, "
"17",NA,NA,NA,NA,NA,NA,NA,NA,NA,", , ",", , "
"18",NA,NA,NA,NA,NA,NA,NA,NA,NA,", , ",", , "
"19",NA,NA,NA,NA,NA,NA,NA,NA,NA,", , ",", , "
"20",NA,NA,NA,NA,NA,NA,NA,NA,NA,", , ",", , "
"21",NA,NA,NA,NA,NA,NA,NA,NA,NA,", , ",", , "
"22",NA,NA,NA,NA,NA,NA,NA,NA,NA,", , ",", , "
"23",NA,NA,NA,NA,NA,NA,NA,NA,NA,", , ",", , "
"24",NA,NA,NA,NA,NA,NA,NA,NA,NA,", , ",", , "
"25",NA,NA,NA,NA,NA,NA,NA,NA,NA,", , ",", , "
"26",NA,NA,NA,NA,NA,NA,NA,NA,NA,", , ",", , "
"27",NA,NA,NA,NA,NA,NA,NA,NA,NA,", , ",", , "
"28",NA,NA,NA,NA,NA,NA,NA,NA,NA,", , ",", , "
"29",NA,NA,NA,NA,NA,NA,NA,NA,NA,", , ",", , "
"30",NA,NA,NA,NA,NA,NA,NA,NA,NA,", , ",", , "
"31",NA,NA,NA,NA,NA,NA,NA,NA,NA,", , ",", , "
"32",NA,NA,NA,NA,NA,NA,NA,NA,NA,", , ",", , "
"33",NA,NA,NA,NA,NA,NA,NA,NA,NA,", , ",", , "
"34",NA,NA,NA,NA,NA,NA,NA,NA,NA,", , ",", , "
"35",NA,NA,NA,NA,NA,NA,NA,NA,NA,", , ",", , "
"36",40000000,225735664,"Paddington 2","Paddington, now happily settled with the Brown family and a popular member of the local community, picks up a series of odd jobs to buy the perfect present for his Aunt Lucy's 100th birthday, only for the gift to be stolen.",17.16706,392,"2017-11-09","Released",103,"Heyday Films, StudioCanal, ","France, United Kingdom, "
"37",0,0,"Trolls Holiday","When the eternally optimistic Poppy, queen of the Trolls, learns that the Bergens no longer have any holidays on their calendar, she enlists the help of Branch and the rest of the gang on a delightfully quirky mission to fix something that the Bergens don't think is broken.",10.960594,81,"2017-11-24","Released",26,"NBC, DreamWorks Animation, ",", , "
"38",0,0,"The Fixies: Top Secret","The Fixies are little creatures that, unseen by humans, help them maintain their appliances – and generally make sure things don’t fall apart… Until an unexpected occurrence of gargantuan proportions threatens to reveal the Fixies’ existence!",2.16628,0,"2017-10-28","Released",80,"Aeroplane JSC, ","Russia, "
"39",500000000,657924295,"Justice League","Fuelled by his restored faith in humanity and inspired by Superman's selfless act, Bruce Wayne and Diana Prince assemble a team of metahumans consisting of Barry Allen, Arthur Curry and Victor Stone to face the catastrophic threat of Steppenwolf and the Parademons who are on the hunt for three Mother Boxes on Earth.",49.608365,4552,"2017-11-15","Released",120,"DC Comics, DC Entertainment, RatPac-Dune Entertainment, Warner Bros. Pictures, Cruel & Unusual Films, Atlas Entertainment, Lensbern Productions, ","United States of America, "
"40",0,0,"To the Sky for a Dream","A story about a young boy who dreams about airplanes.",0.631886,0,"2017-10-26","Released",94,"Lenkino, ","Russia, "
"41",175000000,800526015,"Coco","Despite his family’s baffling generations-old ban on music, Miguel dreams of becoming an accomplished musician like his idol, Ernesto de la Cruz. Desperate to prove his talent, Miguel finds himself in the stunning and colorful Land of the Dead following a mysterious chain of events. Along the way, he meets charming trickster Hector, and together, they set off on an extraordinary journey to unlock the real story behind Miguel's family history.",88.585844,4490,"2017-10-27","Released",105,"Pixar, ","United States of America, "
"42",0,0,"Olaf's Frozen Adventure","Olaf is on a mission to harness the best holiday traditions for Anna, Elsa, and Kristoff.",13.158388,593,"2017-10-27","Released",23,"Walt Disney Pictures, ","United States of America, "
"43",180000000,853977126,"Thor: Ragnarok","Thor is imprisoned on the other side of the universe and finds himself in a race against time to get back to Asgard to stop Ragnarok, the prophecy of destruction to his homeworld and the end of Asgardian civilization, at the hands of an all-powerful new threat, the ruthless Hela.",198.510611,6372,"2017-10-25","Released",130,"Marvel Studios, Walt Disney Pictures, ","United States of America, "
"44",0,0,"Night Trip","",0.099259,0,"2017-10-10","Released",NA,", , ","Canada, "
"45",10000000,0,"The Little Vampire 3D","Based on the characters from the bestselling novels by Angela Sommer-Bodenburg, tells the story of Rudolph, a thirteen year old vampire, whose clan is threatened by a notorious vampire hunter. He meets Tony, a mortal of the same age, who is fascinated by old castles, graveyards and - vampires. Tony helps Rudolph in an action and humor packed battle against their adversaries, together they save Rudolph's family and become friends.",4.287931,11,"2017-10-04","Released",83,"A. Film, Ambient Entertainment GmbH, Cool Beans, Rothkirch Cartoon Film, ","Netherlands, United Kingdom, Germany, Denmark, "
"46",0,0,"Romantic Road","An  English couple, a leading London lawyer and his wife re-define later life by motoring rural India in their battered 1936 Rolls Royce, falling into company with tea-wallahs and maharajahs, dodging tribal conflicts and battling with border-officials to get to a photography conference/human rights festival in Bangladesh.",0.086763,0,"2017-09-28","Released",80,", , ","United Kingdom, Canada, Bangladesh, India, Nepal, "
"47",0,60330833,"My Little Pony: The Movie","A new dark force threatens Ponyville, and the Mane 6 – Twilight Sparkle, Applejack, Rainbow Dash, Pinkie Pie, Fluttershy and Rarity – embark on an unforgettable journey beyond Equestria where they meet new friends and exciting challenges on a quest to use the magic of friendship and save their home.",12.414584,99,"2017-10-05","Released",99,"Lionsgate, DHX Media, Hasbro Studios, Allspark Pictures, ","Canada, United States of America, "
"48",15000000,13767037,"Salyut-7","Salyut 7, the Soviet space station, was orbiting Earth in unmanned regime. Suddenly it stops responding to signals from the Ground Control. Fall of this station, the pride of soviet science and space industry, would not only damage the image of the country, but also bring upon tragedy, probably with loss of life. Astronauts have to be sent to the station to find what caused the breakdown and prevent the catastrophe. However, nobody has ever docked an uncontrolled object in space. To this day this is the most technically complicated mission in the history of the world of space navigation.",16.403481,64,"2017-09-22","Released",106,"Vita Aktiva, CTB Film Company, Lemon Films Studio, Globus-film, ","Russia, "
"49",104000000,410902662,"Kingsman: The Golden Circle","When an attack on the Kingsman headquarters takes place and a new villain rises, Eggsy and Merlin are forced to work together with the American agency known as the Statesman to save the world.",32.00462,3504,"2017-09-20","Released",141,"Shangri-La Entertainment, Marv Films, TSG Entertainment, 20th Century Fox, ","United Kingdom, United States of America, "
"50",70000000,123081555,"The LEGO Ninjago Movie","Six young ninjas are tasked with defending their island home of Ninjago. By night, they’re gifted warriors using their skill and awesome fleet of vehicles to fight villains and monsters. By day, they’re ordinary teens struggling against their greatest enemy....high school.",10.292947,239,"2017-09-21","Released",101,"Warner Bros. Animation, LEGO System A/S, Lin Pictures, Lord Miller, Vertigo Entertainment, Warner Animation Group, ","Denmark, United States of America, "
"51",35000000,62832209,"The Mountain Between Us","Stranded after a tragic plane crash, two strangers must forge a connection to survive the extreme elements of a remote snow covered mountain. When they realize help is not coming, they embark on a perilous journey across the wilderness.",14.158505,729,"2017-10-05","Released",109,"Chernin Entertainment, 20th Century Fox, ","United States of America, "
"52",15100000,0,"Hochelaga, Land of Souls","Mohawk archaeologist Baptiste Asigny engages in a search for his ancestors following a tragic terrain slump in the Percival Molson Stadium.",3.420215,0,"2017-09-09","Released",100,"Max Films Productions, ","Canada, "
"53",0,0,"The Wild Boys","At the beginning of the 20th century, on the island of La Réunion, five adolescents of good families enamoured with the occult, commit a savage crime. A Dutch Captain takes them in charge for a repressive cruise on a haunted, dilapidated sailboat. Exhausted by the Captain’s methods, the five boys prepare to mutiny. Their port of call is a supernatural island with luxuriant vegetation and bewitching powers that holds a disturbing secret.",1.4965,13,"2018-02-28","Released",111,"Ecce Films, ","France, "
"54",0,0,"<U+D638><U+BE44><U+C640> <U+B3D9><U+D654><U+B098><U+B77C> <U+B300><U+BAA8><U+D5D8>","",0.083613,0,"2017-09-05","Released",NA,", , ","Japan, "
"55",55000000,29815215,"Hostiles","A legendary Native American-hating Army captain nearing retirement in 1892 is given one last assignment: to escort a Cheyenne chief and his family through dangerous territory back to his Montana reservation.",23.218155,462,"2017-12-22","Released",133,"Entertainment Studios Motion Pictures, Waypoint Entertainment, Grisbi Productions, Le, ","United States of America, "
"56",8000000,1413034,"Lean on Pete","Charley, a teen living with his single father, finds work caring for an aging racehorse named Lean on Pete. When he learns Pete is bound for slaughter, the two embark on an odyssey across the new American frontier in search of a place to call home.",7.835794,33,"2018-03-30","Released",119,"The Bureau, Film4 Productions, BFI Film Fund, A24, ","United Kingdom, United States of America, "
"57",80000000,2600000,"Inhumans: The First Chapter","After the Royal Family of Inhumans is splintered by a military coup, they barely escape to Hawaii where their surprising interactions with the lush world and humanity around them may prove to not only save them, but Earth itself.",3.831853,36,"2017-09-01","Released",80,"ABC Studios, IMAX, ","United States of America, "
"58",0,0,"Clank: Red Mosaic","The deceased friend and mentor, Doctor Alfred, leaves behind a posthumous trail for Clank to follow. With little time to spare he must figure out the mystery behind the disappearance of the ""Red Mosaic"".",2.195811,0,"2017-12-25","Released",111,", , ",", , "
"59",0,0,"Lapland Odyssey 3","In the third instalment of the franchise, Janne embarks on an epic hike, a journey of self-discovery. His dreams of a tranquil retreat into nature are quickly shattered however, when Räihänen and Kämäräinen both decide to come along for the trip. Meanwhile Janne’s spouse Inari gets the chance to go back to work, but only if she can prove she’s “management material” and a real leader. Inari enters the Swamp Soccer tournament, where to her horror she finds out her ex Little Mikko is also competing.",1.349806,4,"2017-08-23","Released",103,"Yellow Film & TV, ","Finland, "
"60",0,0,"Goodbye Balthazar","Despite being broken in a snowstorm, a rickety scarecrow wakes to find a beautiful shell. But as the sound of the sea inside mesmerises him, the shell is stolen by a crow. Setting out to reclaim it, the scarecrow embarks on a poignant journey in this wonderful, but possibly saddest animation you’ll ever see. He just wants his shell back!",0.082448,0,"2017-08-22","Released",10,", , ","Switzerland, "
"61",0,0,"Jungle","A mysterious guide escorts an enthusiastic adventurer and his friend into the Amazon jungle, but their journey turns into a terrifying ordeal as the darkest elements of human nature and the deadliest threats of the wild force them to fight for survival.",13.2022,479,"2017-10-20","Released",113,"Screen Queensland, Screen Australia, Babber Films, Cutting Edge Group, Melbourne International Film Festival, ","Australia, Colombia, "
"62",40000000,65146020,"The Nut Job 2: Nutty by Nature","When the evil mayor of Oakton decides to bulldoze Liberty Park and build a dangerous amusement park in its place, Surly Squirrel and his ragtag group of animal friends need to band together to save their home, defeat the mayor, and take back the park.",7.80644,175,"2017-08-11","Released",91,"Gulfstream Pictures, Red Rover International, ToonBox Entertainment, Open Road Films, ","United States of America, Canada, South Korea, "
"63",0,0,"Sightings","A dysfunctional family under suspicion of murder after three bodies mysteriously appear on their ranch are terrorised by what they can only describe as Bigfoot.",2.844795,3,"2017-10-21","Released",88,"High Octane Pictures, BrighterMoon Productions, ","United States of America, "
"64",0,0,"Iceman","The Ötztal Alps, more than 5300 years ago. A Neolithic clan has settled near a creek. It is their leader Kelab's responsibility to be the keeper of the group's holy shrine Tineka. While Kelab is hunting, the settlement is attacked. The members of the tribe are brutally murdered, amongst them Kelab's wife and son, only one newborn survives - and Tineka is gone. Blinded by pain and fury, Kelab is out for one thing alone - vengeance.",0.765398,5,"2017-11-30","Released",96,"Lucky Bird Pictures, Echo Films, ","Austria, Germany, Italy, "
"65",0,0,"Bluehilda","Bluehilda is raring to get out into the real world, but first she’s pretty hungry… She decides to hunt the ever-elusive Copper-back Raboon for dinner, and is dying to test her ten years of magical training in order to catch it. However, Francis flies off into the deadly Furest alone, and Bluehilda must go after him. She gets an even bigger test of her magic than she anticipated when her precious pug bat is caught by the Unbearables! Bluehilda must face the deadly trio of witch hunters in order to save Francis! Will Bluehilda be up to the test? Or will Francis end up as a trophy?",0.142709,0,"2017-07-28","Released",8,"Titmouse, ","United States of America, "
"66",0,0,"The Jungle Bunch","Maurice may look like a penguin - but he's a real tiger inside! Raised by a tigress, he's the clumsiest kung-fu master ever. Along with his friends, The Jungle Bunch, he intends to maintain order and justice in the jungle, as his mother did before he. But Igor, an evil koala, wants to destroy the jungle once and for all—helped by his army of silly baboons.",2.894181,15,"2017-07-26","Released",98,", , ","France, "
"67",0,0,"Junk Head","It is a real SF feature film used in stop motion technique",0.103375,1,"2017-07-23","Released",115,", , ",", , "
"68",0,0,"The Taker's Crown","The legendary King Wiglaf must assemble the most unlikely team to find The Taker's crown of power before Tome, the Titan thief, claims it and brings destruction upon humanity.",0.101761,1,"2017-07-20","Released",86,"WhiteShore Films, ","United States of America, "
"69",0,0,"Zerzura","",0.066689,0,"2017-07-19","Released",NA,"Imouhar Studio, Sahel Sounds, ",", , "
"70",197471676,225874228,"Valerian and the City of a Thousand Planets","In the 28th century, Valerian and Laureline are special operatives charged with keeping order throughout the human territories. On assignment from the Minister of Defense, the two undertake a mission to Alpha, an ever-expanding metropolis where species from across the universe have converged over centuries to share knowledge, intelligence, and cultures. At the center of Alpha is a mysterious dark force which threatens the peaceful existence of the City of a Thousand Planets, and Valerian and Laureline must race to identify the menace and safeguard not just Alpha, but the future of the universe.",26.864067,2720,"2017-07-20","Released",136,"BNP Paribas, Belga Films, River Road Entertainment, Grive Productions, EuropaCorp, Universum Film (UFA), Fundamental Films, Gulf Film, Novo Pictures, TF1 Films Production, Orange Studio, ","Belgium, Canada, China, France, Germany, United Arab Emirates, United Kingdom, United States of America, "
"71",0,0,"Girl in Flight","The story of 11-year-old Silvia whose life at home is consumed by her mother’s clinical depression. When no one will take the time to fulfill her dream to visit Rome, she runs away, determined to see it for herself. On a train she meets a Roma girl, Emina, and begins following her through the streets of Rome to her gypsy camp.",0.1515,0,"2017-07-17","Released",80,", , ",", , "
"72",0,0,"Maze","Inspired by the true events of the infamous 1983 prison breakout of 38 IRA prisoners from HMP Maze, which was to become the biggest prison escape in Europe since World War II.",3.657805,15,"2017-09-22","Released",93,"Filmgate Films, Mammoth Films, Cyprus Avenue Films, ","Germany, Ireland, United Kingdom, Sweden, "
"73",0,0,"Coyote: The Mike Plant Story","Mike Plant burned his way through life by an unconventional set of rules, leading him to dark corners of the world before finding his passion and the pinnacle of an extreme sport that celebrates individuals who race around the world on a sailboat... a true American adventure story.",0.076189,0,"2017-07-13","Released",105,"Sparkplug Films, Story Developing..., ",", , "
"74",0,0,"Pokémon the Movie: I Choose You!","This is the story of how Ash and Pikachu first met. At first, Pikachu was disobedient towards Ash, but Ash only wanted to be friends with Pikachu. On the day they set out from Pallet Town, both of them saw a Ho-Oh flying and they made a vow to meet it.",10.268253,179,"2017-07-15","Released",98,"The Pokémon Company, ","Japan, "
"75",0,0,"JoJo's Bizarre Adventure: Diamond Is Unbreakable - Chapter 1","In a world where people can wield psychic avatars, a family must unite to track down a serial killer.",6.212213,12,"2017-08-04","Released",119,"Toho Company, Ltd., Warner Bros. Pictures, ","Japan, "
"76",8144,0,"To the Mountain","The story of five hikers who find meaning in their lives after the beautiful yet harsh surroundings force them to connect with one another.",0.283347,0,"2018-02-02","Released",76,", , ",", , "
"77",0,0,"Moss","In this Southern Gothic coming-of-age tale, an isolated and troubled young man, Moss, meets a mysterious and beautiful hiker on the banks of the river near his home on his eighteenth birthday. She guides him on a journey of self-discovery and helps him overcome the tragic death of his mother and the shadow it has cast on his relationship with his detached father.",0.084503,0,"2017-06-21","Post Production",81,"Sunshine Pictures, ","United States of America, "
"78",60000,0,"The Cold Side of the Sun","Antu, a young screenwriter journeys into the fictional worlds of his screenplays.",0.089093,0,"2017-06-17","Released",80,"BlandKrause Studios, ","Chile, United States of America, "
"79",217000000,605425157,"Transformers: The Last Knight","Autobots and Decepticons are at war, with humans on the sidelines. Optimus Prime is gone. The key to saving our future lies buried in the secrets of the past, in the hidden history of Transformers on Earth.",22.872991,2319,"2017-06-16","Released",149,"Tom DeSanto/Don Murphy Production, Ian Bryce Productions, Huahua Media, Di Bonaventura Pictures, Hasbro, Paramount Pictures (Canada), ","Canada, United States of America, "
"80",0,0,"Rock","The word ""rok"" in Russian means both rock music and fate. The film's heroes, who want to conquer the musical Olympus of Moscow, are accompanied by both. This troika is not even a group yet, not a team, and probably not even friends. But that's at the beginning. The further the heroes leave home, the more dangerous their adventures and the people they met on the way become, and the more strongly the children change inside. The film is a journey, a search of the self, where the road to the dream is the greatest, most dangerous and unforgettable adventure in the life of the young provincial musicians.",0.623302,2,"2017-10-06","Released",87,"VGIK Debut, ","Russia, "
"81",0,0,"Mountain","An epic cinematic and musical collaboration between Sherpa filmmaker Jennifer Peedom and the Australian Chamber Orchestra, that explores humankind's fascination with high places. Narrated by Willem Dafoe.",5.089608,10,"2017-09-01","Released",70,"camp 4 Collective, Stranger Than Fiction, Sherpas Cinema, ","Australia, "
"82",0,0,"Animal Crackers","A family must use a magical box of Animal Crackers to save a rundown circus from being taken over by their evil uncle Horatio P. Huntington.",3.994114,5,"2017-09-01","Released",94,"China Film Co., Blue Dream Studios, Beijing Wen Hua Dong Run Investment Co., ","China, United States of America, Spain, "
