"","budget","revenue","title","overview","popularity","vote_count","release_date","status","runtime","production_companies","production_countries"
"143",0,0,"White Sun","Young Pooja lives with her mother in a village in Nepal. Though saddened by the death of her grandfather, she is secretly thrilled at the prospect of meeting the man she hopes may be her father — Chandra, a former Maoist guerrilla who is returning home after a decade-long civil conflict.",0.353482,5,"2016-09-07","Released",87,"Worley Works, Aadi Productions, Louverture Films, Bertha Foundation, Doha Film Institute, Film Kitchen, Hubert Bals Fund, Mila Productions, Netherlands Fund for Film, ","Nepal, Netherlands, United States of America, Qatar, "
"144",0,0,"Demon Hunter","A young girl tormented by the tragedies of her past is brought in for questioning by the police over the death of a man, who she claims to be a demon. Detective Beckett realizes this is the same girl he made a broken promise to seven years ago that he'd find the monster that raped and murdered her 12 year old sister.",0.271213,2,"2016-09-06","Released",85,"Ill Eagle Films, Constant Motion Pictures, Full Metal Films, ","Ireland, United States of America, "
"145",0,0,"The Northlander","In the year 2961, the time is after humanity and nature has recovered the land. A hunter named Cygnus is called to rise above his duty. He provides for Last Arc, a once nomadic band of survivors in need of food and water that is now growing scarce. The answer must be found before a group of outlandish Heretics descend upon them. Cygnus must voyage across the treacherous landscape to defend his people. Sent by Nova, the matriarch of the band, she acts based on her vision for Cygnus to find a seed of hope. The future of Last Arc is for him to discover, Cygnus ventures into a hostile landscape in search of an answer for his people. On this journey of encountering many traps and dangers, Cygnus discovers what has been hunting him is his identity.",3.207054,7,"2016-10-14","Released",98,"MANIFOLD PICTURE, ","Canada, "
"146",0,0,"Time Raiders","Time Raiders is based on the online novel series Daomu Biji written by Xu Lei.  It tells the story of explorers searching for the secrets of immortality in ancient tombs",0.501965,5,"2016-08-18","Released",123,"Magnum Films, Chop Flix, ","China, Hong Kong, "
"147",60000000,69929545,"Kubo and the Two Strings","Kubo mesmerizes the people in his village with his magical gift for spinning wild tales with origami. When he accidentally summons an evil spirit seeking vengeance, Kubo is forced to go on a quest to solve the mystery of his fallen samurai father and his mystical weaponry, as well as discover his own magical powers.",17.718356,1352,"2016-08-18","Released",102,"Focus Features, Laika Entertainment, ","United States of America, "
"148",0,0,"The Train of Salt and Sugar","In 1989, Mozambique is a country ruined by civil war. The train that connects Nampula to Malawi is the only hope for people willing to risk their lives to exchange a few bags of salt for sugar. Running slowly over sabotaged tracks, the journey is filled with obstacles and violence. Mariamu, a frequent traveler, shares her trip with her friend Rosa, a nurse who is going to her new hospital, living the reality of war for the first time, Lieutenant Taiar, who only knows the reality of his military life, and another soldier, Salomão, with whom he doesn’t get along. Amongst bullets and laughter, stories of love and war unfold as the train advances towards the next stop.",0.11767,1,"2016-08-10","Released",93,"Ukbar Filmes, ","Mozambique, France, Portugal, South Africa, Brazil, "
"149",0,0,"Dark Skull","Elder Mamaní’s father has died, and it looks as if young Elder couldn’t care less, even though he has no one to take care of him now. He goes to live with his grandmother in the outskirts of the mining city, Huanuni, where Francisco, his godfather, gives him a job at the mine. But it doesn’t take long for Elder, who cares more about getting high and wandering through dangerous alleys at night, to mess it up. But he soon finds out about a dark secret regarding Francisco’s involvement in his father’s death…",0.180786,1,"2016-08-09","Released",80,"Socavón Cine, ","Bolivia, Qatar, "
"150",0,0,"The Ornithologist","Stranded along a sublime river fjord in northern Portugal, a hunky ornithologist is subjected to a series of brutal and erotic Stations-of-the-Cross-style tests.",2.623839,25,"2016-10-05","Released",118,"Itaca Films, Blackmaria, House on Fire, ","Brazil, Portugal, France, "
"151",65000000,143695338,"Pete's Dragon","Pete is a mysterious 10-year-old with no family and no home who claims to live in the woods with a giant, green dragon named Elliott. With the help of Natalie, an 11-year-old girl whose father Jack owns the local lumber mill, forest ranger Grace sets out to determine where Pete came from, where he belongs, and the truth about this dragon.",12.995466,932,"2016-08-10","Released",102,"Walt Disney Pictures, ","United States of America, "
"152",0,0,"L.I.P.S.","The bravest adventurer at The League of Interplanetary Process Servers attempts to deliver 30 subpoenas throughout the universe in only ten minutes.",0.029453,0,"2016-07-29","Released",22,", , ","United States of America, "
"153",15000000,77947607,"Shin Godzilla","From the mind behind Evangelion comes a hit larger than life.  When a massive, gilled monster emerges from the deep and tears through the city, the government scrambles to save its citizens.  A rag-tag team of volunteers cuts through a web of red tape to uncover the monster's weakness and its mysterious ties to a foreign superpower.  But time is not on their side - the greatest catastrophe to ever befall the world is about to evolve right before their very eyes.",7.293837,240,"2016-07-29","Released",120,"Cine Bazar, Toho Pictures, ","Japan, "
"154",0,0,"Star Wars Rebels: Steps Into Shadow","Ezra, having grown in power, leads a mission to break the crew's old friend Hondo Ohnaka out of prison. Meanwhile, Grand Admiral Thrawn -- a master Imperial strategist -- has vowed to dismantle and destroy the growing rebellion.",0.19007,3,"2016-07-16","Released",44,", , ",", , "
"155",0,0,"Manifest Destiny: The Lewis & Clark Musical Adventure","This musical comedy weaves together sharp satire and heartfelt storytelling into a grand adventure. Through ten original songs, the film follows gruff explorer William Clark and his naturalist companion Meriwether Lewis as they blaze a trail to the Western waters. Along the way, they encounter the wise Sacagawea, battle the elements, and find that President Thomas Jefferson has some surprises up his sleeve.",0.199258,0,"2016-07-13","Released",91,"Parisi Pictures, New Renaissance Pictures, ",", , "
"156",185000000,343471816,"Star Trek Beyond","The USS Enterprise crew explores the furthest reaches of uncharted space, where they encounter a mysterious new enemy who puts them and everything the Federation stands for to the test.",18.113765,3394,"2016-07-07","Released",122,"Skydance Media, Paramount, Bad Robot, Perfect Storm Entertainment, Alibaba Pictures Group, Sneaky Shark, Huahua Media, ","United States of America, "
"157",68,0,"Spring Break Zombie Massacre","In a world where the zombie apocolypse is an unquestioned reality, truly righteous brothers tackle love, loss, and life lessons amid the backdrop of an epic spring break.",0.032872,0,"2016-07-07","Released",NA,"Rock On Go Wild, ","United States of America, "
"158",0,0,"Sheborg Massacre","When an alien fugitive crash lands into a local puppy farm and begins turning people into machines that feed on puppy flesh, Dylan and her BFF Eddie have to decide whether or not to take on the SheBorg menace, and save the world.",0.57237,6,"2016-07-04","Released",90,", , ",", , "
"159",840000,0,"Porta dos Fundos: Contrato Vitalício","Two friends, Michael Director and actor Rodrigo, receive the grand prize of the jury in a trendy international film festival. After too much drink, Rodrigo signed a contract to participate in the upcoming film of the filmmaker. Miguel disappears and reappears ten years later with a proposal to make a long delirious. Rodrigo is already famous and distrusts the health director. To make matters worse, you realize that to honor the contract will be required to make a film that can destroy not only his career but his life.",0.860896,22,"2016-06-30","Released",90,"Telecine Productions, Paramount, Paris Filmes, Porta dos Fundos, ","Brazil, "
"160",180000000,356743061,"The Legend of Tarzan","Tarzan, having acclimated to life in London, is called back to his former home in the jungle to investigate the activities at a mining encampment.",29.211848,3292,"2016-06-29","Released",109,"Village Roadshow Pictures, Dark Horse Entertainment, Beagle Pug Films, Jerry Weintraub Productions, RatPac-Dune Entertainment, Riche Productions, ","Canada, United Kingdom, United States of America, "
"161",165000000,389681935,"Independence Day: Resurgence","We always knew they were coming back. Using recovered alien technology, the nations of Earth have collaborated on an immense defense program to protect the planet. But nothing can prepare us for the aliens’ advanced and unprecedented force. Only the ingenuity of a few brave men and women can bring our world back from the brink of extinction.",17.816806,3183,"2016-06-22","Released",120,"Centropolis Entertainment, Stereo D, TSG Entertainment, 20th Century Fox, ","United States of America, "
"162",0,0,"Bliss!","Tasha Robson, 16, has run away from home! While she rides the waves aboard the large ferry heading from South Shields, England to Scandinavia in search of her unknown father, ""The Viking"" all is less than calm in the Robson household.",0.066228,1,"2016-06-19","Released",95,"Goldfinch Entertainment, Premiere Picture, GSP Studios, Sugar & Water Films, ","Norway, United Kingdom, "
"163",105000000,408579038,"Ice Age: Collision Course","Set after the events of Continental Drift, Scrat's epic pursuit of his elusive acorn catapults him outside of Earth, where he accidentally sets off a series of cosmic events that transform and threaten the planet. To save themselves from peril, Manny, Sid, Diego, and the rest of the herd leave their home and embark on a quest full of thrills and spills, highs and lows, laughter and adventure while traveling to exotic new lands and encountering a host of colorful new characters.",34.304443,1632,"2016-06-23","Released",100,"Blue Sky Studios, Twentieth Century Fox Animation, ","United States of America, "
"164",75000000,875457937,"The Secret Life of Pets","The quiet life of a terrier named Max is upended when his owner takes in Duke, a stray whom Max instantly dislikes.",6.903046,4224,"2016-06-18","Released",87,"Universal Pictures, Fuji Television Network, Dentsu, Illumination Entertainment, ","United States of America, "
"165",0,0,"Land of the Little People","Four young kids who live in a village of military officers families, form a small gang. An old abandoned army base, located in the surrounding fields, turns into their camp. A war begins and most men are drafted. When the kids return to their camp they discover two soldiers who deserted their units, using their camp as a hideout...",0.061034,0,"2016-06-13","Released",83,"White Bird Films, Fresco Films, Noescapeteam, Royal Rat Productions, ","Israel, Palestinian Territory, "
"166",0,0,"Rico Shade","In a comic book like world, a mysterious vigilante protects the streets from evil. When a villain named ""The Face"" commits an evil act, it is up to Rico Shade to stop him.",0.136969,2,"2016-06-10","Released",5,", , ","United States of America, "
"167",200000000,1028570889,"Finding Dory","Dory is reunited with her friends Nemo and Marlin in the search for answers about her past. What can she remember? Who are her parents? And where did she learn to speak Whale?",18.056297,5764,"2016-06-16","Released",97,"Pixar, ","United States of America, "
"168",0,0,"Dealer","Kelly is an easily scared blackjack dealer who gets a huge surprise from his roommate Trevor. Trevor is a drug dealer and can’t finish his rounds for the day. His boss a mysterious figure known only as X offers Kelly a plan – Deal or Die. This takes him to four separate drug deals over the course of a day and night in Las Vegas. Will Kelly survive?",0.039837,0,"2016-06-07","Released",106,", , ","United States of America, "
"169",90000000,334901337,"Now You See Me 2","One year after outwitting the FBI and winning the public’s adulation with their mind-bending spectacles, the Four Horsemen resurface only to find themselves face to face with a new enemy who enlists them to pull off their most dangerous heist yet.",30.974775,4730,"2016-06-02","Released",129,"Summit Entertainment, Lionsgate, K/O Paper Products, TIK Films, ","Canada, China, United Kingdom, United States of America, "
"170",300000,0,"Beyond the Gates","Two estranged brothers reunite at their missing father's video store to liquidate the property and sell off his assets. As they dig through the store, they find a VCR board game dubbed 'Beyond The Gates' that holds a connection to their father's disappearance and deadly consequences for anyone who plays it.",4.570292,82,"2016-06-02","Released",84,"Lodger Films, Easy Open Productions, Thunder Warrior Productions, Destroy All Entertainment, ","United States of America, "
"171",135000000,245623848,"Teenage Mutant Ninja Turtles: Out of the Shadows","After supervillain Shredder escapes custody, he joins forces with mad scientist Baxter Stockman and two dimwitted henchmen, Bebop and Rocksteady, to unleash a diabolical plan to take over the world. As the Turtles prepare to take on Shredder and his new crew, they find themselves facing an even greater evil with similar intentions: the notorious Krang.",13.020287,1346,"2016-06-01","Released",112,"5150 Action, Paramount, Nickelodeon Movies, Platinum Dunes, Gama Entertainment Partners, ","United States of America, "
"172",0,0,"MESSiAH","In a playful collision of cultures, a hapless Irishman and his Parisian girlfriend get more than they bargained for when they encounter a particularly mischievous stranger in the spectacular Australian wilderness.",0.053512,0,"2016-06-01","Released",15,", , ","Australia, "
"173",250,0,"Roxy and the Mine","An adventurer and a photographer investigate an abandoned gold mine in southern Oregon.",0.03424,0,"2016-05-31","Post Production",13,"PAD productions, ","United States of America, "
"174",170000000,299370084,"Alice Through the Looking Glass","In the sequel to Tim Burton's ""Alice in Wonderland"", Alice Kingsleigh returns to Underland and faces a new adventure in saving the Mad Hatter.",12.964275,2523,"2016-05-25","Released",113,"Legend3D, Walt Disney Pictures, Roth Films, Team Todd, Tim Burton Productions, ","United Kingdom, United States of America, "
"175",160000000,433677183,"Warcraft","The peaceful realm of Azeroth stands on the brink of war as its civilization faces a fearsome race of invaders: orc warriors fleeing their dying home to colonize another. As a portal opens to connect the two worlds, one army faces destruction and the other faces extinction. From opposing sides, two heroes are set on a collision course that will decide the fate of their family, their people, and their home.",15.983232,3045,"2016-05-25","Released",123,"Legendary Entertainment, Universal Pictures, Atlas Entertainment, Blizzard Entertainment, ","Canada, China, Japan, United States of America, "
"176",0,0,"Dragón","",0.122212,1,"2016-05-16","Released",NA,", , ","Spain, "
"177",140000000,183345589,"The BFG","The BFG is no ordinary bone-crunching giant. He is far too nice and jumbly. It's lucky for Sophie that he is. Had she been carried off in the middle of the night by the Bloodbottler, or any of the other giants—rather than the BFG—she would have soon become breakfast. When Sophie hears that the giants are flush-bunking off to England to swollomp a few nice little chiddlers, she decides she must stop them once and for all. And the BFG is going to help her!",13.254985,1441,"2016-06-01","Released",120,"Kennedy/Marshall Company, The, Walt Disney Pictures, Amblin Entertainment, Reliance Entertainment, Walden Media, ","India, United States of America, "
"178",73000000,349779543,"The Angry Birds Movie","An island populated entirely by happy, flightless birds or almost entirely. In this paradise, Red, a bird with a temper problem, speedy Chuck, and the volatile Bomb have always been outsiders. But when the island is visited by mysterious green piggies, it’s up to these unlikely outcasts to figure out what the pigs are up to.",9.957043,1344,"2016-05-11","Released",97,"Sony Pictures Animation, Columbia Pictures, Rovio Entertainment, Rovio Mobile, Rovio Animation, ","Finland, United States of America, "
"179",178000000,543934787,"X-Men: Apocalypse","After the re-emergence of the world's first mutant, world-destroyer Apocalypse, the X-Men must unite to defeat his extinction level plan.",42.067847,6266,"2016-05-18","Released",144,"The Donners' Company, Marvel Entertainment, Bad Hat Harry Productions, TSG Entertainment, 20th Century Fox, Genre Films, ","United States of America, "
"180",40,0,"Leste Oeste","Ezequiel, a former professional car racer, returns to his hometown after 15 years to compete in his last race. He finds Stela, an old affair; Angelo, the family patriarch, as well as Pedro, a 16 year-old boy who dreams of being a driver.",0.033235,0,"2016-05-07","Released",86,"Kinopus Audiovisual, ","Brazil, "
"181",0,0,"Sheep & Wolves","In a magical faraway land, in a picturesque little village nestled among green meadows and rolling hills, lives a flock of carefree sheep. But their pastoral and stress-free life is interrupted when a pack of wolves sets up camp in the nearby ravine.",3.857246,21,"2016-04-28","Released",97,"CTB Film Company, Wizart Animation, ","Russia, "
"182",5500,0,"Aster and Sidney","Aster and Sidney are survivors. What destroyed their world is unknown, but what keeps them alive is a constant state of vigilance. Former strangers, they have bonded together against the threat of those who would harm them for the food in their packs or the shoes on their feet.",0.05075,0,"2016-04-28","Released",20,", , ","United States of America, "
"183",0,116873,"Spark: A Space Tail","Spark, a teenage monkey and his friends, Chunk and Vix, are on a mission to regain Planet Bana - a kingdom overtaken by the evil overlord Zhong.",5.316268,23,"2017-04-14","Released",97,"Shanghai Hoongman Technology Co., Gulfstream Pictures, Red Rover International, ToonBox Entertainment, ","Canada, South Korea, "
"184",0,0,"The Lost City","In the Aysén region dwell a population of 90000 isolated souls sharing the harsh landscapes of an area about the size of England. Here where beauty seems to be on first-name terms with fear and danger,in a place where the immensity of nature can never be dominated, the setting hesitates, along the expanses, between sparkling colours and the black and white of the snow and the water. The day-to-day images intermingle with a story of mythological aspect; that of the timeless quest for the Lost City of the Caesars, a city of gold built 500 years ago by the conquerors.",0.024888,0,"2016-04-15","Released",78,"LA FABRICA NOCTURNA PRODUCTIONS, PANCHITO FILMS, ","Chile, "
"185",0,0,"Kicks","When his hard-earned kicks get snatched by a local hood, fifteen-year old Brandon and his two best friends go on an ill-advised mission across the Bay Area to retrieve the stolen sneakers.",3.292555,38,"2016-09-09","Released",80,"Bystorm Films, Animal Kingdom, Bow and Arrow Entertainment, ","United States of America, "
"186",0,0,"O Escaravelho do Diabo","A series of crimes against redheads scares the people from a little town. After the death of his brother, the 13 year old Alberto decides to investigate what is happening and is helped by the experienced but forgetful Inspector Pimentel.",1.01727,20,"2016-04-14","Released",91,"Telecine Productions, Dezenove Som e Imagens Produções, Globo Filmes, ","Brazil, "
"187",0,0,"Back to nothing","A group of freaks subsist as city nomads in an uncontrolled ghetto, doomed for demolition. Kongo, Strasser, Bobby and Jackie are heading out – back to nothing.",0.024915,0,"2016-04-14","Released",98,", , ",", , "
"188",20000000,8821329,"Ratchet & Clank","Ratchet and Clank tells the story of two unlikely heroes as they struggle to stop a vile alien named Chairman Drek from destroying every planet in the Solana Galaxy. When the two stumble upon a dangerous weapon capable of destroying entire planets, they must join forces with a team of colorful heroes called The Galactic Rangers in order to save the galaxy. Along the way they'll learn about heroism, friendship, and the importance of discovering one's own identity.",9.308648,239,"2016-04-13","Released",94,"Sony Pictures Animation, Rainmaker Studios, Blockade Entertainment, ","Canada, Hong Kong, United States of America, "
"189",240000000,1153304495,"Captain America: Civil War","Following the events of Age of Ultron, the collective governments of the world pass an act designed to regulate all superhuman activity. This polarizes opinion amongst the Avengers, causing two factions to side with Iron Man or Captain America, which causes an epic battle between former allies.",51.935464,10048,"2016-04-27","Released",147,"Marvel Studios, ","United States of America, "
"190",115000000,164602163,"The Huntsman: Winter's War","As two evil sisters prepare to conquer the land, two renegades—Eric the Huntsman, who aided Snow White in defeating Ravenna in Snowwhite and the Huntsman, and his forbidden lover, Sara—set out to stop them.",20.198204,2117,"2016-04-06","Released",114,"Roth Films, Universal Pictures, Perfect World Pictures, ","United States of America, "
"191",175000000,966550600,"The Jungle Book","A man-cub named Mowgli fostered by wolves. After a threat from the tiger Shere Khan, Mowgli is forced to flee the jungle, by which he embarks on a journey of self discovery with the help of the panther, Bagheera and the free-spirited bear, Baloo.",21.362136,3930,"2016-04-07","Released",106,"Walt Disney Pictures, Fairview Entertainment, Moving Picture Company, ","United Kingdom, United States of America, "
"192",0,0,"The Floating Chopin","The Floating Chopin tells about a couple who go on a vacation in a beautiful beach. The man tells about his visitation to Europe during holiday. Apparently, he gets a task where he should interpret his visitation.",0.036475,0,"2016-11-29","Released",11,", , ","Indonesia, "
"193",19000000,140705322,"Sausage Party","Sausage Party, the first R-rated CG animated movie, is about one sausage leading a group of supermarket products on a quest to discover the truth about their existence and what really happens when they become chosen to leave the grocery store.",14.239661,3095,"2016-07-11","Released",89,"Columbia Pictures, Sony Pictures Animation, Annapurna Pictures, Point Grey Pictures, Nitrogen Studios Canada, Sony Pictures, ","Canada, United States of America, "
"194",250000000,873260194,"Batman v Superman: Dawn of Justice","Fearing the actions of a god-like Super Hero left unchecked, Gotham City’s own formidable, forceful vigilante takes on Metropolis’s most revered, modern-day savior, while the world wrestles with what sort of hero it really needs. And with Batman and Superman at war with one another, a new threat quickly arises, putting mankind in greater danger than it’s ever known before.",31.967548,9413,"2016-03-23","Released",151,"RatPac-Dune Entertainment, Atlas Entertainment, Cruel & Unusual Films, DC Comics, DC Entertainment, Warner Bros. Pictures, ","United States of America, "
"195",0,0,"Ghostland: The View of the Ju'Hoansi","Remember the culture clash in THE GODS MUST BE CRAZY? This time it's real. One of the most ancient cultures on our planet is undergoing a major change. The Ju/Hoansi Bushmen in Namibia are not allowed to hunt anymore and need to converge with our so called “civilized” lifestyle. For the first time the Ju/Hoansi Bushmen travel through the Kalahari and then right into the heart of Europe. What starts as a look at their fascinating culture becomes an even more fascinating look at our Western lifestyle. A warm and humorous reflection of our habits through the eyes of people who are about to give up their million year old traditions.",0.272826,1,"2017-11-02","Released",88,", , ","Germany, "
"196",110000000,179246868,"Allegiant","Beatrice Prior and Tobias Eaton venture into the world outside of the fence and are taken into protective custody by a mysterious agency known as the Bureau of Genetic Welfare.",20.218655,2804,"2016-03-09","Released",121,"Mandeville Films, Summit Entertainment, Lionsgate, Red Wagon Entertainment, ","United States of America, "
"197",0,0,"Un caballo llamado elefante","Two brothers sneak into a circus in order to free their grandfather's horse and fulfill his last wish.",0.104376,1,"2016-08-04","Released",79,"Invercine&Wood, ","Chile, "
"198",0,0,"Open Season: Scared Silly","The humans and animals believe a werewolf is on the loose, and former hunter Shaw uses the opportunity to re-open the season. Boog, Elliot, and Mr. Weenie have to face their fears and find the werewolf to get the season closed permanently.",11.47887,83,"2016-03-08","Released",85,"Sony Pictures Animation, ","United States of America, "
"199",0,0,"Saving Borshia","A group of aspiring filmmakers must overcome a series of obstacles and conflicts as they strive to complete their cinematic masterpiece.",0.025299,0,"2016-03-05","Released",110,", , ",", , "
