"","budget","revenue","title","overview","popularity","vote_count","release_date","status","runtime","production_companies","production_countries"
"324",2500000,0,"U.F.O.","A group of friends awake one morning to find all electricity and power shut off and an immense alien aircraft hovering in the air above their heads. Suddenly this regular group of friends is battling to survive as the entire human race is threatened by the alien army hovering ominously above.",4.379052,56,"2012-12-15","Released",101,"Hawthorn Productions, Hawthorne Productions, ","United Kingdom, "
"325",0,0,"The Garden of Steven","Steven Crosby, a small town missionary in a strange land, stumbles upon the low road to salvation with the help of a little Mayan girl, a black magic woman and a saint with a cigar.",0.016254,0,"2012-12-05","Released",22,"The Beasts, Redfitz Productions, Saint Gorilla, ","Guatemala, United States of America, "
"326",0,0,"Some Must Watch, While Some Sleep","Some Must Watch While Some Must Sleep is a hypnotic and oneiric cinematic poem composed from footage Michael Higgins shot on the road across Alberta and BC, Canada. Photographed on Super 8mm and using hand-processed film techniques to create an unworldly zone between sleep and wakefulness, it looks at three characters and the film’s material that connects them.  It is a film that invites the viewer to sleep with the film’s protagonists, to drift across into the dream world of the film’s material and lose touch with their current surroundings.",0.008235,0,"2012-11-14","Released",61,"Fivesixteen Films, ","Ireland, "
"327",0,0,"Satellite Boy","When his grandfather's drive-in cinema and home in the outback town of Wyndham is threatened with demolition, a twelve-year-old Aboriginal boy must journey through Australia's bush country — equipped only with ancient survival skills — to stop the city developers.",0.587269,4,"2012-09-08","Released",90,"Satellite Films, Australian Broadcasting Corporation, ","Australia, "
"328",340000,0,"Noobz","Four friends hit the road to LA to compete in the Cyberbowl Video Game Championship, but will they be able to compete with the worst hangovers of their lives?",2.084235,22,"2013-01-25","Released",90,"Wunderkind Pictures, ","United States of America, "
"329",0,0,"Transit","A young girl abandoned by her father at boarding school, travels to an off-beat youth hostel and is forced to confront her personal demons.",0.431537,2,"2012-08-08","Released",19,", , ",", , "
"330",0,0,"The Mountain","On a mountain in Colombia, paramilitary forces have Marxist rebels cornered against a high ridge without food. In search of a way out, the guerrillas ask an old friend (a missionary they had held hostage and released some 20 years ago) for the number of a humanitarian priest in hopes of finding someone to bring food to the mountain. The missionary mistakes the priests' name for the head paramilitary leader and inadvertently gives the guerrilla commanders the wrong number. Through a humorous confusion two sworn enemies end up face to face in an emotional encounter that unveils the very core of Colombia's conflict and the journey each one must take to finally find peace in a lifetime of war.",0.008237,0,"2012-07-12","Released",114,", , ",", , "
"331",0,0,"Could be worse","Unexpected break up with a girlfriend provokes a sequence of events which one after the other affects on the main character. When the young man comes home he will be different.",0.083094,0,"2012-04-07","Released",13,", , ","Russia, "
"332",260000000,284139100,"John Carter","John Carter is a war-weary, former military captain who's inexplicably transported to the mysterious and exotic planet of Barsoom (Mars) and reluctantly becomes embroiled in an epic conflict. It's a world on the brink of collapse, and Carter rediscovers his humanity when he realizes the survival of Barsoom and its people rests in his hands.",17.028005,2664,"2012-03-07","Released",132,"Walt Disney Pictures, ","United States of America, "
"333",0,0,"Oh Willy...","Forced to return to his naturist roots, Willy bungles his way into noble savagery.",0.433798,6,"2013-04-03","Released",17,", , ","Belgium, France, "
"334",58000000,50365377,"Red Tails","The story of the Tuskegee Airmen, the first African-American pilots to fly in a combat squadron during World War II.",9.067776,211,"2012-01-19","Released",125,"Lucasfilm, Partnership Pictures, ","United States of America, "
"335",400,0,"Ala Bala Nica","",0.15554,2,"2011-11-14","Released",NA,"Nikita Mobile, Kargin Studio, Eskiz Studio, ","Armenia, "
"336",0,0,"Yu-Gi-Oh! 3D: Bonds Beyond Time Abridged","Yugi, Jaden and Yusei must travel through time and team up to save a children's card game.",0.010611,0,"2011-11-06","Released",49,"Little Kuriboh Pictures, ","United States of America, "
"337",170000000,185770160,"Hugo","Orphaned and alone except for an uncle, Hugo Cabret lives in the walls of a train station in 1930s Paris. Hugo's job is to oil and maintain the station's clocks, but to him, his more important task is to protect a broken automaton and notebook left to him by his late father. Accompanied by the goddaughter of an embittered toy merchant, Hugo embarks on a quest to solve the mystery of the automaton and find a place he can call home.",12.092998,2953,"2011-11-22","Released",126,"Paramount, Infinitum Nihil, GK Films, ","France, United States of America, United Kingdom, "
"338",0,0,"My Own Private River","Footage from My Own Private Idaho is re-contextualized in James Franco's tribute to River Phoenix.",0.396356,3,"2011-09-25","Released",101,", , ",", , "
"339",0,0,"On the Way Home","This story is about a journey, a relationship and returning home. He has already been driving his truck for twenty years throughout Russia while she waits him at home. He is alone on the road. She is together with her beloved pet, faithful friend and protector Irbis. This could continue for longer if he was not terminally ill.",0.1194,0,"2011-09-18","Released",56,", , ","Germany, Russia, "
"340",0,0,"Blunderkind","in 1988, 12 year old boy genius Henry Jameson sends his best friend, George, into the future to discover the resolution of a cliffhanger episode of the hit detective show 'Columbo.' But he loses him somewhere in time. 20 years later, Henry has become a degenerate alcoholic when 12 yr old George appears on his doorstep. Henry is forced to overcome the loser he has become to find a way to send George back to the 80s. Hilarity ensues!",0.068872,1,"2011-08-28","Released",20,", , ",", , "
"341",0,0,"The LXD: Rise of the Drifts","The next evolution of dance starts with The LXD: The Legion of Extraordinary Dancers. From creator Jon M. Chu comes the award-winning, groundbreaking saga which chronicles the journey of individuals with amazing powers of dance that band together in a League to oppose rival factions, with an epic back-story/mythology that depicts how the various dance styles in the hip-hop world came to be.",0.659324,1,"2011-08-11","Released",84,"Agility Studios, ","United States of America, "
"342",90000000,48795021,"Conan the Barbarian","A quest that begins as a personal vendetta for the fierce Cimmerian warrior soon turns into an epic battle against hulking rivals, horrific monsters, and impossible odds, as Conan (Jason Momoa) realizes he is the only hope of saving the great nations of Hyboria from an encroaching reign of supernatural evil.",15.540016,775,"2011-08-17","Released",113,"Dark Horse Entertainment, Nu Image, Paradox Entertainment, Nimar Studios, Cinema Vehicle Services, Millennium Films, ","United States of America, "
"343",125000000,1342000000,"Harry Potter and the Deathly Hallows: Part 2","Harry, Ron and Hermione continue their quest to vanquish the evil Voldemort once and for all. Just as things begin to look hopeless for the young wizards, Harry discovers a trio of magical objects that endow him with powers to rival Voldemort's formidable skills.",28.604587,8283,"2011-07-07","Released",130,"Warner Bros. Pictures, Heyday Films, ","United Kingdom, United States of America, "
"344",0,0,"Birdboy","A terrible industrial accident changes little Dinki's life forever. Now Dinki's fate may ride on the wings of her eccentric friend Birdboy, a misfit who hides in the forest lost in his fantasies.",0.293917,2,"2011-06-04","Released",13,", , ","Spain, "
"345",0,0,"Cross","First a boy is forced to run. Then he runs on his own. Then he watches another one run.",0.01228,0,"2011-05-21","Released",15,"Truth and Soul Pictures Inc, ",", , "
"346",0,0,"<U+041D><U+0430><U+0440><U+043A><U+043E><U+043C><U+043E><U+0432><U+0441><U+043A><U+0438><U+0439> <U+043E><U+0431><U+043E><U+0437>","",0.007922,0,"2011-05-16","Released",NA,"Favorit Film, ","Russia, "
"347",380000000,1045713802,"Pirates of the Caribbean: On Stranger Tides","Captain Jack Sparrow crosses paths with a woman from his past, and he's not sure if it's love -- or if she's a ruthless con artist who's using him to find the fabled Fountain of Youth. When she forces him aboard the Queen Anne's Revenge, the ship of the formidable pirate Blackbeard, Jack finds himself on an unexpected adventure in which he doesn't know who to fear more: Blackbeard or the woman from his past.",23.165033,6525,"2011-05-14","Released",136,"Walt Disney Pictures, Jerry Bruckheimer Films, Moving Picture Company, ","United States of America, "
"348",0,0,"The Book Smuggler","Colorful life of 19th century Lithuanian country side, is what Jurgis experiences when he meets a book smuggler.",0.48284,5,"2011-03-19","Released",37,", , ","Lithuania, "
"349",0,0,"La venganza del Centenario","A retired cop takes revenge on the thugs that raped and murdered his wife and daughters.",0.005892,0,"2011-01-15","Released",92,"Diamante Films, Ola Studios, ","Mexico, "
"350",0,0,"Something Fishy","A poignant drama about Nick, a 15 year-old boy who risks everything after he sacrifices his friendship with his best mate Trev, to save himself.",0.062882,1,"2010-11-27","Released",15,", , ","Australia, "
"351",2000,0,"Future World: City of Mass Destruction","Set in a post apocalyptic landscape 28 thousand years into the future, ""Future World: City of Mass Destruction"" is an amazing vision of the last city on earth. After four atomic holocausts and the second Ice Age, only one city remains on our ravaged planet - a city on the edge of insanity, overrun by mutants and madmen, and largely controlled by the tyrannical Devoz Corporation. This dying metropolis is mired in the throes of a power struggle amongst the city's final three corporate dynasties. The surviving corporation must in the end turn to a tribe of Amazon warrior women it once tried to destroy to save their dying planet. Visionary director Daniel E. Falicki guides you through a world of lesbian warriors, insufferable Grugs, a vicious Spider Queen, and a Blue Genie with loads of ""smokable"" fun! Are YOU ready to party like it's the year 30,000? Then take a trip to FUTURE WORLD! A cutting edge rotoscoped feature in the style of Ralph Bakshi's ""Heavy Metal,"" ""Future World: City of ...",0.021465,0,"2010-10-22","Released",120,"Collective Studios, Reality Entertainment (RE), Flim Flam Films, Rotomation Pictures, ","United States of America, "
"352",250000000,954305868,"Harry Potter and the Deathly Hallows: Part 1","Harry, Ron and Hermione walk away from their last year at Hogwarts to find and destroy the remaining Horcruxes, putting an end to Voldemort's bid for immortality. But with Harry's beloved Dumbledore dead and Voldemort's unscrupulous Death Eaters on the loose, the world is more dangerous than ever.",21.306035,7646,"2010-10-17","Released",146,"Warner Bros. Pictures, Heyday Films, ","United Kingdom, United States of America, "
"353",25000000,0,"Little Big Soldier","The story of a farmer forced into conscription, who has been looking to get out of the army ever since. His great chance arrives when he stumbles upon a wounded general from an enemy state, and he kidnaps him, intending to claim credit for the capture, which includes five ""mu"" of land, and most importantly, honorable discharge from the army.",8.43577,97,"2010-02-14","Released",96,"Bona Entertainment, ","China, Hong Kong, "
"354",0,0,"Open Season 3","Boog, Elliot, and their forest friends return with an all-new adventure, this time in a Big Top Circus! The comedy begins when Boog's pals choose their family obligations over the annual guy's trip, and a disappointed Boog decides to take a trip of his own, which leads him right into the middle of a circus ring...literally. When he switches places with a devious look-a-like circus grizzly and falls for an alluring Russian troupe member, he'll come to realize that maybe you don't have to choose between family and friendship after all.",7.979846,161,"2010-01-25","Released",75,"Sony Pictures Animation, Reel FX Creative Studios, ","United States of America, "
"355",0,0,"Star Wars Knights of the Old Republic: Episode 2: Veil of the Dark Side","The war against the Sith is becoming more brutal. Darth Malak has laid waste to the Outer Rim, destroying all opposition. Hopelessly outnumbered, the Republic battles bravely as LOGAN STARR continues his secret mission to find the Ancient and mysterious Star Forge. As the crew of the Ebon Hawk search the aquatic world of Manaan, Darth Malak prepares to send his apprentice to hunt them down....  Star Wars Knights of the Old Republic Episode II: Veil of the Dark Side (MAGFEST EDITION) is a 90 minute cut of the original film, that aired at the 2014 MagFest Convention with new visual effects, and a few more surprises.",0.004749,0,"2009-12-18","Released",97,"KOTOR TV, ","United States of America, "
"356",90000000,524028679,"Sherlock Holmes","Eccentric consulting detective, Sherlock Holmes and Doctor John Watson battle to bring down a new nemesis and unravel a deadly plot that could destroy England.",18.58577,7159,"2009-12-23","Released",128,"Village Roadshow Pictures, Silver Pictures, Internationale Filmproduktion Blackbird Dritte, Wigram Productions, Warner Bros. Pictures, ","Germany, United Kingdom, United States of America, "
"357",0,0,"Space Battleship Yamato Resurrection","In the year 2220 A.D., the Earth Federation launches a plan to evacuate Earth when discovering that a travelling black hole capable of destroying anything in its path is on course towards the solar system. As the people on Earth prepare to relocate to planet Amare, whose ruler offers refuge, the tyrants known as the ""S.U.S. Empire"" attack the first Earth evacuation fleet. After learning that his wife Capt. Yuki Mori-Kodai disappeared in the battle and that legendary space battleship Yamato has been fully rebuilt, Susumu Kodai accepts command of the ship as he intends to not only help humanity once again, but also find Yuki in the hope of helping his relationship with his daughter Miyuki, who puts the blame on him for her mother's disappearance. But in order to fullfil the mission, the Yamato must go through battles against the SUS Empire, who intend to spoil humanity's hopes of finding a new place to live in and turn Earth into energy for their own selfish needs.",0.468167,4,"2009-12-12","Released",135,"Toho Company, Ltd., Sedic, Bandai Visual, Chubu-nippon Broadcasting Company (CBC), Enagio, Hakuhodo DY Media Partners, Mainichi Broadcasting System (MBS), TBS, Tokyo FM Broadcasting Co., Yahoo Japan, Tohokushinsha Film Corporation, ","Japan, "
"358",2500000,0,"Breaking Point","""Breaking Point"" is a dramatic tale of corruption and self-realization, in which one man has to overcome a deep seeded conspiracy and his own lingering past in order to gain the redemption he desires.",2.767413,7,"2009-12-04","Released",93,"Evolving Productions, ","United States of America, "
"359",0,0,"Oblivion Island: Haruka and the Magic Mirror","Your favourite teddy bear. That model kit that took so long to complete. The picture book you used to read over and over again. The shining stone you found that day in the park. Where do all your childhood's treasures go when you grow up? In this story, we meet fantastic creatures that gather all these little objects that fall into oblivion as they are forgotten by their owners when they step into adulthood. These creatures sneak into our world from a different dimension, and unseen by humans, they take all the ditched and forgotten ""treasures"" into their world. Here, they use their booty to build their own city, a fairy tale-like place called... Oblivion Island!",1.569872,13,"2009-08-22","Released",98,"Production I.G, Fuji Television Network, ","Japan, "
"360",175000000,735099082,"Up","Carl Fredricksen spent his entire life dreaming of exploring the globe and experiencing life to its fullest. But at age 78, life seems to have passed him by, until a twist of fate (and a persistent 8-year old Wilderness Explorer named Russell) gives him a new lease on life.",24.252668,9286,"2009-05-28","Released",96,"Pixar, ","United States of America, "
"361",35000000,91353501,"Underworld: Rise of the Lycans","A prequel to the first two Underworld films, this fantasy explains the origins of the feud between the Vampires and the Lycans. Aided by his secret love, Sonja, courageous Lucian leads the Lycans in battle against brutal Vampire king Viktor. Determined to break the king's enslavement of his people, Lucian faces off against the Death Dealer army in a bid for Lycan independence.",12.769481,1768,"2009-01-22","Released",92,"Screen Gems, Lakeshore Entertainment, Sketch Films, UW3 Film Productions, ","United States of America, "
"362",150000000,309979994,"Bolt","Bolt is the star of the biggest show in Hollywood. The only problem is, he thinks it's real. After he's accidentally shipped to New York City and separated from Penny, his beloved co-star and owner, Bolt must harness all his ""super powers"" to find a way home.",14.577309,2354,"2008-11-21","Released",98,"Walt Disney Animation Studios, ","United States of America, "
"363",20000000,149281606,"Beverly Hills Chihuahua","A pampered Beverly Hills chihuahua named Chloe who, while on vacation in Mexico with her owner Viv's niece, Rachel, gets lost and must rely on her friends to help her get back home before she is caught by a dognapper who wants to ransom her.",6.977129,308,"2008-10-03","Released",91,"Walt Disney Pictures, Smart Entertainment, Mandeville Films, ","United States of America, "
"364",0,0,"The Letter for the King","Young Tiuri has to pass the final test before before being knighted by king Dagonaut. He has to pass a night in the chapel, what is suddenly disturbed by a strangers request of help. With his decision to help the stranger, Tiuri abandons his given task and starts into an adventure, that will shape the destiny of Dagonaut. On his journey he learns about the true meaning of love, friendship, courage and loyalty.",3.561055,9,"2008-07-16","Released",110,"Katholieke Radio Omroep (KRO), Heimatfilm, Studio-TV-Film, Eyeworks Egmond, Armada Productions, Menaures BV, Zweites Deutsches Fernsehen (ZDF), ","Germany, Netherlands, "
"365",0,0,"Tokyo Gore Police","Set in a future-world vision of Tokyo where the police have been privatized and bitter self-mutilation is so casual that advertising is often specially geared to the ""cutter"" demographic, this is the story of samurai-sword-wielding Ruka and her mission to avenge her father's assassination. Ruka is a cop from a squad who's mission is to destroy homicidal mutant humans known as ""engineers"" possessing the ability to transform any injury to a weapon.",5.302635,99,"2008-10-03","Released",110,"Nikkatsu Corporation, Fever Dreams, ","Japan, United States of America, "
"366",45000000,101702060,"Journey to the Center of the Earth","On a quest to find out what happened to his missing brother, a scientist, his nephew and their mountain guide discover a fantastic and dangerous lost world in the center of the earth.",16.368926,1852,"2008-07-10","Released",93,"New Line Cinema, Walden Media, ","United States of America, "
"367",5000,0,"The mystery of the chronovisor","In the late '50s, a group of 13 scientists realized the greatest discovery of all time: the Chronovisor. The group was led by Father Pellegrino Ernetti, which he developed an interesting theory that led to the conception of an electronic device, which was used to capture and show events in the past on a screen.",0.038876,1,"2008-03-12","Released",25,", , ","Italy, "
"368",2000000,9739679,"Ilya and the Robber","Ilya Muromets has to rescue his trusty horse Burushka and Kiev treasury from the greedy hands of the famous bandit, Solovey-Razboynik.",0.219998,4,"2007-11-28","Released",NA,"CTB Film Company, ","Russia, "
"369",15000000,56255142,"Into the Wild","The true story of top student and athlete, Christopher McCandless, who after graduating from Emory University in 1992, abandoned his possessions, gave his entire $24,000 savings account to charity and hitchhiked to Alaska to live in the wilderness.",20.020061,4233,"2007-09-11","Released",148,"River Road Entertainment, Paramount Vantage, Into the Wild, The Linson Company, ","United States of America, "
"370",130000000,289047763,"Fantastic 4: Rise of the Silver Surfer","The Fantastic Four return to the big screen as a new and all powerful enemy threatens the Earth. The seemingly unstoppable 'Silver Surfer', but all is not what it seems and there are old and new enemies that pose a greater threat than the intrepid superheroes realize.",15.126242,3476,"2007-06-13","Released",92,"Marvel Enterprises, Ingenious Film Partners, 1492 Pictures, Dune Entertainment, Constantin Film Produktion, Bernd Eichinger Productions, 20th Century Fox, ","Germany, United Kingdom, United States of America, "
"371",258000000,890871626,"Spider-Man 3","The seemingly invincible Spider-Man goes up against an all-new crop of villains – including the shape-shifting Sandman. While Spider-Man’s superpowers are altered by an alien organism, his alter ego, Peter Parker, deals with nemesis Eddie Brock and also gets caught up in a love triangle.",21.368935,5117,"2007-05-01","Released",139,"Marvel Enterprises, Columbia Pictures, Laura Ziskin Productions, ","United States of America, "
"372",65000000,422610419,"300","Based on Frank Miller's graphic novel, ""300"" is very loosely based the 480 B.C. Battle of Thermopylae, where the King of Sparta led his army against the advancing Persians; the battle is said to have inspired all of Greece to band together against the Persians, and helped usher in the world's first democracy.",14.577531,6349,"2006-12-09","Released",117,"Virtual Studios, Legendary Entertainment, Hollywood Gang Productions, Atmosphere Entertainment MM, Nimar Studios, Warner Bros. Pictures, Cruel & Unusual Films, ","United States of America, "
"373",10000,0,"The Return of Dominick Deladoor","",0.003562,0,"2006-11-26","Released",NA,"Genesis Audio Visual Productions, ","Greece, "
"374",30000000,3669465,"The Fall","In a hospital on the outskirts of 1920s Los Angeles, an injured stuntman begins to tell a fellow patient, a little girl with a broken arm, a fantastic story about 5 mythical heroes. Thanks to his fractured state of mind and her vivid imagination, the line between fiction and reality starts to blur as the tale advances.",8.966785,541,"2007-02-10","Released",117,"Absolute Entertainment, Googly Films, Deep Films, Tree Top Films Inc., RadicalMedia, ","India, United States of America, "
"375",75600000,12506188,"Zoom","Jack Shepard is an out-of-shape auto shop owner, far removed from the man who once protected the world's freedom. Reluctantly called back into action by the government, Jack is tasked with turning a ragtag group of kids with special powers into a new generation of superheroes to save the world from certain destruction.",6.59059,188,"2006-08-11","Released",83,"Revolution Studios, Team Todd, Boxing Cat Films, ","United States of America, "
"376",0,0,"OSS 117: Cairo, Nest of Spies","Secret agent OSS 117 foils Nazis, beds local beauties, and brings peace to the Middle East.",8.83721,514,"2006-04-19","Released",99,"Artémis Productions, ","France, "
"377",180000000,748806957,"The Chronicles of Narnia: The Lion, the Witch and the Wardrobe","Siblings Lucy, Edmund, Susan and Peter step through a magical wardrobe and find the land of Narnia. There, the they discover a charming, once peaceful kingdom that has been plunged into eternal winter by the evil White Witch, Jadis. Aided by the wise and magnificent lion, Aslan, the children lead Narnia into a spectacular, climactic battle to be free of the Witch's glacial powers forever.",19.028344,3868,"2005-12-07","Released",143,"Walt Disney Pictures, Walden Media, ","United Kingdom, United States of America, "
"378",207000000,550000000,"King Kong","In 1933 New York, an overly ambitious movie producer coerces his cast and hired ship crew to travel to mysterious Skull Island, where they encounter Kong, a giant ape who is immediately smitten with the leading lady.",17.493909,3215,"2005-12-12","Released",187,"Universal Pictures, WingNut Films, Big Primate Pictures, MFPV Film, ","New Zealand, United States of America, Germany, "
"379",150000000,895921036,"Harry Potter and the Goblet of Fire","Harry starts his fourth year at Hogwarts, competes in the treacherous Triwizard Tournament and faces the evil Lord Voldemort. Ron and Hermione help Harry manage the pressure – but Voldemort lurks, awaiting his chance to destroy Harry and all that he stands for.",24.080915,7809,"2005-11-16","Released",157,"Patalex IV Productions Limited, Warner Bros. Pictures, Heyday Films, ","United Kingdom, United States of America, "
