"","budget","revenue","title","overview","popularity","vote_count","release_date","status"
"1",0,0,"Jay and Silent Bob Reboot","The Jersey boys have to go back to Hollywood to stop a brand new reboot of the old ""Bluntman &amp; Chronic Movie"" they hated so much. It's a tongue-in-cheek, silly-ass satire that pokes fun at the movie business's recent re-do obsession, featuring an all-star cast of cameos and familiar faces!",0.17093,0,"2019-12-31","Planned"
"2",4700000,0,"About Endlessness","Inspired by “One Thousand and One Nights”, the celebrated collection of Middle Eastern and Indian folk tales, “About Endlessness” explores the preciousness and beauty of our existence, awakening in us the wish to maintain this eternal treasure and pass it on, in a juxtaposition of tableaux capturing moments in life.",0.079076,0,"2019-05-15","In Production"
"3",0,0,"Untitled Lani Pixels Project","Evil forces have invaded an isolated island and have targeted Patrick and Susan's grandfather, Mr. Campbell. Guided by Jack, a charming Irish rogue, the siblings end up on a dangerous journey filled with magic and mystery.",0.394223,0,"2019-01-01","In Production"
"4",0,0,"Killroy Was Here","A horror anthology movie centered around the phenomenon of the ""Kilroy Was Here"" graffiti.",0.108617,0,"2018-12-31","In Production"
"5",12000000,0,"The Other Side of the Wind","Orson Welles' unfinished masterpiece, restored and assembled based on Welles' own notes. During the last 15 years of his life, Welles, who died in 1985, worked obsessively on the film, which chronicles a temperamental film director—much like him—who is battling with the Hollywood establishment to finish an iconoclastic work.",3.77762,1,"2018-12-31","Post Production"
"6",0,0,"The Shitheads","A pair of deeply unqualified bozos are hired to transport a troubled teenage millionaire to rehab.",0.103103,0,"2018-12-31","Planned"
"7",0,0,"Friend of the World","After a catastrophic war, an eccentric general guides a filmmaker through a ravaged bunker.",2.456189,0,"2018-12-31","Post Production"
"8",0,0,"Little Monsters","A washed-up musician teams up with a teacher and a kids show personality to protect young children from a sudden outbreak of zombies.",2.406866,0,"2018-12-31","Post Production"
"9",0,0,"Happier times, Grump","The Grump decides that it's time to die, because everything is done and there's no meaning in life anymore. Just as his casket is finished, destiny brings new person in his life. His grandchild, Sofia, is in trouble and needs his grandfathers stubbornes, wisdom and the warmth of his fireplace. From the old grumps and young city girls two halves of life grows more than one whole.",0.519174,0,"2018-08-24","Released"
"10",0,0,"Kung Fury II: The Movie","",0.858764,0,"2018-07-01","Planned"
"11",0,0,"Chuck Steel: Night of the Trampires","It's not 1985 anymore...it's 1986, and Chuck Steel is 'the best God damn cop on the force' according to his long suffering boss, Captain Jack Schitt. But even this maverick, renegade, loose cannon, lone wolf, cop on the edge, who doesn't play by the rules has his work cut out when the Governor of LA decides to reduce the licensing hours for clubs and bars triggering a sudden, inexplicable spate of high profile disappearances in the city. The disappearances all have the same thing in common, a crime scene covered in blood but with no sign of the victim. The police are perplexed until they get a break in the case when one of the victims manages to escape. Chuck goes to interview the victim at the hospital but is confronted by a crazed old man who introduces himself as Abraham Van Rental. He warns a disbelieving Chuck that an evil scourge is about to descend on the city of Los Angeles - the scourge of the TRAMPIRES - a mutated hybrid of vampire and tramp.",0.000286,0,"2018-06-16","Post Production"
"12",300,0,"Conference Call","Jack and Judy are two students at the University Of Toronto. Jack is a filmmaker in his masters, with great potential but poor execution skills, while Judy is an overachieving but highly insecure literature student, in her last year of a PhD. They are brought together by a conference, which Judy is presenting at, and Jack is filming. We follow the ups and downs of their ensuing relationship, as they both learn more about each other and themselves through the process.",1.826242,0,"2018-06-08","In Production"
"13",0,0,"Ocean's 8","Debbie Ocean, a criminal mastermind, gathers a crew of seven other female thieves to pull off the heist of the century at New York's annual Met Gala.",15.393933,0,"2018-06-07","Post Production"
"14",0,0,"Russian Psycho","The film’s action happens in today’s Russia, in Moscow. A young man, Sviatoslav Ivanov, is in love with the young girl Asya and decides to marry her. By training he is a graphic designer, but Asya’s father is the managing director of a large Russian bank. Sviatoslav decides to start his own business and open a restaurant to create for Asya the living conditions she is accustomed to. A number of serious obstacles suddenly appear in the way of the young man and menace his life... He finds out that he has a secret ill-wisher who wants to ruin him and his business. The young man goes to the extreme, gradually untangling the secret plot... At the end of the story Sviatoslav manages to answer the question about his enemy...",0.00068,0,"2018-06-06","Released"
"15",0,0,"Uncle Sasha","An almost Chekhovian story about a once successful director making his last film, in spite of everything and everybody, in his country house. Strange guests, vain actors, somewhat eccentric neighbours and the director are reason enough for the author’s irony, and sometimes sarcasm. And you remember? Chekhov’s guns always fire!",0.227791,0,"2018-06-06","Released"
"16",0,0,"Pacific Angels","Ethan, a film student in the Pacific Northwest, finds himself reflecting on his family estrangement when he takes an active interest in conspiracy theories.",2.00543,0,"2018-06-06","Released"
"17",0,0,"The Gift","Tolya Sidorov is a simple worker of early retirement age from some remote place in Russia. Unexpectedly he discovers his artistic talent and becomes a sensation in the world of modern art. And all this because the creation of his masterpieces happens at a very intimate moment... The fame of the unusual artist spreads across the Internet, and even experts from Moscow come to visit an exhibition of Anatoly’s urinary painting. And like in the Russian fairy tale, the hero is miraculously showered with recognition and money. But Tolya prefers to stay incognito, trying to understand whether his work is real art. And the men from the factory would laugh at him if they found out.",1.9208,0,"2018-06-03","Released"
"18",1500,0,"Livescream","Every day, over 200 loving fans watch Scott Atkinson play horror games online. After a lifetime of failures and false starts, streaming games is the only thing he's good at...until it becomes a nightmare.  Enter Livescream - a mysterious horror game sent to him by an anonymous fan. At first, he thinks the game is a low quality indie title. But when his followers start dying one by one, he soon realizes the game is far more sinister. Now, Scott will be forced through nine levels of video game hell, each level representing a different horror game niche, in order to walk away alive.",5.488,0,"2018-05-25","Released"
"19",5000,0,"Neapolitan","In 2002, an introverted young man falls in love on a beta-test dating site only for the young woman to abruptly stop talking to him. He sets to find out why.",0,0,"","Released"
"20",19116000,0,"The Man Who Killed Don Quixote","An advertising executive jumps back and forth in time between 21st century London and 17th century La Mancha, where Don Quixote mistakes him for Sancho Panza.",8.437252,11,"2018-06-25","Released"
"21",0,0,"Non Fiction","Alain and Léonard, a writer and a publisher, are overwhelmed by the new practices of the publishing world.  Deaf to the desires of their wives, they struggle to find their place in a society whose code they can no longer crack.",5.520338,0,"2018-05-17","Post Production"
"22",8500000,0,"Under the Silver Lake","Young and disenchanted Sam meets a mysterious and beautiful woman who's swimming in his building's pool one night. When she suddenly vanishes the next morning, Sam embarks on a surreal quest across Los Angeles to decode the secret behind her disappearance, leading him into the murkiest depths of mystery, scandal and conspiracy.",3.719832,2,"2018-06-22","Released"
"23",0,0,"BlacKkKlansman","Ron Stallworth, an African-American police officer from Colorado, successfully managed to infiltrate the local Ku Klux Klan and became the head of the local chapter.",8.130176,0,"2018-08-10","Released"
"24",0,0,"Sextape","",1.051514,0,"2018-06-20","Released"
"25",0,0,"The World is Yours","A former drug dealer wants to set up a small business in Algeria and  is counting on the money he earned while dealing, which his mother is supposed to have hidden away for him. But unfortunately, she has gambled it all away. He is then forced to go back to a life of crime and, together with a friend and his ex, agrees to one last deal to get his plans back on track",0.390408,0,"2018-08-22","Released"
"26",110000000,301336221,"Deadpool 2","Wisecracking mercenary Deadpool battles the evil and powerful Cable and other bad guys to save a boy's life.",302.43477,850,"2018-05-15","Released"
"27",0,0,"5 Weddings","An American journalist travels to India to cover Bollywood weddings, only to uncover a mosaic of cultural clashes, transgender tangles and lost loves with her travels culminating at a destination where the only journey is the one within.",1.437684,1,"2018-08-24","Post Production"
"28",0,0,"The Pairless","Old friends Masa and Tapsa have very different life situations: Masa is happily married but Tapsa has recently lost his wife and is a single-parent. Masa tries to help Tapsa inviting him to a pottery class. However the whole pottery class begins to help Masa and soon all the lonely ones in the class open up to each other.",1.802684,0,"2018-05-10","Released"
"29",0,0,"Lucia's Grace","This is the story of Lucia, a young woman who has to take care of her teenager daughter all by herself working for an architectural firm. When she has to do an evaluation of a land, she finds out there is something off. This is a movie about a sensitive heroic woman who is brave enough to fight for her principles and won't ever stop until she saves the beautiful valley in which she grew up.",2.540231,0,"2018-05-09","Released"
"30",0,0,"Yomeddine","A Coptic leper and his orphaned apprentice leave the confines of the leper colony for the first time and embark on a journey across Egypt to search for what is left of their families.",3.393895,0,"2018-05-09","Post Production"
"31",0,0,"Diamantino","Gabriel Abrantes and Daniel Schmidt imagine a famous football player absolutely everybody lusts after. An outlandish, ingenuous and funny comedy on the world of football and gigantic long-haired dogs that portrays the nation in dire need of heroes.",2.340287,0,"2018-05-08","Released"
"32",0,0,"Book Club","Four lifelong friends have their lives forever changed after reading Fifty Shades of Grey in their monthly book club.",19.549701,5,"2018-05-18","Released"
"33",0,0,"Alex & The List","Alex, a lovable, unassuming dog trainer is in love with a great woman - Katherine - smart, talented, from a good family. Katherine adores Alex's quirky sense of humor, honesty and capacity to listen. Having decided to pop the question, Alex is blindsided when Katherine produces a detailed list of well-thought-out ""improvements"" she feels will tweak Alex on their way to becoming the ideal couple. Alex instinctively rejects the suggestion that he needs to change anything. But with the threat of a new competitor, Alex decides to ""do the list."" Guided by a coterie of friends that include: Dave, Alex's loyal childhood buddy, best female friend Lily, her husband Michael, and their 8 year old son, Nicky, Alex's journey has him reconsider and question his beliefs, values and world.",4.144931,4,"2018-05-04","Released"
"34",0,0,"The Art of Sitting Quietly and Doing Nothing","A break up causes an impulsive young man named Carl to reside in the woods. There, he reflects on himself, his past life, and has a psychedelic awakening.",1.990569,0,"2018-05-04","Released"
"35",0,0,"Housesitters","Angie and Izzy get a housesitting gig that seems too good to be true. Gruesome supernatural hijinks ensue.",2.969231,1,"2018-04-28","Post Production"
"36",21,0,"Trench","Struggling stand-up Sam Slade and reclusive writer Becky Holt are thrown together when Becky experiences strange phenomena in her own home, and Sam, desperately broke, poses as a private eye - but will Sam's first case be the death of her?",0.88545,0,"2018-04-27","Released"
"37",0,0,"The Other Woman","When Daniel and Isabelle invite Patrick and his new flame, Emma, to dinner, it’s with some misgivings. After all, Patrick has just dumped his ex-wife — their best friend — to run off with a much younger woman. But when the ravishing Emma appears, all of Daniel’s qualms fly out of the window. He’s instantly smitten with the seductive woman...",2.143206,3,"2018-04-26","Released"
"38",0,0,"Enissa Amani: Ehrenwort","Live from Hamburg, Iranian-German comedian Enissa Amani shares her take on German engineering, tax deductions and online fan-mail etiquette.",1.741338,2,"2018-04-26","Released"
"39",0,0,"Chuchotage","Sometimes it's hard to be a conference interpreter.",1.058537,0,"2018-04-24","Released"
"40",0,0,"Lost in the Sauce","A bunch of freaks have mundane conversations about hot fries, eye surgery, laundry, and milk.",0.44647,0,"2018-04-24","Released"
"41",0,0,"Crazy Rich Asians","An American-born Chinese economics professor accompanies her boyfriend to Singapore for his best friend's wedding, only to get thrust into the lives of Asia's rich and famous.",5.044731,1,"2018-08-17","Released"
"42",0,0,"Song of Back and Neck","A hapless man seeking treatment for his crippling back pain discovers a very unusual talent and unexpected love.",2.15613,0,"2018-04-23","Post Production"
"43",0,0,"Untogether","Andrea is a former teen prodigy turned struggling writer who falls for Nick, a recently successful writer who she secretly resents.  Lisa is the responsible younger sister who has an older bohemian boyfriend, Martin, but is drawn to an even older charasmatic Rabbi.  Two English sisters begin to navigate their wild desires and troubled relationships amidst the backdrop of the infamous Hollywood Hills...",0.698371,0,"2018-04-23","Post Production"
"44",0,0,"Untogether","Andrea is a former teen prodigy turned struggling writer who falls for Nick, a recently successful writer who she secretly resents.  Lisa is the responsible younger sister who has an older bohemian boyfriend, Martin, but is drawn to an even older charasmatic Rabbi.  Two English sisters begin to navigate their wild desires and troubled relationships amidst the backdrop of the infamous Hollywood Hills...",2.215298,0,"2018-04-23","Post Production"
"45",0,0,"To Dust","Shmuel, a Hasidic cantor in Upstate New York, distraught by the untimely death of his wife, struggles to find religious solace, while secretly obsessing over how her body will decay. As a clandestine partnership develops with Albert, a local community college biology professor, the two embark on a darkly comic and increasingly literal undertaking into the underworld.",1.045884,1,"2018-04-22","Released"
"46",0,0,"All About Nina","A stand-up comedian with a career about to take off flees to Los Angeles to escape her personal life.",3.295831,0,"2018-04-22","Post Production"
"47",0,0,"Let's Cheat Together","Sleuth Cheng, host of a popular variety show, was found wounded and trapped in a tetrapod at the shore, while a video of him kissing the mayor’s wife went viral and caused media frenzy. As Cheng’s girlfriend angrily confronts him, he reveals details that may turn a secret love affair into a political mega storm.",2.158854,0,"2018-05-11","Planned"
"48",0,0,"Egg","Two couples and a surrogate lay bare the complications, contradictions, heartbreak, and absurdities implicit in how we think about motherhood.",0.800372,0,"2018-04-21","Post Production"
"49",0,0,"Freaks and Geeks: The Documentary","The creators and actors from the TV show 'Freaks and Geeks' share their untold stories and pivotal moments from the making of the series that only aired for one season.",0.910506,0,"2018-04-21","Released"
"50",0,0,"The Great Pretender","The lives of a French theater director, her ex-boyfriend, and the two actors playing them intersect dramatically.",0.654759,0,"2018-04-21","Post Production"
"51",0,0,"Helsinki Mansplaining Massacre","One woman’s desperate struggle to survive a horde of men with frail egos, who just want to explain everything to her. But the biggest horror may be closer to her than she thinks.",0.942294,0,"2018-04-21","Released"
"52",150,0,"Bro Night","Bro Night follows the story of three bros who during their weekly Bro Night get a mysterious phone call that will change their lives forever.",1.554693,2,"2018-04-20","Post Production"
"53",0,0,"The Saint Bernard Syndicate","The film is a comedy about Rasmus and Frederik, two Danish men in their 30s, who head out on a business venture. They know each other from a boarding school back in Denmark and none of them have really been successful in life so far. Now they meet, 15 years later, both keen to set up a dog breeding centre.  The two partners have learned that so-called luxury dogs are extremely popular among the Chinese upper class and therefore expect this to be their way into fast and overwhelming wealth in China. A 200 plus lb St. Bernard dog by the name of Dollar travels with them to Chongqing. Here they meet up with the mysterious Mr. Liu who owns the largest bakery in Western China and who believes that dogs are as powerful as humans. Soon, the dog business evolves in unexpected ways, while the friendship between the two Danes grows stronger.",2.494581,0,"2018-05-09","Post Production"
"54",0,0,"Duck Butter","Two women, who are dissatisfied with the dishonesty they see in dating and relationships, decide to make a pact to spend 24 hours together hoping to find a new way to create intimacy.",2.579304,2,"2018-04-20","Post Production"
"55",0,0,"They Bite!","Mr. Hawkins is a retired detective yearning for a mission. When his wife, a Chinese delivery driver, doesn't return from a drop off at a notoriously haunted house, he gets worried. He arrives at the house to investigate,  but soon realizes he may not be the strapping young badass he once was.",0.671975,0,"2018-04-20","Released"
"56",0,0,"Sex Madness Revealed","Jimmy Morris has a special surprise guest on his podcast, The Film Dick. It's Chester Holloway who reveals all the secrets behind the mysterious 1939 film, 'Sex Madness.'",0.688508,0,"2018-04-20","Released"
"57",0,0,"Smuggling Hendrix","Caught between the mob and border patrol, washed-up musician Yiannis must put his plans to leave Cyprus on hold his when his beloved dog escapes across the wall to the island's Turkish side.",0.921937,0,"2018-04-20","Released"
"58",0,0,"7 Stages to Achieve Eternal Bliss by Passing Through the Gateway Chosen by the Holy Storsh","A small-town couple finds the perfect apartment in the big city, except there's one catch: the apartment is home to the ritualistic suicides of a deranged cult.",2.36025,0,"2018-04-20","Post Production"
"59",500,0,"Saul's 108th Story","As a teenager in 1950 Brooklyn, all Saul wanted to do was hang out with his friends and go to the beach. Instead, he got roped into a dangerous new job, and Saul got in a little over his head.",0.999422,0,"2018-04-20","Released"
"60",0,0,"Year of The Monkey","A mild political satire about a peculiar friendship between a lonesome monkey and an (impoverished) zoo warden, and about an upside-down world in transition as seen by a chimpanzee.",0.994924,0,"2018-04-19","Released"
"61",0,0,"Year of The Monkey","A mild political satire about a peculiar friendship between a lonesome monkey and an (impoverished) zoo warden, and about an upside-down world in transition as seen by a chimpanzee.",0.994924,0,"2018-04-19","Released"
"62",0,0,"Les Municipaux, ces héros","",2.104448,7,"2018-04-25","Released"
"63",0,0,"Violence Voyager","Following an end-of-term school ceremony, the American boy Bobby decides to go with his friend Akkun into the mountains outside their village, to a place perfect for a secret base. On the way they stop into a mysterious amusement park. They have fun there, but are attacked and cannot leave. Falling in with some other children who are also lost there, they fend off a number of attacks, and gradually learn the truth behind the facility.",0.615343,0,"2018-04-18","Released"
"64",0,0,"Trojí život","",0.607597,0,"2018-04-18","Released"
"65",0,0,"Dry Martina","Martina was a famous singer in Argentina during the late 90s, who's become completely frigid and disenchanted with love. The arrival of a so-called sister, alongside her attractive boyfriend, compel Martina to go to Chile with one objective in mind: getting back her libido.",2.62093,0,"2018-10-06","Released"
"66",0,0,"Penelope","In the Smug art world, innocence perishes. This is the discovery experienced firsthands by Penelope, a young woman who, after embarking on a series of insignificant relationships, arrives at a field of new experiences, some sort of moral abyss she will find herself trapped in more and more.",0.007223,0,"2018-04-17","Released"
"67",0,0,"Jefe","Cesar is 'the boss', the one everyone hates, the one some flatter and the one nobody tells the truth; the great successful businessman is on the edge of the precipice. One night his actions crumble down, his partners betray him and his wife kicks him out of the house. Entrenched in his office, he tries relentlessly to recover his company and his life. But he will not do it alone, César will find a very special ally, Ariana, the cleaner of the night shift.",3.17187,0,"2018-05-04","Released"
"68",0,0,"Multiple Choice","",0.577582,0,"2018-04-14","Post Production"
"69",0,0,"Farmer of the Year","When Hap Anderson, a widowed 83-year-old Minnesota farmer that thinks he's still quite the ladies' man, sells his family farm, he finds himself adrift and staring a short future in the face. Driven by the possibility of showing up with an old flame and impressing his old army buddies, he sets out to attend his 65th WWII reunion in California with his directionless and unreasonably self-confident granddaughter, Ashley. Each with their own issues and agendas, they head west in a dilapidated Winnebago. Encountering oddball tourist attractions and eccentric characters, they find themselves in seemingly impossible situations with only each other for support. As the journey progresses so does their relationship and they begin to understand and appreciate each other as individuals while discovering that being young and being old, aren't all that different.",1.980746,0,"2018-04-13","Released"
"70",0,0,"La Noche Que No Se Repite","A small rural town is the center of multiple parallel stories that intertwine the fate of several different characters across a single night. Some of them are: Juan Manuel y Esteban, two bored teenagers competing for the love of a French exchange student who decide to play a prank to ""Fat Pablo"", a naive pizza delivery boy that is mistaken as a delinquent by Olveira y Sandro. These two arrive to town to assault a corrupt ranch owner, a coup planned by ""El Tranquera"", a small-time dealer. Either chance or destiny make of this fateful night a turning point in the lives of the characters.",0.50948,0,"2018-04-12","Released"
"71",0,0,"Frankly a Mess","A struggling performer and all-around slacker accidentally stumbles into a successful fetish video career, and is subsequently pulled into a community of sickos while dealing with her over-bearing family in this outrageous comedy.",0.757977,0,"2018-04-08","Released"
"72",24625000,0,"Taxi 5","A police officer who's transfered in the police of Marseille gets assigned to take down a group of Italian robbers who drive the powerfull Ferrari's with the older niece of Daniel, a terrible driver who gets the legendary white taxi.",15.598667,102,"2018-04-11","Released"
"73",0,0,"What a Wonderful Family! 3: My Wife, My Life","At the Hirata home, three generations of their family live together. A crisis ensues when one afternoon, housewife Fumie falls asleep and wakes up to find a thief has stolen her secret money she kept hidden in the refrigerator.",8.273229,0,"2018-05-25","Released"
"74",0,0,"The Maestro","An uptight, eccentric piano instructor has illusions of grandeur despite having to face a harsh reality.",0.439226,0,"2018-04-02","Released"
"75",0,0,"The Big Frozen Gumshoe","Detective Dick is a 1940's private investigator who is frozen by a mysterious stranger for sixty-nine years. He defrosts in the modern world where he has to solve the case that put him on ice.",0.737379,1,"2018-04-01","Post Production"
"76",0,0,"Postcards from London","Postcards From London tells the story of beautiful teenager Jim who, having travelled from the suburbs, finds himself in Soho where he falls in with a gang of unusual high class male escorts – The Raconteurs – who specialise in post-coital conversation. From shy novice to sought after escort, and eventually artist’s muse, Jim would be the toast of the town if it wasn’t for his annoying affliction – Stendhal Syndrome – a rare condition which causes him to hallucinate and faint. When Jim is roped into the world of detecting art forgery, could his condition bring about his downfall?",0.83698,0,"2018-08-17","In Production"
