"","budget","revenue","title","overview","popularity","vote_count","release_date","status"
"600",0,0,"Different Flowers","Uptight Millie Haven has always followed the rules, but when she has doubts before her big Kansas City wedding, her attitude-prone little sister Emma, the least likely of heroes, comes to the rescue. They embark on a  spontaneous roadtrip to their grandmother’s farm where, with the help of Grandma Mildred, they rediscover their bond.",1.669723,5,"2017-09-29","Released"
"601",0,0,"Neurotic Quest for Serenity","Kika K is a successful star with millions of fans, but behind the scenes, she is in personal and professional crisis: she has to deal with an obsessive fan, a boyfriend with no concept, professional appointments scheduled by the businesswoman and her obsessive-compulsive disorder",3.670534,26,"2017-02-02","Released"
"602",0,0,"The Bar","A group of strangers are trapped inside a bar.",6.843521,349,"2017-02-15","Released"
"603",0,0,"Daphne","Daphne is a young woman negotiating the tricky business of modern life. Caught in the daily rush of her restaurant job and a nightlife kaleidoscope of new faces, she is witty, funny, the life of the party. Too busy to realise that deep down she is not happy. When she saves the life of a shopkeeper stabbed in a failed robbery, the impenetrable armour she wears to protect herself begins to crack, and Daphne is forced to confront the inevitability of a much-needed change in her life.",3.811178,11,"2017-01-29","Released"
"604",0,0,"The Turk Shop","At a creative firm somewhere in Stockholm, there's a short break in a meeting. Cecilia relates an anecdote from a hen party, about a 'Turk kiosk' that turned out to be closed. Asal, relatively new at the workplace, questions Cecilia's choice of words, and this seriously offends Cecilia. In the end it's Asal who is accused of inappropriate behaviour.",0.04391,0,"2017-01-29","Released"
"605",0,1657449,"The Other Side of Hope","A restaurateur befriends a Syrian refugee who  has recently arrived in Finland.",4.770375,79,"2017-02-03","Released"
"606",0,0,"The Man","Simon is the king of the Danish art scene - eccentric, successful, wealthy, with a beautiful wife and a young mistress. Life is beautiful, until the day his unknown son Casper turns up and attracts all the attention. It turns out that Casper is the world-famous graffiti artist “The Ghost”. This is a provocation and a challenge to Simon, and the relationship between father and son is put to a serious test. However, against all odds he two slowly grow closer to each other, but the question is whether blood ties are enough? Because after all Simon has no plans of being a father, and Casper has other plans with his father than simply getting to know him…",0.956528,2,"2017-03-02","Released"
"607",0,0,"The Incredible Jessica James","Burned by a bad breakup, a struggling New York City playwright makes an unlikely connection with a divorced app designer she meets on a blind date.",5.454002,69,"2017-01-27","Released"
"608",0,0,"Strange Birds","Mavie is 27 years old and has just moved to the French capital from the provinces. She dreams of a future as a writer but is plagued by doubt and uncertainty. 76-year-old misanthrope Georges runs a bookshop in Paris – or has he merely been forced to take refuge there to escape his past? These are two peculiar creatures indeed. Georges is cynical and no longer expects much from life, while Mavie is still brimming with expectation. Yet something magical happens between them, until Georges' dark secret suddenly catches up with him – and Mavie is caught up in something very different...",3.087353,3,"2017-05-31","Released"
"609",0,0,"Fun Mom Dinner","Four women, whose kids attend the same preschool class, get together for a ""fun mom dinner."" When the night takes an unexpected turn, these unlikely new friends realize they have more in common than just marriage and motherhood.",6.455459,56,"2017-08-04","Released"
"610",0,0,"The Robbery","Meet Crystal. She decides to rob a liquor store. It goes pretty ok.",1.870828,2,"2017-01-25","Released"
"611",0,0,"Vezir Parmagi","",2.708095,2,"2017-01-25","Released"
"612",0,0,"Last Hen In Egypt","Alaa Deek (Mohammad Ramadan) is a bank employee who belongs to an ancient family, but he hates women from childhood and avoids any dealings with his family. When he and his family travel to Nile, all the family members die, and now he has to take full responsibility for his family's affairs. They are all just women, since he is the only man in the family.",0.05822,0,"2017-01-25","Released"
"613",0,0,"Rakete Perelman","",2.279748,1,"2017-11-09","Released"
"614",0,1783421,"The Last Word","A retired businesswoman – who tries to control everything around her – decides to write her own obituary. A young journalist takes up the task of finding out the truth, and the result is a life-altering friendship.",7.904224,114,"2017-03-03","Released"
"615",10000000,248370,"Band Aid","A couple who can't stop fighting embark on a last-ditch effort to save their marriage: turning their fights into songs and starting a band.",7.851579,63,"2017-06-02","Released"
"616",0,0,"Wannabe","17-year-old Coco wants to become famous. She goes to each audition, but is rejected time and again. On her YouTube channel, she creates a fictional world in which everything is perfect and her self-confidence is based on likes and followers.",0.123249,0,"2017-01-24","Released"
"617",0,0,"Catherine","A tragic comedy of a sweet little girl, who grows up to be a crazy old cat lady.",0.041269,0,"2017-01-24","Released"
"618",0,532669,"Brigsby Bear","Brigsby Bear Adventures is a children's TV show produced for an audience of one: James. When the show abruptly ends, James's life changes forever, and he sets out to finish the story himself.",11.906878,125,"2017-07-27","Released"
"619",0,7,"Beatriz at Dinner","Beatriz, an immigrant from a poor town in Mexico, has drawn on her innate kindness to build a career as a health practitioner. Doug Strutt is a cutthroat, self-satisfied billionaire. When these two opposites meet at a dinner party, their worlds collide, and neither will ever be the same.",10.226258,68,"2017-06-09","Released"
"620",0,0,"Deidra & Laney Rob a Train","After their mother ends up in jail, two sisters turn to train robbery in order to support their family.",3.899304,40,"2017-01-23","Released"
"621",0,0,"Suck It Up","Ronnie lost her brother, Faye lost her first love. These two best friends take off on a debaucherous road trip to the mountains to get over the death of the guy they both loved.",2.824623,5,"2017-01-23","Released"
"622",0,653951,"Wilson","Middle-aged and divorced, Wilson finds himself lonely, smug and obsessed with his past.",11.455249,155,"2017-03-24","Released"
"623",0,0,"The Polka King","Local Pennsylvania polka legend Jan Lewan develops a plan to get rich that shocks his fans and lands him in jail.",5.56106,78,"2017-01-22","Released"
"624",0,29258,"Lemon","A man watches his life unravel after he is left by his blind girlfriend.",4.262918,8,"2017-01-22","Released"
"625",0,0,"Kate Can’t Swim","When Kate’s best friend Em returns from abroad with a surprising new lover, they embark on a reunion vacation with their partners, but the peaceful getaway quickly becomes emotionally complicated.",0.07813,0,"2017-01-22","Post Production"
"626",0,0,"Zamfir's Zona Part Two","Jealousy, envy, gossip, and greed are testing Zona's and Mane's perfect marriage.",0.080949,1,"2017-01-21","Released"
"627",0,0,"Dave Made a Maze","A frustrated artist gets lost inside the cardboard fort he builds in his living room.",5.658495,52,"2017-01-21","Released"
"628",0,0,"Meet The Gähwilers","An african refugee starts working for a swiss family.",0.081096,1,"2017-01-26","Released"
"629",0,0,"Free and Easy","Under a tin-gray sky, in a hollowed out corner of northern China, a stranger arrives in town bearing magical soap—but smelling it will cost you. Nearby, a pair of unenthused cops try cracking a seemingly simple case. Or not. And you can forget religious solace; the only monk around is not what he seems.",0.159646,1,"2017-01-21","Released"
"630",0,0,"Dim the Fluorescents","A struggling actress and an aspiring playwright pour all of their creative energy into the only paying work they can find: role-playing demonstrations for corporate training seminars. When they book the biggest gig of their careers at a hotel conference, they commence work on their most ambitious production to date.",2.174716,0,"2017-01-21","Released"
"631",0,0,"Horseshoe Theory","A weapons deal between a white supremacist and a member of the Islamic State blossoms into more.",2.183198,0,"2017-01-21","Released"
"632",0,0,"Orders","In the labyrinth of suburban America, a soldier wanders through streets not as dead and empty as they may appear. A ghost story in digital camouflage.",0.057733,0,"2017-01-21","Released"
"633",0,0,"Cecile on the Phone","Cecile wants answers, but, actually, she doesn't. After her ex-boyfriend's return to New York triggers overwhelming feelings of doubt and confusion, she embarks on a series of telephone conversations, all of which ultimately only distract her from the one conversation she really needs to have.",0.356416,0,"2017-01-21","Released"
"634",0,0,"No Other Way to Say It","Writer/Director Tim Mason pulls the curtain back on the glamorous world of advertising in this short comedy about a voiceover actor trying to nail the right tone for a pair of indecisive ad creatives selling a fictitious children's ice cream brand. Or is it a short tragedy about a pair of ad creatives trying to coax the right tone out of a distracted voiceover actor?",1.236844,0,"2017-01-21","Released"
"635",5000000,56292348,"The Big Sick","Pakistan-born comedian Kumail Nanjiani and grad student Emily Gardner fall in love but struggle as their cultures clash. When Emily contracts a mysterious illness, Kumail finds himself forced to face her feisty parents, his family's expectations, and his true feelings.",11.958486,818,"2017-06-23","Released"
"636",0,24931915,"Ingrid Goes West","Ingrid becomes obsessed with a social network star named Taylor Sloane who seemingly has a perfect life. But when Ingrid decides to drop everything and move west to be Taylor's friend, her behaviour turns unsettling and dangerous.",10.747819,243,"2017-08-11","Released"
"637",0,0,"Landline","A teenager living with her sister and parents in Manhattan during the 1990s discovers that her father is having an affair.",5.108937,35,"2017-07-21","Released"
"638",0,0,"Bitch","The provocative tale of a woman who snaps under crushing life pressures and assumes the psyche of a vicious dog. Her philandering, absentee husband is forced to become reacquainted with his four children and sister-in-law as they attempt to keep the family together during this bizarre crisis.",3.895439,17,"2017-01-20","Released"
"639",0,0,"It Happened in L.A.","Annette might be judgmental, critical, and a total perfectionist—but only of the most charming variety. When she suddenly perceives that her relationship with her boyfriend, Elliot, is inferior to all the happy coupledom she sees among her friends, she decides they need to break up. Launched into the LA dating scene, where film industry jobs, old school bars, and elitist consumerism are the norm, Annette begins to realize that maybe meeting some cool new guy isn’t going to lead her to personal fulfillment.",3.444227,0,"2017-01-20","Released"
"640",0,0,"Neighborhood Food Drive","A sublime comedy of biting humor and unusual schemes that paints a satirical portrait of millennials and hipsters who think they’re benefitting their community. But good intentions do not always have good consequences.",2.218994,0,"2017-01-20","Released"
"641",0,0,"Fucking Bunnies","Raimo’s comfortable, middle-class bubble is burst when a Satan-worshipping sex cult moves in next door.",0.332924,0,"2017-01-20","Released"
"642",10000,0,"Rekindled","After a string of failed relationships, Kate gets the chance to rekindle romance with the love of her life — her high-school boyfriend.",2.301579,0,"2017-01-20","Released"
"643",0,0,"It Happened in L.A.","Annette might be judgmental, critical, and a total perfectionist—but only of the most charming variety. When she suddenly perceives that her relationship with her boyfriend, Elliot, is inferior to all the happy coupledom she sees among her friends, she decides they need to break up. Launched into the LA dating scene, where film industry jobs, old school bars, and elitist consumerism are the norm, Annette begins to realize that maybe meeting some cool new guy isn’t going to lead her to personal fulfillment.",3.444227,0,"2017-01-20","Released"
"644",0,0,"Miyubi","Miyubi is a<U+200B><U+200B> virtual reality <U+200B>comedy about a Japanese toy robot - inhabited by the viewer - gifted to a young boy on his birthday in 1982 suburban America. Over the course of a year, as the boy's family fractures apart, the viewer experiences love and inevitable obsolescence in an intimate, hilarious and endearing interactive story.",0.082765,0,"2017-01-20","Released"
"645",0,0,"Brad Cuts Loose","Brad, an uptight office drone, seemingly discovers the perfect vehicle for letting off steam when an advertisement for a business catering to his innermost desires pops up one morning on his computer. Brad's subsequent visit to the business and encounter with its receptionist Janine, however, don't quite go as planned.",0.935623,0,"2017-01-20","Released"
"646",0,0,"Family Life","While house-sitting for a distant cousin, a lonely man fabricates the existence of a vindictive ex-wife withholding his daughter, in order to gain the sympathy of the single mother he has just met.",0.179721,0,"2017-01-20","Released"
"647",0,0,"It's a Date","It’s a Date is a culmination of his preoccupations, a weird but humanistic look at a couple on a first date. It seems to be going well until the man decides to really open up and get (sur)real.",0.092429,0,"2017-01-20","Released"
"648",0,0,"I Don't Feel at Home in This World Anymore","When a depressed woman is burglarized, she finds a new sense of purpose by tracking down the thieves alongside her obnoxious neighbor. But they soon find themselves dangerously out of their depth against a pack of degenerate criminals.",8.302608,381,"2017-01-19","Released"
"649",0,0,"Lost in London","Within the course of a night, Woody Harrelson finds himself in a misadventure in London that winds him up in prison.",2.923506,8,"2017-01-19","Released"
"650",0,0,"The Little Hours","A young servant fleeing from his master takes refuge at a convent full of emotionally unstable nuns in the middle ages.",8.104285,116,"2017-06-30","Released"
"651",0,0,"Room(h)ates","Delphine and Yvan divorce. While his financial situation does not allow him to find a home, Yvan remembers that he owns 20% of his ex-wife's house. He then returned to live with Delphine, in his 20%. The two ex will discover the joys of forced housemates.",5.82897,121,"2017-04-19","Released"
"652",0,0,"Mi-temps","",0.04498,0,"2017-01-19","Released"
"653",0,0,"I Know You from Somewhere","A young woman incurs the wrath of the internet after inadvertently becoming a viral sensation.",0.15856,0,"2017-01-19","Released"
"654",0,0,"Ma belle mère et moi... 9 mois après","",0.040232,0,"2017-01-17","Released"
"655",0,0,"Return to... Return to Nuke 'Em High AKA Vol. 2","Following the events of Volume 1,  the mutated glee club continue their violent rampage in Tromaville. Chrissy and Lauren, two innocent lesbian lovers, must fight not only the Cretins, mutants, and monsters but also the evil Tromorganic Foodstuffs Conglomerate. Can they, and Kevin the Wonder Duck, save Tromaville High School and the world?",3.585259,3,"2017-01-15","Released"
"656",0,0,"The Hippopotamus","Disgraced poet Ted Wallace is summoned to his friend's country manor to investigate a series of unexplained miracles.",2.128546,32,"2017-03-19","Released"
"657",10000,0,"Haunt Me","Angie wants to see a ghost more than anything. After many failed attempts, she arrives at a bed and breakfast that could make her wish come true.",0.046215,0,"2017-01-14","Released"
"658",0,0,"Limmy's Vines","A unique and deliriously disturbing insight into the existential terrors of the 21st century, with paranoia, mental illness, sexuality, boredom and the Internet all coming under scrutiny in 600 six second segments.",0.099842,0,"2017-01-12","Released"
"659",100000,20000,"Kinda Funny Live 2","Greg, Colin, Tim, Nick (and Kevin... Unfortunately) put on their annual live extravaganza. With guest host Burnie Burns, comedy from Mike Drucker, music from ToneDeff and lots more surprises.",0.122363,1,"2017-01-09","Released"
"660",0,0,"Split Me","When seventeen-year-old aspiring bowler Joey discovers she can't join the over-40s women's team, will oddball and lactose-intolerant Scooter’s friendship be enough to brave this backwater town?",0.079178,0,"2017-01-09","Released"
"661",2000000,0,"Everybody Loves Somebody","On the surface, Clara Barron seems to have it all: a job as an OB-GYN; a great house in LA; and a loving family. But, the one thing Clara doesn't have figured out is her love life. Pressured by a family wedding in Mexico, Clara asks a co-worker to pose as her boyfriend for the weekend festivities,- only to be caught by surprise when her ex- boyfriend (and family favorite) suddenly shows up after disappearing from her life completely. Torn, Clara must decide between going back to the past or open her heart to new and unexpected possibilities.",5.781342,52,"2017-02-10","Released"
"662",0,0,"Yours Faithfully, Edna Welthorpe (Mrs)","Chris Shepherd directs a short animation in tribute to Joe Orton (Entertaining Mr Sloane, Loot) to mark the 50th anniversary of his death. Joe Orton would write letters of complaint using the pseudonym of Edna Welthorpe. Using this persona, Orton would wind up companies, vicars and even ridicule his own plays. In this short we see what mayhem ensues when Edna writes to Smedley Jams and Littlewood home catalogue service.",0.156569,1,"2017-01-01","Released"
"663",0,0,"Chuck Hank and the San Diego Twins","A turf war has been raging in Oldtown for generations. On one side, The Syndicate - an evil gang of crank-head misfits, who has been set on muscling the San Diego family out of the parcel of land they own in the center of town. On the other side, the San Diego family: Tony and Johnny - twin brothers, and their sister Salsa are the last of a bloodline that stretches back for generations. Their mother, father and brothers were all brutally murdered in a violent clash with The Syndicate years earlier. With their neighborhood becoming increasingly fearful, The Syndicate puts into action another evil advance on their family's fading legacy by kidnapping Salsa - all hell breaks loose. The twins and their best friend Chuck Hank must decide whether to hand over the deed to their families land in order to save their sister or fight, the final fight!",2.92972,2,"2017-01-01","Post Production"
"664",0,0,"Love and Goodbye and Hawaii","Rinko (Aya Ayano) and Isamu (Kentaro Tamura) have been living together for three years in what seems like an idyllic situation, except for one detail: they broke up months ago. Even so, despite misgivings from her friends, the setup is comfortable enough for Rinko not to feel pressured to change it. When an attractive graduate student takes an interest in Isamu, however, Rinko is forced to confront her remaining feelings for him and the reality of their cohabitation. A unique twist on the romantic comedy, director Shingo Matsumura’s finely-tuned film gently reveals deep emotional truths about love and relationships with subtlety and genuine empathy, delivered with pitch-perfect performances from his leads. -JAPAN CUTS: Festival of New Japanese Film",2.378809,0,"2017-01-01","Released"
"665",0,0,"Ils s'aiment aussi depuis 20 ans (théâtre)","",0.084134,0,"2017-01-01","Released"
"666",0,0,"Snooze","",0.041411,0,"2017-01-01","Released"
"667",0,0,"Hans Teeuwen: Real Rancour","Hans Teeuwen's Real Rancour, recorded live at the Leicester Square Theatre, November 2016.",0.106091,1,"2016-12-31","Released"
"668",0,0,"Brown","A young cop deals with a horrifying and mysterious medical issue, with no help from his irritating partner.",0.041904,0,"2016-12-31","Released"
"669",0,0,"Writer's Block","Past her prime and afflicted with a severe case of writer's block, a veteran songwriter finds new inspiration in a bird that takes up residence outside her home.",0.038904,0,"2016-12-31","Released"
"670",15000,0,"Lemon","Seconds after the wedding, a bride is stunned to learn that her new husband fudged nearly everything about his past, but his revelations force her to come clean about a few shocking secrets of her own.",0.109945,0,"2016-12-31","Released"
"671",0,0,"Red Dog: True Blue","Explores the early events leading up to Red Dog's discovery on the road to Dampier, and his ultimate rise from ordinary dog to Australian legend.",2.552087,29,"2016-12-26","Released"
"672",0,0,"The Mole Song: Hong Kong Capriccio","As undercover cop Reiji takes on a new mission to takedown the Chinese mafia, elite police officer Shinya  moves to arrest Reiji.",1.024124,3,"2016-12-23","Released"
"673",180000,0,"Bienvenido Don Goyito","Satirical comedy about a jíbaro that moves from the country to the city and resists to change his rural customs. The film depicts family and emotional conflicts that Puerto Rico suffered due to Americanization.",2.183975,0,"2017-01-01","Released"
"674",2000,0,"To Have and To Hold","A noble socialite and her butler must concoct a plan to stop her husband's affair with a younger woman.",0.038824,0,"2016-12-21","Released"
"675",32,0,"R.A.I.D. Special Unit","The story of a woman who dreams to join an intervention group in the police department called RAID. Unfortunately, she is rather clumsy and both her family (and soon to be family-in-law) and a veteran of the RAID do not approve. However, Johanna is determined to prove them wrong.",8.994584,374,"2017-02-01","Released"
"676",0,0,"La Comédie presque française : Dom Juan les Pins","",0.041682,0,"2016-12-17","Released"
"677",0,0,"Fate for Rent","The main character Rita is kind and sweet young woman, who can’t say “no” and is ready to help anyone who asks, and therefore is constantly being used by her family and friends. Her sister Olga is pursuing a career, leaving her children to Rita; her love interest Vlad uses her by borrowing money and never giving it back, and also by getting Rita to do his work; Rita’s mother Nina is thinking only about her questionable business. Rita herself, while being a talented inventor of modern gadgets, is a freelance employee at an advertising company, where Olga is a creative director. Olga gets fame for all Rita’s inventions. One day, everything changes.",0.153987,1,"2016-12-16","Released"
"678",0,0,"A Really Crazy Wednesday","Márcio steals a script and knocks coffee in it.",0.106534,0,"2016-12-16","Post Production"
"679",0,0,"Poveri ma ricchi","The ""Tucci"" are a poor Italian family living in a small village in Lazio. Father, mother, a conceited daughter and a genius son, forced to pretend being stupid to keep up with the family. One day something unexpected happens: the family wins one hundred million Euros. Excited, they decide to keep the winning a secret, but as soon as a single word slips out from the mouth of the householder, they only have one choice to avoid being persecuted by friends and acquaintances: run away. They leave at night, heading to Milan. They will realize as soon as they arrive that today's rich people behaves very differently from the past, and being rich has become a real bother... this discovery will make things way different from what Tuccis' expected.",4.558053,154,"2016-12-15","Released"
"680",0,0,"Survival Family","A world wide electrical outage occurs. Everything that requires electricity comes to a stop. Tokyo is nearly ruined. Yoshiyuki Suzuki (Fumiyo Kohinata) decides to escape from Tokyo with his family.",1.264761,8,"2017-02-11","Released"
"681",0,0,"Sen Benim Herseyimsin","",0.179759,4,"2016-12-09","Released"
"682",0,0,"Christmas with the Andersons","Drowning in tinsel and lights every Christmas, Michael and Caroline Anderson throw the year’s biggest party at their house. But this year, with Michael jobless and Caroline’s store struggling, that tradition may end. The Andersons decide to host a very different kind of party and, in the process, rediscover what’s most important about the holiday.",0.114803,1,"2016-12-09","Released"
"683",0,0,"Shelved","Private Gumdrop of Santa's Special Ops has been sent on a mission to spy on the conduct of the little boys and girls of the world. What Santa didn't expect was that his Elf would transgress and terrorize the Montgomery family. Now the Montgomery's must decide how they will defeat this elf doll with the Power of Kringle and Conscience of Krampus.",0.040088,0,"2016-12-09","Released"
"684",0,0,"<U+041C><U+043E><U+043B><U+043E><U+0434><U+043E><U+0433><U+0432><U+0430><U+0440><U+0434><U+0435><U+0439><U+0446><U+0435><U+0432> 32","",0.074484,0,"2016-12-06","Released"
"685",0,0,"Dear Evan Hansen","All his life, Evan Hansen has felt invisible. But when a tragic event shocks the community and thrusts him into the center of a rapidly evolving controversy, Evan is given the opportunity of a lifetime: the chance to be somebody else.",0.073736,1,"2016-12-04","Released"
"686",0,0,"Asteria","Two astronauts attempt to plant their flag on a newly discovered planet. But first, they need to get rid of some pesky aliens whose business there is unknown.",0.326704,3,"2017-02-10","Released"
