"","budget","revenue","title","overview","popularity","vote_count","release_date","status"
"1874",0,0,"Adventures of Serial Buddies","Gregory is a devout Catholic who wants to kill evil people in order to grant them safe passage to heaven, Gary is an assembly worker at a trophy shop who wants to kill potential trophy winners, Graham is Gary's intern who will do anything to become a trophy maker and Vinny Van Go drives a road emergency van just to make friends. A coincidental encounter forces these four dim witted rejects to join forces and embark upon an idiotic and altogether hilarious road trip adventure - encountering the likes of skinheads, fraternity jocks, sorority babes, missing children, bikers, porn-stars, clowns, and Kathie Lee Gifford! If the boys aren't careful they might just become human, in what is ""the very first serial killer buddy movie of all time",0.071117,1,"2013-01-01","Released"
"1875",2000000,0,"Wrinkles","Based on Paco Roca's comic of the same title (2008 Spanish National Comic Prize), WRINKLES is a 2D animated feature-length film for an adult audience. Wrinkles portrays the friendship between Emilio and Miguel, two aged gentlemen shut away in a care home. Recent arrival Emilio, in the early stages of Alzheimer, is helped by Miguel and colleagues to avoid ending up on the feared top floor of the care home, also known as the lost causes or ""assisted"" floor. Their wild plan infuses their otherwise tedious day-to-day with humor and tenderness, because although for some their lives are coming to an end, for them it is just a new beginning.",5.052811,37,"2011-09-19","Released"
"1876",0,0,"The State That I Am Fish","A film within a film within a film within a fish.",0.088416,1,"2011-09-17","Released"
"1877",0,539896,"Peace, Love & Misunderstanding","A conservative lawyer named Diane takes her two teenage children Jake and Zoe to meet their estranged, hippie grandmother in Woodstock after her husband asks for a divorce.",7.110858,72,"2011-09-13","Released"
"1878",0,0,"Something Red","While embarking on a blind date, Scott finds himself face to face with several potential hook ups and discovers that beauty truly is in the eye of the beholder.",0.093384,1,"2011-09-11","Released"
"1879",0,6748712,"A Letter to Momo","Clinging to an unfinished letter written by her recently deceased father, young Momo moves with her mother from bustling Tokyo to the remote Japanese island of Shio. Upon their arrival, she begins to explore her new habitat, meeting local children and learning their routines and customs. However, it's not long before several bizarre occurrences crop up around the previously tranquil island. Orchards are found ransacked, prized trinkets start disappearing and, worst of all, each morning after her mother leaves for work, Momo hears strange mumblings coming from the attic of their home. Annoyed by these creepy goings-on and her mother's refusal to believe them, Momo embarks on a strange and supernatural adventure to discover the source of the mischief, which leads her to a trio of troublesome imps: the flatulent lizard Kawa, the childlike Mame and their hulking ogre leader Iwa. Momo also learns that her visit to the island is in some way connected to her father's mysterious letter.",7.582782,106,"2012-04-21","Released"
"1880",0,6483963,"Goon","Doug Glatt, a slacker who discovers he has a talent for brawling is approached by a minor league hockey coach and invited to join the team as the ""muscle."" Despite the fact that Glatt can't skate his best friend, Pat, convinces him to give it a shot, and Glatt becomes a hero to the team and their fans, until the league's reigning goon becomes threatened by Glatt's success and decides to even the score.",7.413333,417,"2012-01-06","Released"
"1881",0,0,"Damsels in Distress","A trio of beautiful girls set out to revolutionize life at a grungy American university: the dynamic leader Violet Wister, principled Rose and sexy Heather. They welcome transfer student Lily into their group which seeks to help severely depressed students with a program of good hygiene and musical dance numbers.",5.07899,83,"2012-04-06","Released"
"1882",0,0,"Darkwood Manor","When Dorothy Stringer High School announces it is to close, all hope seems lost. That is until one of the students finds a flyer on the street offering a reward to anyone who can spend two nights in Darkwood Manor. But when the intrepid group of volunteers and their form tutor arrive at the manor it quickly becomes clear that the resident evil is not a ghost after all and, one by one, they start to disappear...",0.859269,0,"2011-09-10","Released"
"1883",0,0,"Blunderkind","in 1988, 12 year old boy genius Henry Jameson sends his best friend, George, into the future to discover the resolution of a cliffhanger episode of the hit detective show 'Columbo.' But he loses him somewhere in time. 20 years later, Henry has become a degenerate alcoholic when 12 yr old George appears on his doorstep. Henry is forced to overcome the loser he has become to find a way to send George back to the 80s. Hilarity ensues!",0.047262,1,"2011-08-28","Released"
"1884",0,0,"I'm Coming Over","I'm Coming Over reveals a day in the life of Matt Downing, owner and proprietor of I’m Coming Over, specializing in holistic happiness. When traditional therapy has failed, Matt Downing picks up the pieces with common sense, good old fashioned hard work, and a strict avoidance of the modern world.",0.013895,0,"2011-08-14","Released"
"1885",0,0,"Lie Detector","A job interview goes horribly wrong when a lie detector exposes people‘s true feelings about each other.",0.560424,8,"2011-07-22","Released"
"1886",0,0,"Off White Lies","In this bittersweet family comedy, shy teenager Libby moves back to Israel to live with her hapless father Shaul, unexpectedly finding herself without a home as war breaks out around them. Shaul devises a creative solution: posing as refugees, they are taken in by a wealthy family in Jerusalem. Finally in a “normal” household, Shaul and Libby begin to build their father-daughter relationship, but their false identities can’t last forever.",0.082097,1,"2011-10-09","Released"
"1887",0,0,"The President Goes To Heaven","This is the story of the President who was more powerful than God. He ruled the world with an iron fist. But getting into heaven is not easy even for him. All the laws he made for others to follow turns to his detriment. Everything that was done to ruin him turns out to be his salvation. What the President has to do to get into heaven? - Written by Anonymous",0.060822,1,"2011-07-11","Released"
"1888",0,0,"Des Noeuds dans la Tête","",0.009915,0,"2011-07-09","Released"
"1889",0,0,"Sunflower Hour","A behind the scenes look at the seedy underbelly of puppeteering and what it really takes to make it in children's television.",0.616866,1,"2011-07-06","Released"
"1890",300,0,"The Last Time I Saw Soap","""The Last Time I Saw Soap"" was inspired by the hard-edged character films of John Cassavetes. The story centers on four friends as they return from the funeral of another friend who has died suddenly from a brain trauma. Throughout the day and evening, we observe these four different types as they desperately attempt to ""live it up"" in honor of their dead friend. However it soon becomes obvious that these people have been so numbed by virtual technology and social media that they have forgotten how to interact on a regular human level. The evening soon unravels into drunkeness, anger, and sexual hang-ups involving some ill-hired prostitutes. https://vimeo.com/121909948",0.007061,0,"2011-07-05","Released"
"1891",0,0,"I Scream When I Knew What You Did in Friday the 13th of Last Summer Part 2 - I Saw the Hour of the Return of the Revenge in Halloween","Seven years after the massacre of the first film, the survivors Niandra and Eliseu still fear the return of Geison, the terrible psychopath who mutilated his friends on a Friday the 13th. New murders start happening in the small town of Carlos Barbosa, putting a new generation of victims as targets of the killer. But who is behind that ""Scream"" mask?",0.053456,1,"2011-10-20","Released"
"1892",0,0,"Summer of the Zombies","A newly turned zombie struggles to navigate the land of the undead.",0.059678,1,"2011-07-01","Released"
"1893",0,0,"The Nights of Alice","The quiet life of Alice turmoils when her mother knocks on her door after twenty years of absence. Her husband and children discover that Alice lied to them about so many things.",0.3584,0,"2011-06-28","Released"
"1894",0,0,"Respect","The story is simply set around a couple fighting at the breakfast table. All is well, nothing out of the ordinary. Steph announces to his life partner Flippy, the mascot bear for Flipp’s cereals, that he wishes to go to Japan to fulfill his childhood’s dream: study at a Ninja school.",0.044024,1,"2011-06-18","Released"
"1895",0,0,"Courir","",0.006781,0,"2011-06-18","Released"
"1896",5000000,9206470,"Bernie","In small-town Texas, affable and popular mortician Bernie Tiede strikes up a friendship with Marjorie Nugent, a wealthy widow well known for her sour attitude. When she becomes controlling and abusive, Bernie goes to great lengths to remove himself from her grasp.",8.09015,414,"2012-04-27","Released"
"1897",0,0,"The Centre of the Universe","A young girl with a special gift is the only one who can save our universe. Now twenty years later her powers are needed and with the help of a mysterious stranger she must set aside her own doubts and save the universe.",0.005882,0,"2011-06-03","Released"
"1898",15000000,133432856,"The Artist","Hollywood, 1927: As silent movie star George Valentin wonders if the arrival of talking pictures will cause him to fade into oblivion, he sparks with Peppy Miller, a young dancer set for a big break.",8.989766,1397,"2011-06-26","Released"
"1899",14350531,3964682,"Attack the Block","A teen gang in a grim South London housing estate must team up with the other residents to protect their neighbourhood from a terrifying alien invasion.",9.22113,915,"2011-05-12","Released"
"1900",0,0,"The Selling","For most people affected by the recent housing market crash, the impact was financial. Super nice real estate agent Richard Scarry has an additional burden: the paranormal. This startlingly funny debut feature takes many of the tropes of haunted house films and employs them to exciting, witty, and original ends.",0.555836,3,"2011-04-29","Released"
"1901",0,0,"Diseaster","A merry Easter morning in the Northern-European countryside is thoroughly spoiled, when one of carrot farmer and hunter Be's conscientiously sharpened carrot strikes the heart of an Easter bunny hopping around carelessly.  His disabled and hypersensitive son Timmie becomes very upset, but finds comfort in the arms of his sherry-addicted mother, Eva.  However, when their poison-spraying agro-scientist neighbor Draco trips over an empty beer bottle, the exceptionally painful consequences for all those concerned become incalculable.",0.005882,0,"2011-04-23","Released"
"1902",0,0,"Frontalwatte","""Frontalwatte"" is like running against a hard wall and falling down softly. Franz, Adrian and Anastasia stumble through a pointless world. They kill time by viewing apartments, jaw operations, incest and poetry slams. Their search for identity becomes a search for the best fitting role.",0.143053,2,"2016-07-14","Released"
"1903",0,0,"Spilt Milk","A disgruntled grocery store clerk can't quit living in the past until one night his store gets robbed and it changes his future forever.",0.157684,4,"2011-04-10","Released"
"1904",0,0,"Night Of The Alien","Fran, an unemployed slacker and best friend The Lord of Evil and darkness are two lost souls on a road trip through the Southern California desert. They pick up a hitchhiker, who claims to be an Alien from the planet Zoltran.",0.123689,1,"2011-04-08","Released"
"1905",2000000,676045,"All the Time in the World","When Molly, the 21 year-old sister of Maarten, departs the family home, she leaves her older brother with empty nest syndrome. But it also opens up new opportunities for him, such as the possibility to explore his love for Arthur, a closet gay. Molly and Maarten wrestle with their personal relationships and also their relationship with one another, but fate nevertheless seems determined to strike them both down.",0.805918,6,"2011-04-14","Released"
"1906",0,0,"Catharsis","",0.006237,0,"2011-04-04","Released"
"1907",0,0,"Cork's Cattlebaron","A young protege and his boss sit down for the most epic steak dinner of their lives in Omaha, Nebraska.",0.014592,0,"2011-04-02","Released"
"1908",0,0,"Ridicule","This is the story of Romain who has always felt different because of the antlers he was born with. But one day someone is going to change his life and the way people look at him.",0.005882,0,"2011-04-01","Released"
"1909",0,0,"Praça Walt Disney","",0.005882,0,"2011-03-29","Released"
"1910",0,0,"Suck Seed","A group of high-school students forms a band even though they’re not remotely gifted with music. Their intention is to be cool and attract girls. But when a pretty young student turns up and wants to join the band as a guitarist, things start to get interesting.",0.583856,7,"2011-03-17","Released"
"1911",0,0,"The Mushroom Kingdom","A plumber tries to win back his girlfriend.",0.005882,0,"2011-03-14","Released"
"1912",0,0,"Music Lessons","",0.008834,0,"2011-03-12","Released"
"1913",0,0,"Anyone for Tennis?","A mother of three is trying her best to make ends meet. One day the tennis player Rafael Nadal appears. They eat ice-cream and play tennis together and finds themselves in a deserted forest. An absurd but serious story is told about their summer, as wonderful as it is unlikely.",0.006036,0,"2011-01-29","Released"
"1914",0,0,"Paris Shanghai","At the start of his 20,000 kilometre bike ride Manu crosses paths with Victor, a teenager behind the wheel of a stolen car. Manu enjoys travelling, open spaces and making new friends. Victor does not.",0.031639,0,"2011-01-23","Released"
"1915",0,0,"The Strange Thing About the Johnsons","A dark domestic melodrama/satire about the ties that bind and the ties that really bind.",0.796995,6,"2011-01-22","Released"
"1916",0,0,"Quirky Guys and Gals","The movie consists of 4 stories each telling how people survive on life-death choice. The story titles are: Cheering Girls, Boy? meets girl., Claim Night! and The House Full Of 'Abandoned' Businessmen.",0.225743,2,"2011-01-15","Released"
"1917",0,0,"Silent City","If silent pictures were still the only style of film making, how would they look today? What would Charlie Chaplin's 'Tramp' look like? Would Buster Keaton's love story always involve a man and a woman? SILENT CITY is a modern day silent film that weaves together a series of vignettes depicting life in New York City. Illustrating change in society since the original silent film era, as well as the diversity of the Big Apple.",0.005882,0,"2011-01-11","Released"
"1918",0,0,"L'amour, la mort, les fringues (théâtre)","",0.080795,0,"2011-01-11","Released"
"1919",0,0,"The Ballad of Love","",0.041177,1,"2011-01-01","Released"
"1920",0,0,"Blaming George Romero","When 4 horror film fanatic friends, unhappy with their lives, think that a zombie apocalypse is going on they jump on the chance to be ""survivors."" On the way, they learn about their friendship, themselves, and what it means to be happy.",0.006328,0,"2011-01-01","Released"
"1921",0,0,"Holy Moly","After suffering a devastating breakup, Sammy accepts the services of a 'life-enhancement' coach named Tabitha. Tabitha instructs Sammy in the skills every real man should have: shooting a gun, driving a fast car, and being decisive. Sammy attempts to use his new skills to woo back his ex through a series of voicemails, while Tabitha harbors other intentions for her protege",0.00673,0,"2011-01-01","Released"
"1922",0,0,"<U+0412> <U+043E><U+043F><U+0435><U+0440><U+0435>","",0.006729,0,"2011-01-01","Released"
"1923",0,0,"The Problem Is...","Eric meets Julie in a park. Alex, his best friend, tries to convince him to talk to her. The problem is...",0.006009,0,"2011-01-01","Released"
"1924",0,0,"Quem é o Pai do Menino Jesus?","",0.011529,0,"2010-12-26","Released"
"1925",0,0,"Qui a envie d'être aimé ?","",0.058339,1,"2011-02-09","Released"
"1926",0,0,"Pahanjvum e milionater","",0.421102,2,"2010-12-10","Released"
"1927",1500000,8786756,"New Kids Turbo","Five friends from 'Maaskantje' are getting fired because of the economic crisis. They decide that they won't pay for anything anymore.",6.201227,88,"2010-12-09","Released"
"1928",0,0,"Le gang des seniors (théâtre)","",0.009307,0,"2010-12-09","Released"
"1929",0,0,"The Actor","Bob has found the solution to all his problems: he will become an actor, whatever it costs.",0.005947,0,"2010-11-24","Released"
"1930",0,0,"The Track Meet","A runner attempts to woo a woman he sees at the track with the perfect pair of shoes.",0.237355,1,"2010-11-19","Released"
"1931",0,0,"América","Lisa, a beautiful young Russian woman, is married to Victor, a Portuguese. Fernanda, the Spanish ex-wife of Victor, taking advantage of the coming wave of illegal immigrants in Portugal, wants to do business with false passports. Since then, and to Lisa's desperation, her home becomes a halfway house for immigrants of various nationalities and different races, all in search of a better future. Among them is Andrei, a young Ukrainian orthopedist who is wanted by the Russian mafia. Andrei falls in love with Lisa, who sees in him the opportunity to get out of that life. But things are not simple.",0.148268,1,"2011-05-26","Released"
"1932",0,0,"Recycle Me","A young environmentalist sets out to shake the world.",0.022597,0,"2011-02-27","Released"
"1933",0,0,"Day of the Living?","The last three Zombies on earth are trapped inside a cabin, while an angry mob of humans linger outside. The three of them don't have much time to waste as the humans grow restless.",0.006422,0,"2010-11-02","Released"
"1934",0,0,"Rosie","Fifteen-year-old Paul is home alone when he finds himself in front of Rosie, a homeless woman selling jewelry door-to-door to survive. This improbable meeting will have unexpected consequences for both of them.",0.005902,0,"2010-11-01","Released"
"1935",0,0,"Operation Casablanca","Mistaken for a dangerous Islamist, Saadi - a regular guy who happens to be an illegal Arab immigrant - sets out on the most dangerous day of his life. A satirical and thrilling comedy where a wrongly accused suspect gets mixed up in a worldwide terrorist plot.",1.344206,1,"2010-12-02","Released"
"1936",0,0,"Family Guy Presents: It's a Trap!","In this spectacular and offensively uproarious final chapter, Luke Skywalker (Chris) and Princess Leia (Lois) must travel to Tatooine to free Han Solo (Peter) by infiltrating the wretched stronghold of Jabba the Hutt (Joe), the galaxy's most loathsome and dreadful gangster. Once reunited, the Rebels team up with a tribe of Ewoks to combat the Imperial forces on the forest moon of Endor. Meanwhile the Emperor (Carter Pewterschmidt) and Darth Vader (Stewie) conspire to turn Luke to the dark side, and young Skywalker is determined to rekindle the spirit of the Jedi within his father. The Galactic Civil War has never been more outrageous, as the Rebel forces gather to attack the seemingly defenseless and incomplete second Death Star in the battle that will determine the fate of the galaxy.",5.469384,174,"2010-10-22","Released"
"1937",0,0,"The Women on the 6th Floor","Paris, in the early 1960s. Jean-Louis Joubert is a serious but uptight stockbroker, married to Suzanne, a starchy class-conscious woman and father of two arrogant teenage boys, currently in a boarding school. The affluent man lives a steady yet boring life. At least until, due to fortuitous circumstances, Maria, the charming new maid at the service of Jean-Louis' family, makes him discover the servants' quarter on the sixth floor of the luxury building he owns and lives in. There live a crowd of lively Spanish maids who will help Jean-Louis to open to a new civilization and a new approach of life. In their company - and more precisely in the company of beautiful Maria - Jean-Louis will gradually become another man, a better man.",5.82623,125,"2010-12-20","Released"
"1938",0,0,"Loves of a Zombie","Zombie escapes from prison and says in TV that he's in love with a woman, becoming very popular in Haiti. Politicians decide to support his candidature for president.",0.112993,1,"2010-10-22","Released"
"1939",0,0,"<U+0412><U+0438><U+0434><U+0440><U+0438><U+043C><U+0430><U+0441><U+0433><U+043E><U+0440>, <U+0438><U+043B><U+0438> <U+0418><U+0441><U+0442><U+043E><U+0440><U+0438><U+044F> <U+043C><U+043E><U+0435><U+0433><U+043E> <U+043A><U+043E><U+0441><U+043C><U+043E><U+0441><U+0430>","",0.043076,1,"2010-10-06","Released"
"1940",38000000,105610124,"Life As We Know It","After a distastrous first date for caterer Holly and network sports director Messer, all they have is common is a dislike for each other and their love for their goddaughter Sophie. But when they suddenly become all Sophie has in this world, Holly and Messer must set their differences aside. Juggling careers and social calendars, they'll have to find common ground while living under the same roof.",8.315305,1205,"2010-10-02","Released"
"1941",5,0,"Bistro","A restaurant diner is unable to make a pig of himself.",0.052114,1,"2010-10-01","Released"
"1942",0,0,"Shirley Souagnon - Sketch-Up","",0.005882,0,"2010-09-23","Released"
"1943",0,0,"The Butcher, the Chef, and the Swordsman","A tale of revenge, honor and greed follows a group of misfits that gets involved with a kitchen cleaver made from the top five swords of the martial arts world in this wild and brash action comedy.",1.903191,10,"2011-03-17","Released"
"1944",0,864659,"Submarine","15-year-old deep-thinking Welsh schoolboy, Oliver Tate struggles to initiate and maintain a relationship with Jordana, his devilish, dark-haired classmate at their Swansea high school. As his parents' marriage begins to fall apart, similar problems arise in his relationship with Jordana.",7.069048,598,"2011-03-18","Released"
"1945",4500000,0,"Our Day Will Come","Redheaded teen Remy is bullied by his soccer teammates and drawn into fights with his younger sister and mother in their cramped apartment. After a flare-up of domestic violence, he flees home and is tracked down by a bitter guidance counselor, Patrick, also a redhead. Patrick looks upon Remy’s sullen insolence with both sympathy and disdain and decides to toughen him up...",3.340096,50,"2010-09-12","Released"
"1946",3837625,3867000,"West Is West","Comedy sequel to ""East is East"".  Manchester, North of England, 1975. The now much diminished, but still claustrophobic and dysfunctional, Khan family continues to struggle for survival. Sajid, the youngest Khan, the runt of the litter, is deep in pubescent crisis under heavy assault both from his father's tyrannical insistence on Pakistani tradition, and from the fierce bullies in the schoolyard. So, in a last, desperate attempt to 'sort him out', his father decides to pack him off to Mrs Khan No 1 and family in the Punjab, the wife and daughters he had abandoned 35 years earlier. It is not long before Ella Khan (Mrs Khan No2) with a small entourage from Salford, England, swiftly follows to sort out the mess, past and present.",1.738567,18,"2010-10-19","Released"
"1947",0,0,"The Agent","The talent agent Ari Sheinwold is visited one day by his top client Vincent Gallo for a meeting, which begins with some good news. When Sheinwold does not receive the response he expects from Gallo after telling him the ""good news"", the agent begins to reveal his true nature.",0.00673,0,"2010-09-10","Released"
"1948",0,0,"I'm Still Here","I'm Still Here is a portrayal of a tumultuous year in the life of actor Joaquin Phoenix. With remarkable access, the film follows the Oscar-nominee as he announces his retirement from a successful film career in the fall of 2008 and sets off to reinvent himself as a hip-hop musician. The film is a portrait of an artist at a crossroads and explores notions of courage and creative reinvention, as well as the ramifications of a life spent in the public eye.",5.742004,139,"2010-09-10","Released"
"1949",0,1611000,"Trophy Wife","A housewife takes over her husband's umbrella business after his illness.",7.092202,134,"2010-11-10","Released"
"1950",0,0,"The Little Bedroom","One day, a bad fall forces Edmond to accept Rose's help. Eventually, the two grow closer. The young woman finds relief in confiding painful memories to the older man; things she cannot even bring herself to tell her husband. Meanwhile, Edmond, too, opens up, sharing recollections of his beloved wife.",0.062856,1,"2011-09-29","Released"
"1951",5000,1000,"The Big Sleaze","Chuck Peterson is a young slacker with big dreams. Disowned by his family and ignored by his peers, he diligently pursues his dreams of writing a fantastic children's book to become famous and strike it rich. But due to a bipolar disorder and lack of creative talent, he slums his way through life relying on small time scams to keep himself afloat. When his gangster roommate makes him an offer he can't refuse, Chuck immediately takes the chance to clear himself of all his debts. But things go from bad to worse when the plan makes Chuck a prime murder suspect among a plethora of pornographers and terrorists!",0.041474,1,"2010-06-28","Released"
"1952",0,0,"Maldives Express","A young couple in search of their missing child receives a disturbing text message.",0.007424,0,"2010-06-27","Released"
