"","budget","revenue","title","overview","popularity","vote_count","release_date","status"
"1181",28000000,16374328,"Pride and Prejudice and Zombies","A zombie outbreak has fallen upon the land in this reimagining of Jane Austen’s classic tale of the tangled relationships between lovers from different social classes in 19th century England. Feisty heroine Elizabeth Bennet (Lily James) is a master of martial arts and weaponry and the handsome Mr. Darcy (Sam Riley) is a fierce zombie killer, yet the epitome of upper class prejudice. As the zombie outbreak intensifies, they must swallow their pride and join forces on the blood-soaked battlefield in order to conquer the undead once and for all.",11.35054,866,"2016-02-04","Released"
"1182",0,0,"The Human Thing","A thief breaks into the home of a famous writer, unknowingly stealing what turns out to be the only manuscript of an upcoming story. In desperate need of money, he submits it to a contest...",0.036966,0,"2016-01-21","Released"
"1183",0,0,"So Good to See You","Theo and Frances, an artsy downtown couple, are driving to a dinner party at their old friend Zoe's new house in a wealthy suburb of NYC. Lost and frustrated, they call Zoe's husband for directions. When the answering machine picks up, they're unknowingly recorded, making a series of unforgivable comments, criticizing their old friends and their various life choices. After an unexpectedly pleasant reunion over dinner, it quickly becomes a painful nightmare for all. A darkly comic take on the dual realities of friendship.",0.042472,0,"2016-01-21","Released"
"1184",0,0,"Offline: Are You Ready for the Next Level?","Champion gamer Jan has to fight for his digital identity, winning back his real life as well.",2.411727,28,"2016-01-19","Released"
"1185",0,0,"Wert der Arbeit","Night after night Bodo sweeps the empty city streets. Dirty work that no one notices. Attracted by electronic basses and gleaming lights he comes across a vernissage. A strange world in which he makes a familiar discovery and decides not to be invisible anymore.",0.057659,1,"2016-01-19","Released"
"1186",0,0,"Three Women Wait for Death","Miranda and her adult-ish daughters, Hester and Rose, are crammed in a rotting little caravan to be near their irascible Gramps in his final days. They love him but his care bills are mounting and when they discover that he’s hidden his savings and doesn’t remember where... they could bloody kill him.",0.024455,0,"2016-01-19","Released"
"1187",0,0,"The Hardest Thing","The heart-wrenching path of two young couples in their transition from adolescence to adulthood and the trials and tribulations that come with it.",0.022383,0,"2016-01-14","Released"
"1188",0,0,"Ari","Being a kid is tough, being yourself is harder. In the face of humiliation Ari finds courage and self acceptance in the most unexpected way.",0.022453,0,"2016-01-11","Released"
"1189",0,0,"Shame for Swedish: Magnus Betnér och Soran Ismail","No need for a larger presentation. Between them, hundreds of TV shows, an international standup career, Summer in P1, one Kristall, countless debates, several rounds of Sweden on tour, a number of awards such as the comedy of the year, successful radio shows, the year's hot and award-winning podcasts. Now they go together to avoid loneliness on the roads. With standup as a constant starting point, the two biggest satirics on the Swedish scene now form an unbeatable duo where they get racism, zombies and review the reviewers. Naked, hard and honest, they dissect our contemporary. Two comedians who ignore trends and allow society to set the agenda rather than the audience. No matter whether they upset or touch, nobody will leave the show untouched.",0.031583,1,"2016-01-07","Released"
"1190",0,0,"Drawcard","They say a picture tells a thousand words, sometimes its better to keep your mouth shut.",0.100417,2,"2016-01-02","Released"
"1191",300,0,"Paper Planes","In a dream world, the exaggerated lives of six teenagers are thrown into a world of drugs in crime in a typical crime plot in a not so typical world of stolen cocaine, penicillin, Fire Saws, and Carl Jung.",0.047628,0,"2016-01-02","Released"
"1192",0,0,"First Friday","Inspired by the monthly First Friday Event and the Art &amp; Culture of Philadelphia. ""A young boy who wants to be a superhero runs away from home while a group of teenagers plot a gallery heist as the gallery owner is distracted by a smooth-talking art critic.""",0.043812,0,"2016-01-01","Rumored"
"1193",0,0,"Ghosted","A widow's attempts to find love are ruined when the ghost of her cheating dead husband joins her on her dates.",0.022554,0,"2016-01-01","Released"
"1194",0,0,"<U+041F><U+0440><U+043E><U+043F><U+0430><U+0433><U+0430><U+043D><U+0434><U+0430>","",0.022353,0,"2016-01-01","Released"
"1195",0,0,"C'est La Vie","In a series of clinical tableau comprising a sort of apocalyptic travelogue of the LA streets, an aggressive homeless man berates the viewer regarding the circumstances of his life and the wrongness of everything.",0.022564,0,"2016-01-01","Released"
"1196",0,0,"Monty Comes Back","After fighting with his boss and losing his job, Monty, a semi-successful thespian, flees back home to live with his parents under false pretenses. His old friends and family are left to deal with his inflated ego, while he comes to terms with the fact he isn't as 'great' as he may believe.",0.377226,1,"2016-09-03","Released"
"1197",0,0,"Bark","BARK is a portrait of a seemingly simple argument between two teenage girls that curdles into a surreal, psychological struggle.",0.065033,0,"2016-01-01","Released"
"1198",0,0,"Will Get Married Urgently","Jenia is a workaholic - glossy magazine editor. Stas is celebrity photographer. She is ambitious, and he on the contrary always relaxed. Jenia's ig dream is to become editor in chief, but for that to happen she needs to find a husband immediately! The condition given by the shareholders of the magazine is strict: since magazine is family-oriented - it needs a family person as a boss. To solve this problem Jenia has only a week. Stas decides to help the girl, having connections of lot of bachelors who could well fit to be the future husband. But Jenia suddenly realizes that she is not that ambitious, and Stas was surprised to discover he is in love.",0.382564,2,"2015-12-31","Released"
"1199",0,0,"The Thumb Wrestler","An epic tale about life, heartache and thumb wrestling.",0.0696,0,"2015-12-31","Released"
"1200",10333,0,"Prach a broky","",0.022353,0,"2015-12-26","Released"
"1201",0,0,"Questioning","In this dog world, a hard-to-crack police officer tries to uncover a truth about Biscroc's theft.",0.061337,0,"2015-12-22","Released"
"1202",0,0,"Vojtech","",0.111028,1,"2015-12-17","Released"
"1203",0,0,"Po nebu bosikom","",0.031773,0,"2015-12-17","Released"
"1204",0,0,"All Roads Lead to Rome","Maggie is an uptight, single mother and college writing teacher from New York City. In an effort to reconnect with her troubled teen daughter Summer, she decides to embark on a journey to a Tuscan village where she frequented in her younger days. Upon arrival, Maggie runs into Luca a handsome former lover who is still a bachelor and lives with his eighty-year-old mother Carmen. Summer (missing her “bad boy” boyfriend in NYC) and Carmen (secretly planning a wedding against Luca’s wishes to MARCELINO, her one true love in Rome) impulsively steal Luca’s car and race off to Rome. Maggie and Luca quickly pursue allowing the two mismatched couples to spend some time together and develop a new understanding of each other.",5.489891,99,"2016-01-14","Released"
"1205",2400000,0,"Der grosse Sommer","",0.195651,2,"2016-01-28","Released"
"1206",0,0,"Half Sister, Full Love","Pierrick is still dealing with the recent disappearance of his brother. Then why not accept the invitation of Tessa, his best friend, at her family home in order to spend a week alone to meditate on his life?",3.482749,58,"2016-01-13","Released"
"1207",0,3371692,"A Man Called Ove","Despite grumpy 59 year-old Ove being deposed as president of his condominium association, but he keeps looking over the neighbourhood with an iron fist. When pregnant Parvaneh and her family move into the terraced house opposite Ove and she accidentally back into Ove’s mailbox, it sets off a series of unexpected changes in his life.",10.330778,308,"2015-12-25","Released"
"1208",60000000,101134059,"Joy","A story based on the life of a struggling Long Island single mom who became one of the country's most successful entrepreneurs.",12.710429,2049,"2015-12-24","Released"
"1209",0,0,"Halal Love","Four tragicomic interconnected stories about how devoted Muslim men and women are trying to manage their love life and desires without breaking any religious rules.",0.147956,1,"2016-07-07","Released"
"1210",0,0,"A Dog for Christmas","The entire family stays at Dave and Sandy's home for the holidays. Kassandra wants a puppy for Christmas, but Mom and Dad aren't ready for that. Will Santa grant Kassandra's only wish for Christmas?",0.057943,1,"2015-12-12","Released"
"1211",0,0,"Waiting","Two strangers meet in a hospital where their respective partners lie in a coma. Their meeting sees them start to re-examine what they want to do with their lives as they deal with their grief and sadness.",0.499825,5,"2016-05-27","Released"
"1212",0,1510000,"SOS, Santa Claus or Everything Will Come True!","A little girl Sveta has only one New Year wish - to make peace between her parents.",0.060619,0,"2015-12-10","Released"
"1213",50000000,242786137,"Daddy's Home","The story of a mild-mannered radio executive (Ferrell) who strives to become the best stepdad ever to his wife's two children, but complications ensue when their freewheeling, freeloading real father arrives, forcing stepdad to compete for the affection of the kids.",11.209872,1249,"2015-12-25","Released"
"1214",0,233755553,"Alvin and the Chipmunks: The Road Chip","Through a series of misunderstandings, Alvin, Simon and Theodore come to believe that Dave is going to propose to his new girlfriend in New York City - and dump them. They have three days to get to him and stop the proposal.",11.248899,590,"2015-12-17","Released"
"1215",0,0,"Karma Police","An eager-to-please Ticket Inspector struggles with the morality of her job after being given the following ultimatum: fine or be fired!",0.022447,0,"2015-12-05","Released"
"1216",0,0,"The Sabbatical","James Pittman is a burnt-out photography professor who goes on sabbatical and straight into a mid-life crisis. A young artist named Lucy comes into his life and he tries desperately to recapture the lost spirit of his youth.",0.021407,0,"2015-12-03","Released"
"1217",0,0,"HPL Insurance","You can't control the gibbering madness that lies waiting on the edge of our reality but for a small monthly premium you can ensure that you don't pay for it when things go eldritch.",0.041572,0,"2015-12-02","Released"
"1218",0,0,"Recommendation","A salesgirl at a grocery store recommends a sausage to a customer in such a sincere and humble way that he falls in love for her.",0.2082,0,"2015-12-01","Released"
"1219",0,0,"La révolution n'est pas un dîner de gala","Lola is hitch-hiking on a highway rest area when she meets Karim. He agrees to drive her all the way to Paris. Lola wants to become a film actress. Karim wants to change the course of History. The revolution will happen with or without them.",0.105701,0,"2015-12-01","Released"
"1220",0,0,"Ruben fête ses 25 ans","",0.021246,0,"2015-12-01","Released"
"1221",0,0,"Counter Clockwise","Counter Clockwise is a sci-fi thriller/dark comedy about a scientist who accidentally invents time travel and is zapped six months into the future. He finds himself in a sinister upside down world where his wife and sister are murdered and he's the main suspect. He's forced to go back in time to uncover the mystery surrounding their deaths.",0.616108,3,"2016-10-04","Released"
"1222",0,0,"Les Stars : Daniel Prévost & Jacques Balutin","",0.041507,0,"2015-11-25","Released"
"1223",0,0,"Hippocampus","Erkan changes his gender and become a transexual. The doorman of his apartment has a crush on Erkan's woman view. The doorman witnesses the argument between Erkan and two men. He finds out that that Erkan is originally a man under the attractive woman view. The doorman is frustrated.",0.041665,0,"2015-11-25","Released"
"1224",0,0,"The Garbage Helicopter","Somewhere in Sweden, a gigantic dumpster breaks free from a heavy chain suspended underneath a big helicopter. The dumpster hits the ground with a formidable crash and the garbage spouts out into the surroundings. Meanwhile, an aging Roma woman wakes up in her house with an extremely strong desire to get her old wall clock back.",0.352638,2,"2015-11-23","Released"
"1225",0,0,"Piano","Marta hauls a piano home from a used music shop. She almost succeeds. Albert tries for the thirtieth year already to tell Paula that he loves her. He almost succeeds. Paula wants to respond to Albert in the same vein. She almost succeeds. Police commissioner Kits has dreamed of parachuting all his life. He almost succeeds. Mirjam wants be become a circus artist. She almost succeeds. A honeybee tries to get out past a closed window. It almost succeeds. A film without main characters where the lives of characters that have lost their head intertwine in a dramatic and less dramatic way in an ordinary concrete panel apartment building.",0.059859,1,"2015-11-18","Released"
"1226",0,0,"On the Path","A road in the middle of nowhere. A car. A bike. Two lonely people looking for the same thing. They meet.",0.021258,0,"2015-11-16","Released"
"1227",0,0,"Flykten från enplansvillorna","Salomon has achieved everything he ever wanted. From the outside it looks as if he is living the suburban dream with a good looking wife, kids and a nice house. But still he can't get rid of the feeling that something is lost and that he's constantly drifting apart from his family. A film about love, death and God.",0.029648,0,"2015-11-15","Released"
"1228",0,0,"The Boss's Daughter","40-year-old foreman Vital is chosen by Alix (25) as a guinea pig in the anonymous study she is carrying out in her father's factory.  The boss's daughter soon finds herself falling under the spell of this reserved, enigmatic worker as he begins to open up to her, revealing his dreams of another life.",3.521834,34,"2016-01-06","Released"
"1229",0,0,"Midori in Hawaii","Midori is a struggling wedding photographer in Kona, Hawaii. Her small world in thrown off balance when Seiko, her judgmental sister comes to visit from Japan.  As the sisters travel the island together the reason for Seiko's visit gradually becomes and old grudges and mistrust begin to surface.  'Midori in Hawaii' is a small, breezy comedy that explores the nature of memory and the lifelong relationship between siblings.",0.061594,0,"2015-11-14","Released"
"1230",28000000,133346506,"The Big Short","The men who made millions from a global economic meltdown.",18.495044,3482,"2015-12-11","Released"
"1231",0,0,"Dad in Training","",2.686578,49,"2016-04-06","Released"
"1232",0,0,"#Garotas - O Filme","",0.021181,0,"2015-11-12","Released"
"1233",0,0,"Shitcago","In its minimal and non-traditional plot, Shitcago follows a seemingly mundane day in the life of a young loner living in Chicago as he wanders around the city and encounters many idiosyncratic characters.",0.037216,0,"2015-11-11","Released"
"1234",0,0,"The Chop","A comedy about Yossi, a charismatic Kosher butcher who loses his job, cannot find work at other Kosher butchers, and decides to pretend to be Muslim in order to get work at a Halal butchers.",0.105564,2,"2015-11-08","Released"
"1235",0,0,"El tiempo de los monstruos","",0.132951,3,"2016-04-23","Released"
"1236",0,0,"The Painter","A starving artist struggles to meet an impending deadline as his upstairs neighbor does everything imaginable to distract him.",0.022447,0,"2015-11-06","Released"
"1237",1000000,0,"Hortensia","Hortensia's father is electrocuted with the refrigerator door; she is fired from work; she discovers that her boyfriend is cheating on her with her best friend. Desperate, follows the goals she wrote when was fourteen: ""to marry a boy who is blond like my father and to design the most beautiful shoe in the world."" Things will only get worse while she fails to listen to her true self.",0.117866,1,"2015-11-19","Released"
"1238",0,0,"One Hell of a Plan","Two burglars release dozens of cats into a neighbourhood and start the dogs barking. They use the din to their advantage and dig up a bag of loot. However, the situation snowballs and turns into the worst night the burglars ever spent.",0.245986,0,"2015-11-04","Released"
"1239",0,0,"Don't tell Mom","A nocturnal education film, designed to help children develop their emotions and expressions as well as language and physical skills by enjoying singing and exercising with a big brother.",0.021251,0,"2015-11-01","Released"
"1240",0,0,"Afternoon Class","He's trying to stay awake in an afternoon class.",0.091445,2,"2015-10-31","Released"
"1241",0,0,"Noch ein Seufzer und es wird Nacht","",0.025795,0,"2015-10-31","Released"
"1242",0,0,"Best Wishes from Millwood","An unhappy housewife is visited by a bicycle-riding stranger with wish-making cookies.",0.056017,0,"2015-10-30","Released"
"1243",200000,0,"The Night Is Young","This is the story of the night Matt and Dave met Amy and Syd. All feeling a bit fed up with their jobs and Los Angeles, luck would have it that they decide to go to the same bar on the same night. Thankful to meet anyone who isn't painfully self absorbed, the drinks pile up as the four twenty-somethings find unexpected friendships, and maybe something more",0.949145,2,"2015-10-29","Released"
"1244",0,0,"Love Arumirai","The story has to do with the seven-year marriage between Geng (Pitsanu Nimsakul) and fashion model Bella (Sheranut Yusananda) turning stormy. The bickering husband and wife face their toughest test yet when they wake up one morning and get a shock when they go to the mirror.",2.669784,1,"2015-10-29","Released"
"1245",0,0,"We Are Happy","Sarah and Paul had the perfect marriage, until their best friends turned up.",0.020549,0,"2015-10-29","Released"
"1246",0,0,"Her Father, My Lover","Taeko’s friend Maya confesses that she has a crush on Taeko's father. Taeko tells her father and mother. Taeko's mother laughs and Taeko's father acts like its not a big deal. Since then, Maya rushes to Taeko's father.",0.071502,0,"2015-12-19","Released"
"1247",1211360,3129507,"Without Borders","Few not connected novels about the love. Few couples falling in love in different places of post USSR: Moscow, Georgia, Armenia.",1.686065,7,"2015-10-22","Released"
"1248",0,0,"Siro Gortsakic","",0.131884,2,"2015-10-22","Released"
"1249",0,0,"600 PS für zwei","",0.065066,0,"2015-10-22","Released"
"1250",1150118,0,"Girl Asleep","The world is closing in on Greta Driscoll. On the cusp of turning fifteen she can't bear to leave her childhood, it contains all the things that give her comfort in this incomprehensible new world. She floats in a bubble of loserdom with her only friend Elliott, until her parents throw her a surprise 15th birthday party and she's flung into a parallel place; a world that's weirdly erotic, a little bit violent and thoroughly ludicrous - only there can she find herself.",2.721088,44,"2016-06-18","Released"
"1251",0,0,"Cosmic Scrat-tastrophe","Scrat struggles once again to protect his nut.",3.207014,54,"2015-11-06","Released"
"1252",99000000,246233113,"The Peanuts Movie","Snoopy embarks upon his greatest mission as he and his team take to the skies to pursue their arch-nemesis, while his best pal Charlie Brown begins his own epic quest back home.",7.753343,722,"2015-11-05","Released"
"1253",0,0,"The Flame","How far will one go to preserve the world they are accustomed to… Olya is unshakable to the blows of fate, she always strikes first instead of being hit. Everyone who is not with her is against her. However one day the moment comes when she has to reconsider her view of life…",0.021832,0,"2015-10-18","Released"
"1254",0,0,"Ratking","Fearing the anger of his boss Erik, the mad shorty Rene tries to keep a low profile at a campground near Lake Constance where he has to deal with small-town bureaucracy and bizarre campground residents.",0.05562,1,"2015-10-16","Released"
"1255",0,3254,"Elixir","A modern fairy tale with scientists, partisans, cosmonauts, officials, and the Motherland. The scientist and his assistant are collecting the ingredients for an elixir that can resurrect dead people to life. At the same time, officials are looking for the carpenter who has a power to transmute water into oil.",0.034588,0,"2016-03-17","Released"
"1256",0,0,"Problemski Hotel","The cross-frontier migrant's life 'within the system' - an endless, featureless, futureless round of queues - becomes even bleaker in December. Bipul doesn't want to admit it, but the arrival of Lidia, a Russian girl makes a difference. Hope? Surely not! A future? Get real! December is also the ninth month of Martina's pregnancy. But, just when the situation seems hopeless, help is at hand. A Christmas story.",0.033201,0,"2016-01-13","Released"
"1257",0,0,"The Red Thunder","Sarah, a nerdy teenager, needs her mom's new car to go on a date with the boy she likes, but her mom won't let her drive the vehicle. She decides to steal it and go on her date, but something unexpected happens with the car that will change Sarah's life forever...",0.031633,0,"2015-10-12","Released"
"1258",0,0,"Sacramento","A convoy of stories that feature caricature views on religion. We get to see Pope Francis, a neighborhood priest who thinks he’s Jesus Christ, a cable TV Evangelist hustler, a Hegelian woman looking for truth in spirituality, and other weirdoes that belong to a freak circus.",0.020796,0,"2015-10-12","Released"
"1259",0,0,"Les Filles au Moyen-Âge","The history of women through the Middle Ages as told to and by little boys and girls and an old man (Michael Lonsdale)",0.080905,1,"2016-01-27","Released"
"1260",0,0,"Die Badewanne","The short film tells the story about three brothers who try to dive back into their childhood by re-enacting an old family picture.",0.071191,1,"2016-02-06","Released"
"1261",0,0,"Chaotic Love Poems","A cheerful yet serious Indonesian Romeo and Juliet. A boy and a girl from the same district, but with difficult childhoods and other reasons not to acknowledge their love. Through the colourful and musical retro style - the 1970s came late to Indonesia - shines a chaotic political and social era.",0.025344,0,"2016-02-04","Released"
"1262",0,0,"The Student and Mister Henri","Because of his wavering health, Monsieur Henri can no longer live alone in his Paris appartment.  Particularly grumpy, he ends up nonetheless accepting his son Paul's suggestion that he let one of his rooms out to a young female student.  Far from falling for her charms, Henri uses her to orchestrate utter family chaos...",5.950234,127,"2015-10-07","Released"
"1263",0,0,"I Follow You","Anna bumps into Jesper on the morning train. She’s never seen him before, but it turns out he knows everything about her.  A short film about social media and surveillance in postmodern society.",0.063676,1,"2015-10-03","Released"
"1264",0,0,"YOLO: The Movie","Two friends seek dating advice from a guy they meet on the Internet.",0.091609,1,"2015-10-03","Released"
"1265",0,0,"The Audition","Robert De Niro and Leonardo DiCaprio must compete for the lead role in Martin Scorsese's next film.",2.125465,29,"2015-10-03","Released"
"1266",0,0,"Bakuman","Moritaka Mashiro (Takeru Satoh) doesn't want to follow in the path of his uncle who worked as a manga artist, but ultimately died because of exhaustion. Moritaka Mashiro figures he will graduate from school and work at an office. Things change though when falls in love with a girl at school. The girl, who hopes to become a voice actress, tells Moritaka they can marry, but only after they both achieve their dreams. Moritaka then teams up with fellow classmate Akito Takagi (Ryunosuke Kamiki) to publish their first manga.",1.097208,13,"2015-10-01","Released"
"1267",0,0,"María Bonita","The Mexican diva of cinema, María Felix, age 80, is staying as a guest at the home of a family in Veracruz. There she meets the daughter of the owners, Agatha, age 16, who wants to know what does the actress do to be so beautiful at her age. They become friends, live adventures and María reveals her secrets.",0.028608,0,"2015-10-01","Released"
"1268",0,0,"Octopus","Squid have 10 legs. Octopuses have 8 legs. Added together, that’s 18 legs.",0.021214,0,"2015-10-01","Released"
"1269",0,0,"The Cult of Carano","A local man attempts to take advantage of a global crisis by forming a proper cult. Like every good cult, there is a nefarious end game.",0.056048,1,"2015-09-26","Released"
"1270",0,0,"Frisky","Two twenty-somethings move to San Francisco to chase their career, but end up chasing tail instead.",0.02001,0,"2015-09-26","Released"
"1271",0,0,"Mormoan","A day in the door to door life of a lonely Mormon.",0.020033,0,"2015-09-26","Released"
"1272",0,0,"Fuck Buddies","Platonic room-mates Joseph and Ellie try to 'keep it casual' when they find themselves manipulated by an otherworldly force to begin having sex with each other.",0.590106,1,"2015-09-25","Released"
"1273",0,0,"Fleur de cactus (théâtre)","",0.298855,1,"2015-09-25","Released"
