"","budget","revenue","title","overview","popularity","vote_count","release_date","status","runtime","production_companies","production_countries"
"81",0,0,"Red Dog: True Blue","Explores the early events leading up to Red Dog's discovery on the road to Dampier, and his ultimate rise from ordinary dog to Australian legend.",3.943586,29,"2016-12-26","Released",88,"Woss Group Film Productions, ","Australia, "
"82",0,0,"Survival Family","A world wide electrical outage occurs. Everything that requires electricity comes to a stop. Tokyo is nearly ruined. Yoshiyuki Suzuki (Fumiyo Kohinata) decides to escape from Tokyo with his family.",1.264761,8,"2017-02-11","Released",117,"Altamira Pictures Inc., Dentsu Inc., Toho Company, Ltd., Fuji Television Network, ","Japan, "
"83",0,0,"Christmas with the Andersons","Drowning in tinsel and lights every Christmas, Michael and Caroline Anderson throw the year’s biggest party at their house. But this year, with Michael jobless and Caroline’s store struggling, that tradition may end. The Andersons decide to host a very different kind of party and, in the process, rediscover what’s most important about the holiday.",0.07922,1,"2016-12-09","Released",90,"Marvista Entertainment, ION Television, ","United States of America, "
"84",0,0,"I'll Be Home for Christmas","Jackie Foster, a dynamic Assistant District Attorney and single mom, is looking forward to wrapping up her latest case and spending Christmas with Gracie, her adorable and precocious, eight-year old daughter. But when Jackie’s estranged dad, Jack , a gruff retired police officer, unexpectedly shows up at her door, they will be forced to confront old wounds.",2.114651,24,"2016-11-27","Released",84,", , ",", , "
"85",0,0,"Boxing Day: A Day After Christmas","Money is not necessarily the key to happiness. It can easily be considered man's worst downfall. Michael Adeyemi was destined to be a billionaire by the age of 35 and with money comes access to the fine things of life. Find out how Michael's desperate quest for fortune and success would cost him the number one thing money cannot buy - Family. Blinded by selfish ambitions, pride and appetite for greed leads him down a path of self-destruction, blinding him to the only thing that is worth saving. It all comes crashing down on ""Boxing Day"" where Michael is swept under a sea of adversities caused by none other than himself. Watch this downpour of self-inflicted wave of adversities with rippling effects that triggers thought provoking questions, of love, pain, pride and ultimate redemption - what if you never get that second chance?",2.688612,0,"2017-02-12","Released",114,"Prime International Productions, Gifted Gift Studios, ","Nigeria, "
"86",150000000,643331111,"Moana","In Ancient Polynesia, when a terrible curse incurred by Maui reaches an impetuous Chieftain's daughter's island, she answers the Ocean's call to seek out the demigod to set things right.",5.596225,4848,"2016-11-23","Released",107,"Walt Disney Pictures, Walt Disney Animation Studios, ","United States of America, "
"87",180000000,809342332,"Fantastic Beasts and Where to Find Them","In 1926, Newt Scamander arrives at the Magical Congress of the United States of America with a magically expanded briefcase, which houses a number of dangerous creatures and their habitats. When the creatures escape from the briefcase, it sends the American wizarding authorities after Newt, and threatens to strain even further the state of magical and non-magical relations.",30.684299,8159,"2016-11-16","Released",133,"Heyday Films, Warner Bros. Pictures, ","United Kingdom, "
"88",0,0,"The Geneva Convention","As Hakim is waiting for the bus after class, he is caught in a vendetta between teenagers. He is not exactly keen to get into a fight, but how can he possibly avoid an awaited confrontation?",0.04943,0,"2016-11-04","Released",15,"Année Zéro, Région Lorraine, Centre National de la Cinématographie, ","France, "
"89",0,0,"Loewie","One quiet autumn evening, Elisa gets a surprise visit from her grandfather. He tells her an enchanting Saint-Nicolas story...",0.073844,1,"2016-10-29","Released",48,"Penthouse Productions, ","Belgium, "
"90",0,0,"Shed Skin Papa","As a director faces a series of setbacks in life including debt and divorce, his elderly father suddenly regains his youth.",0.173016,0,"2016-12-16","Released",101,"Shaw Brothers, ","Hong Kong, "
"91",0,0,"Las furias","",0.369842,4,"2016-11-11","Released",NA,"Aquí y Allí Films, Televisión Española, ",", , "
"92",0,0,"Up in the Sky","Pottan is going to a riding camp, but ends up at a recycling center where she is taken care of by the strange staff. One day Pottan finds out that the staff are building a space rocket.",0.039558,0,"2016-10-21","Released",82,"Film i Väst, ","Sweden, "
"93",30000000,2351359,"Ballerina","Set in 1879 Paris. An orphan girl dreams of becoming a ballerina and flees her rural Brittany for Paris, where she passes for someone else and accedes to the position of pupil at the Grand Opera house.",14.605207,684,"2016-12-14","Released",89,"Main Journey, Caramel Films, Quad Productions, ","Canada, France, "
"94",0,0,"Tatu and Patu","",0.159624,0,"2016-10-19","Released",75,"Dionysos Films Oy, ","Finland, "
"95",125000000,346864462,"Trolls","Lovable and friendly, the trolls love to play around. But one day, a mysterious giant shows up to end the party. Poppy, the optimistic leader of the Trolls, and her polar opposite, Branch, must embark on an adventure that takes them far beyond the only world they’ve ever known.",19.172778,1381,"2016-10-13","Released",92,"DreamWorks Animation, 20th Century Fox, ","United States of America, "
"96",111000000,296485718,"Miss Peregrine's Home for Peculiar Children","A teenager finds himself transported to an island where he must help protect a group of orphans with special powers from creatures intent on destroying them.",17.762961,4641,"2016-09-28","Released",127,"Big Screen Productions, Chernin Entertainment, Tim Burton Productions, SCOPE Pictures, St. Petersburg Clearwater Film Commission, TSG Entertainment, Ingenious Media, 20th Century Fox, ","Belgium, United Kingdom, United States of America, "
"97",0,0,"Heartland","A young Oklahoma artist, struggling with a recent death, finds escape in a reckless affair with her brother's girlfriend.",0.642737,8,"2016-09-24","Released",98,", , ",", , "
"98",0,0,"One Hundred and Fifty Years of Life","A 90-year-old man struggles to care for his mentally handicapped son.",0.216174,2,"2016-09-22","Released",93,"Liu Yu Film Studio, ","China, "
"99",2500000,0,"Rolli and the Secret Route","Rolli and little elf girl Juniper along with the rest of the rollis and other strange creatures lead peaceful and rollishly fun lives in their flourishing Rolli Village. One day the inquisitive friends Rolli and Juniper hear incredible news from Malcolm the Maggot: somewhere far away, beyond mountains, forests and the sea, lies a place called The Beginning of All Time. That’s where the storks always take off on their trips to deliver babies in small bundles to their new homes. Rolli and Juniper cannot help but become curious. Both of them have fallen into Rolli Village in a bundle from the sky, and especially Juniper has always wondered where she came from. The two friends decide to throw themselves into a joint adventure. They embark on a trip toward The Beginning of All Time in order to find the answer to life’s greatest secret.",0.205423,0,"2016-09-16","Released",82,"Matila Röhr Productions (MRP), ","Finland, "
"100",0,0,"Hey Bunny","A misanthropist ex-hacker is suspected of sabotaging a famous happiness-research facility. He is forced to prove his innocence and stumbles into a wild adventure, during which he involuntarily becomes an idealistic activist, has to deal with strange, possibly supernatural rabbits and his crazy family - and regains a little belief in happiness.",0.53135,2,"2017-04-27","Released",90,"Hot Couple Film, ","Germany, "
"101",0,0,"Your Mother and I","Johnna's dad changed the world. Or so he says. Whilst Johnna and her dad are talking, they can't seem to connect, each growing more and more frustrated with one another, revolving around one another in their own orbits.",0.044477,0,"2016-09-14","Released",14,"Paper Bag Productions, Low Sky Productions, Meraki Moving Pictures, ","United Kingdom, Canada, "
"102",75000000,632443719,"Sing","A koala named Buster recruits his best friend to help him drum up business for his theater by hosting a singing competition.",15.388534,3101,"2016-11-23","Released",108,"Illumination Entertainment, Universal Pictures, Dentsu, Fuji Television Network, ","United States of America, "
"103",0,0,"Good Luck, Orlo!","A baby has died. Orlo's parents are consumed with grief. In an attempt to make them happy and his family whole again, Orlo does something unexpected.",0.032568,0,"2016-09-10","Released",15,"Kinorama, Zwinger Film, ","Slovenia, Croatia, "
"104",0,0,"Weirdos","Two Nova Scotian teens who hit the road in July 1976 accompanied by the laconic ghost of (the still-living) Andy Warhol.",0.700342,7,"2016-09-09","Released",89,", , ","Canada, "
"105",0,0,"Indice 50","A family, composed of a strapping father, a mother with an authoritarian temper and an excited young boy, land on a crowded beach for their summer holidays. After struggling for several minutes to find a spot, the family, really organized, begin to settle themselves. However during that topping ritual, a fast and cunning mosquito is going to break the family chain. Owing to the little insect, their wonderful day will be transformed into a true hell.",0.115977,2,"2016-12-26","Released",5,"ESMA, ","France, "
"106",0,0,"Mad World","An absentee father and his bipolar son are forced to live together as they struggle with a recent family tragedy. The tension and anxiety boil as they live and try to cope in a tiny apartment. As time passes, they realize their shared pain is not their only source of grief, as they find the outside world is a cruel and unjust place.",0.755298,4,"2016-10-13","Released",101,", , ","Hong Kong, "
"107",0,0,"Jesús","18-year-old Jesús lives with his stern, somewhat unaffectionate father in Santiago, Chile. When not doing drugs, having casual sex or simply slouching in front of the TV, Jesús and his friends perform in a K-pop boyband. But his routine is thrown into chaos one evening when he and his drunken posse viciously assault a young gay man and leave him for dead. It’s an act that propels Jesús into a profound moral crisis which have severe consequences.",0.676556,2,"2016-08-24","Released",85,"unafilm, Don Quijote Films, JBA Production, ","Colombia, France, Chile, Germany, Greece, "
"108",1000,0,"Star David","12 y.o. Jewish girl Dinka studies at Machon (Jewish orthodox orphanage). Lone middle-aged Hana, the Machon headmistress, exerts best efforts to educate girls in the spirit of Jewish tradition and to protect them from the temptations of the outside world. Once Dinka has watched a boring b-movie on TV and felt in love with Hollywood actor David Travis, a muscular handsome moustachette. She decides to marry him by the Talmudic rules and writes letters to Hollywood.",0.289026,0,"2016-08-20","Released",16,"VKSR, ","Russia, Ukraine, "
"109",60000000,69929545,"Kubo and the Two Strings","Kubo mesmerizes the people in his village with his magical gift for spinning wild tales with origami. When he accidentally summons an evil spirit seeking vengeance, Kubo is forced to go on a quest to solve the mystery of his fallen samurai father and his mystical weaponry, as well as discover his own magical powers.",17.718356,1352,"2016-08-18","Released",102,"Focus Features, Laika Entertainment, ","United States of America, "
"110",30000000,57814445,"Nine Lives","A stuffy businessman finds himself trapped inside the body of his family's cat.",9.040487,383,"2016-08-03","Released",87,"Fundamental Films, EuropaCorp, ","China, France, "
"111",65000000,143695338,"Pete's Dragon","Pete is a mysterious 10-year-old with no family and no home who claims to live in the woods with a giant, green dragon named Elliott. With the help of Natalie, an 11-year-old girl whose father Jack owns the local lumber mill, forest ranger Grace sets out to determine where Pete came from, where he belongs, and the truth about this dragon.",12.995466,932,"2016-08-10","Released",102,"Walt Disney Pictures, ","United States of America, "
"112",0,0,"A Field Day","Middle-aged Cheolgu is laid off with no advance notice. Looking for a new job is not easy and neither is the situation that his family members are in. A movie that takes a cheerful, positive look at life while maintaining the balance of a group drama involving diverse characters.",0.531784,0,"2018-03-22","Released",75,", , ","South Korea, "
"113",0,0,"<U+ADF9><U+C7A5><U+D310> <U+C694><U+AD34><U+C6CC><U+CE58> <U+C5FC><U+B77C><U+B300><U+C655><U+ACFC> 5<U+AC1C><U+C758> <U+C774><U+C57C><U+AE30><U+B2E4><U+B0E5>!","",0.043648,0,"2016-07-20","Released",NA,", , ","Japan, "
"114",0,0,"Manifest Destiny: The Lewis & Clark Musical Adventure","This musical comedy weaves together sharp satire and heartfelt storytelling into a grand adventure. Through ten original songs, the film follows gruff explorer William Clark and his naturalist companion Meriwether Lewis as they blaze a trail to the Western waters. Along the way, they encounter the wise Sacagawea, battle the elements, and find that President Thomas Jefferson has some surprises up his sleeve.",0.199258,0,"2016-07-13","Released",91,"Parisi Pictures, New Renaissance Pictures, ",", , "
"115",0,0,"VULKAN","",0.063533,1,"2016-07-08","Released",NA,", , ","Sweden, "
"116",0,0,"Center of My World","A strange family: 17-year-old Phil lives with his mother and twin sister in an old mansion on the outskirts of town. When he returns from summer camp, the mood in the mansion has soured somehow. Phil doesn’t worry about it, hanging out with his best friend Kat instead. When he starts to feel attracted to a mysterious new student at school, Phil is plunged into emotional turmoil only exacerbated by the trouble at home.",5.13363,58,"2016-11-10","Released",115,"Prisma Film- und Fernsehproduktion, Österreichischer Rundfunk (ORF), ARTE, Westdeutscher Rundfunk (WDR), Bayerischer Rundfunk (BR), Universum Film (UFA), Neue Schönhauser Filmproduktion, Mojo Pictures, ","Austria, Germany, "
"117",105000000,408579038,"Ice Age: Collision Course","Set after the events of Continental Drift, Scrat's epic pursuit of his elusive acorn catapults him outside of Earth, where he accidentally sets off a series of cosmic events that transform and threaten the planet. To save themselves from peril, Manny, Sid, Diego, and the rest of the herd leave their home and embark on a quest full of thrills and spills, highs and lows, laughter and adventure while traveling to exotic new lands and encountering a host of colorful new characters.",34.304443,1632,"2016-06-23","Released",100,"Blue Sky Studios, Twentieth Century Fox Animation, ","United States of America, "
"118",75000000,875457937,"The Secret Life of Pets","The quiet life of a terrier named Max is upended when his owner takes in Duke, a stray whom Max instantly dislikes.",6.903046,4224,"2016-06-18","Released",87,"Universal Pictures, Fuji Television Network, Dentsu, Illumination Entertainment, ","United States of America, "
"119",0,0,"Fishtales","After a shark attack leads to Cleo and Puffer's eight-legged octopus friend Ollie getting lost in the ocean, a fun-loving manta ray named Crash helps them search the sea to find their lost mate. Along their journey they meet all sorts of fascinating creatures of the deep and learn about each and every one of them during their aquatic adventure..",0.295756,4,"2017-06-22","Released",72,", , ","United States of America, "
"120",0,0,"Piper","A mother bird tries to teach her little one how to find food by herself. In the process, she encounters a traumatic experience that she must overcome in order to survive.",7.90063,659,"2016-06-16","Released",6,"Pixar, ","United States of America, "
"121",200000000,1028570889,"Finding Dory","Dory is reunited with her friends Nemo and Marlin in the search for answers about her past. What can she remember? Who are her parents? And where did she learn to speak Whale?",18.056297,5764,"2016-06-16","Released",97,"Pixar, ","United States of America, "
"122",0,0,"Thai Jashe!","Thai Jashe! is an upcoming urban Gujarati film written and directed by Nirav Barot. The film is about the struggles of a middle class man to achieve his goals in the metrocity Ahmedabad. The film stars Manoj Joshi, Malhar Thakar and Monal Gajjar.",0.377256,2,"2016-06-03","Released",NA,"DFM Productions, Kore Films LLP Productions, ","India, "
"123",135000000,245623848,"Teenage Mutant Ninja Turtles: Out of the Shadows","After supervillain Shredder escapes custody, he joins forces with mad scientist Baxter Stockman and two dimwitted henchmen, Bebop and Rocksteady, to unleash a diabolical plan to take over the world. As the Turtles prepare to take on Shredder and his new crew, they find themselves facing an even greater evil with similar intentions: the notorious Krang.",13.020287,1346,"2016-06-01","Released",112,"5150 Action, Paramount, Nickelodeon Movies, Platinum Dunes, Gama Entertainment Partners, ","United States of America, "
"124",170000000,299370084,"Alice Through the Looking Glass","In the sequel to Tim Burton's ""Alice in Wonderland"", Alice Kingsleigh returns to Underland and faces a new adventure in saving the Mad Hatter.",12.964275,2523,"2016-05-25","Released",113,"Legend3D, Walt Disney Pictures, Roth Films, Team Todd, Tim Burton Productions, ","United Kingdom, United States of America, "
"125",0,0,"Best Friends Genetically Modified","Jackson's unhealthy eating habits lead to persistent nagging by his lady friend, which triggers Jackson to break off the relationship. Tony picks up the health baton and starts pressuring Jackson to take care of his body, emphasizing to him that the body is the temple of the Holy Spirit and that he cannot serve God with all his heart if his heart and other organs are laboring to fight off self induced toxin poisoning. Jackson takes sides in the ongoing battle for the right of people to choose their own medical treatment. He partners up with Tony and Julie to become a champion for those underdogs who fight against Big Pharma and the Monsantos of the world who reap a fortune as they seize power to run the lives of the little people and jeopardize the future of the planet in their attempt to misuse science and political science to usurp God.",0.029034,0,"2016-05-21","Released",118,"Sword of the Spirit Publishing, ","United States of America, "
"126",0,0,"Import","In 1994, a young family of Bosnian refugees find themselves in a little Dutch village after receiving their residence permit. Absurd situations occur as they attempt to turn this new world into their home.",0.027361,0,"2016-05-20","Released",17,"Pupkin Film, ","Netherlands, "
"127",0,272132,"After the Storm","Ryota is an unpopular writer although he won a literary award 15 years ago. Now, Ryota works as a private detective. He is divorced from his ex-wife Kyoko and he has an 11-year-old son Shingo. His mother Yoshiko lives alone at her apartment. One day, Ryota, his ex-wife Kyoko, and son Shingo gather at Yoshiko's apartment. A typhoon passes and the family must stay there all night long.",4.710968,86,"2016-05-21","Released",117,"Fuji Television Network, GAGA, Bandai Visual, ","Japan, "
"128",0,0,"Dragón","",0.122212,1,"2016-05-16","Released",NA,", , ","Spain, "
"129",8000000,292279,"My Life as a Zucchini","After his mother’s death, Zucchini is befriended by a kind police officer, Raymond, who accompanies him to his new foster home filled with other orphans his age. There, with the help of his newfound friends, Zucchini eventually learns to trust and love as he searches for a new family of his own.",6.663911,390,"2016-10-12","Released",66,"Gébéka Films, Rita Productions, Blue Spirit Animation, ","Switzerland, France, "
"130",140000000,183345589,"The BFG","The BFG is no ordinary bone-crunching giant. He is far too nice and jumbly. It's lucky for Sophie that he is. Had she been carried off in the middle of the night by the Bloodbottler, or any of the other giants—rather than the BFG—she would have soon become breakfast. When Sophie hears that the giants are flush-bunking off to England to swollomp a few nice little chiddlers, she decides she must stop them once and for all. And the BFG is going to help her!",9.50094,1441,"2016-06-01","Released",120,"Kennedy/Marshall Company, The, Walt Disney Pictures, Amblin Entertainment, Reliance Entertainment, Walden Media, ","India, United States of America, "
"131",73000000,349779543,"The Angry Birds Movie","An island populated entirely by happy, flightless birds or almost entirely. In this paradise, Red, a bird with a temper problem, speedy Chuck, and the volatile Bomb have always been outsiders. But when the island is visited by mysterious green piggies, it’s up to these unlikely outcasts to figure out what the pigs are up to.",9.957043,1344,"2016-05-11","Released",97,"Sony Pictures Animation, Columbia Pictures, Rovio Entertainment, Rovio Mobile, Rovio Animation, ","Finland, United States of America, "
"132",0,0,"Ace the Case: Manhattan Mystery","While her mother is away on business, a young girl home alone with her older brother witnesses her neighbor's kidnapping. But no one believes her--not her brother, not the cops. So she takes matters into her own hands putting her life at risk to save her neighbor.",0.767313,7,"2016-08-26","Released",94,"Kaufman Films, ","United States of America, "
"133",0,0,"scratch on metal","Film about an Afghanistan-War-era multi-ethnic military family who struggle to preserve their daily existence in the face of selfish needs and psychological struggles.",0.086619,1,"2016-05-01","Released",4,"Pingvin Productions, ","United States of America, "
"134",0,0,"Sheep & Wolves","In a magical faraway land, in a picturesque little village nestled among green meadows and rolling hills, lives a flock of carefree sheep. But their pastoral and stress-free life is interrupted when a pack of wolves sets up camp in the nearby ravine.",3.712037,21,"2016-04-28","Released",97,"CTB Film Company, Wizart Animation, ","Russia, "
"135",0,0,"Fair Haven","A young man returns to his family farm, after a long stay in ex-gay conversion therapy, and is torn between the expectations of his emotionally distant father, and the memories of a past, loving relationship he has tried to bury.",1.653447,21,"2017-03-03","Released",90,"Silent Giant Productions, Trick Candle Productions, ","United States of America, "
"136",0,116873,"Spark: A Space Tail","Spark, a teenage monkey and his friends, Chunk and Vix, are on a mission to regain Planet Bana - a kingdom overtaken by the evil overlord Zhong.",5.316268,23,"2017-04-14","Released",97,"Shanghai Hoongman Technology Co., Gulfstream Pictures, Red Rover International, ToonBox Entertainment, ","Canada, South Korea, "
"137",0,0,"After the Reality","The life of a contestant on a 'Bachelorette' style reality show is thrown into turmoil when the sudden death of his father forces him to quit the series prematurely and reconnect with his estranged sister at the family cabin.",0.514028,4,"2016-04-21","Released",85,"USofAnderson I, ","United States of America, "
"138",1,1,"The Van","An animated documentary about the love and loss of a beloved 1992 Dodge van.",0.026443,0,"2016-04-17","Released",10,"Fiddly Fig Animation Studios, ","United States of America, "
"139",20000000,8821329,"Ratchet & Clank","Ratchet and Clank tells the story of two unlikely heroes as they struggle to stop a vile alien named Chairman Drek from destroying every planet in the Solana Galaxy. When the two stumble upon a dangerous weapon capable of destroying entire planets, they must join forces with a team of colorful heroes called The Galactic Rangers in order to save the galaxy. Along the way they'll learn about heroism, friendship, and the importance of discovering one's own identity.",9.011924,239,"2016-04-13","Released",94,"Sony Pictures Animation, Rainmaker Studios, Blockade Entertainment, ","Canada, Hong Kong, United States of America, "
"140",0,0,"Homework","A young father, his twelve-year-old daughter, a night club, two secrets and a lie that will solve everything.",0.024758,0,"2016-04-13","Released",7,"Deutsche Film- und Fernsehakademie Berlin (DFFB), Pennybooth Productions GbR, ","Germany, "
"141",0,0,"Dating Daisy","Dating Daisy is a romantic comedy about the honest and crazy truth of dating in your twenties!  The story follows Michael and Daisy, two exes who decide to road trip home together for the holidays and get caught up in their crazy past.",0.251719,1,"2016-04-09","Released",89,"Batterie Productions, ","United States of America, "
"142",0,0,"Lucky U Ranch","It's 1953, and 11-year-old Junior McCaully is ready to call it quits. Chubby, bullied, and stuck at an Arizona trailer court with his hardworking mom. Nothing prepares him for the arrival of Melissa, a sophisticated Hollywood girl who changes everything.",0.060001,1,"2016-04-09","Released",93,", , ","United States of America, "
"143",175000000,966550600,"The Jungle Book","A man-cub named Mowgli fostered by wolves. After a threat from the tiger Shere Khan, Mowgli is forced to flee the jungle, by which he embarks on a journey of self discovery with the help of the panther, Bagheera and the free-spirited bear, Baloo.",21.362136,3930,"2016-04-07","Released",106,"Walt Disney Pictures, Fairview Entertainment, Moving Picture Company, ","United Kingdom, United States of America, "
