"","budget","revenue","title","overview","popularity","vote_count","release_date","status","runtime","production_companies","production_countries"
"144",18000000,88923251,"My Big Fat Greek Wedding 2","The continuing adventures of the Portokalos family. A follow-up to the 2002 comedy, ""My Big Fat Greek Wedding.""",7.914629,423,"2016-03-23","Released",94,"Universal Pictures, Gold Circle Films, HBO Films, Playtone, ","Canada, United States of America, "
"145",0,0,"Un caballo llamado elefante","Two brothers sneak into a circus in order to free their grandfather's horse and fulfill his last wish.",0.104376,1,"2016-08-04","Released",79,"Invercine&Wood, ","Chile, "
"146",0,0,"Open Season: Scared Silly","The humans and animals believe a werewolf is on the loose, and former hunter Shaw uses the opportunity to re-open the season. Boog, Elliot, and Mr. Weenie have to face their fears and find the werewolf to get the season closed permanently.",11.47887,83,"2016-03-08","Released",85,"Sony Pictures Animation, ","United States of America, "
"147",0,0,"Monster High: Great Scarrier Reef","Join the Monster High ghouls on an all new aquatic adventure as they dive deep into the crystal deep blue waters of the Great Scarrier Reef. When the ghouls get pulled in the school pool, they find themselves transported to a world of corals and florals - a wild underwater wonderland! But Lagoona is not there to see the sights - she's on a mission of the heart, as she realizes she has come home! She must confront her childhood nemesis and bully, come to terms with her own freaky flaws, win an aquatic dance extravaganza, and fight a terrible beast from the deep. So take the plunge - you won't believe what awaits you under the waves!",3.962114,15,"2016-02-12","Released",69,"Mattel Entertainment, ","United States of America, "
"148",0,0,"Timber the Treasure Dog","A boy rises to the occasion with his best friend (a lovable talking dog) to save his home and family.",0.140539,3,"2016-05-26","Released",89,"Koch Media, ","United States of America, "
"149",13500000,3342697,"Robinson Crusoe: The Wild Life","On a tiny exotic island, Tuesday, an outgoing parrot lives with his quirky animal friends in paradise. However, Tuesday can't stop dreaming about discovering the world. After a violent storm, Tuesday and his friends wake up to find a strange creature on the beach: Robinson Crusoe. Tuesday immediately views Crusoe as his ticket off the island to explore new lands. Likewise, Crusoe soon realizes that the key to surviving on the island is through the help of Tuesday and the other animals. It isn't always easy at first, as the animals don't speak ""human."" Slowly but surely, they all start living together in harmony, until one day, when their comfortable life is overturned by two savage cats, who wish to take control of the island. A battle ensues between the cats and the group of friends but Crusoe and the animals soon discover the true power of friendship up against all odds (even savage cats).",10.876418,106,"2016-02-04","Released",90,"uFilm, StudioCanal, nWave Pictures, Illuminata Pictures, ","Belgium, France, "
"150",0,0,"Brother for a Day","Brother for a Day is a film about our city, our streets and our neighborhoods—a story that could happen anywhere. It tells the story of a thoroughly modern family of three members. In their struggle for money, the parents fail to devote much time or attention to their five-year-old daughter, Anja. They do not have the time or patience to explain things to her and they give her what she wants just to ‘buy some peace’. “Brother for a Day” at first glance appears to be a story of different nationalities; in fact, it refers to the divide between the child’s world and the world of adults.",0.038668,0,"2016-02-03","Released",12,"Lunar Produkcija, ","Macedonia, "
"151",0,0,"Rock'n'roll Will Never Die","Vince is a 13-year-old drummer. His father, Fred, is 48, and a faded guitarist and singer rock ""star."" He’s going to play with him one of his old tunes at his middle school summer party. The trouble is chain-smoker Fred doesn’t really have a voice any more. Besides, Fred is not really his father…",0.205073,0,"2016-02-01","Released",20,"Origine films, ","France, "
"152",0,0,"Undercover Vampire Policeman","Thèo (17) is a teenager that is drawing and creating by himself and without any other incentive than his passion a series of underground comics called ""Undercover Vampire Policeman"". With her best friend and partner in crime (Ava) supporting him, he daydreams about leaving their world behind to be an illustrator.",0.093752,0,"2016-02-14","Released",9,", , ",", , "
"153",0,3162153,"The Eagle Huntress","Follow Aisholpan, a 13-year-old girl, as she trains to become the first female in twelve generations of her Kazakh family to become an eagle hunter, and rise to the pinnacle of a tradition that has been typically been handed down from father to son for centuries.",4.584688,34,"2016-11-02","Released",87,"Kissaki Films, Stacey Reiss Productions, ","Mongolia, United States of America, United Kingdom, "
"154",5000000,5879736,"Captain Fantastic","A father living in the forests of the Pacific Northwest with his six young kids tries to assimilate back into society.",14.778632,2375,"2016-07-02","Released",119,"ShivHans Pictures, Electric City Entertainment, Post Haste Digital, ","United States of America, "
"155",145000000,521170825,"Kung Fu Panda 3","Continuing his ""legendary adventures of awesomeness"", Po must face two hugely epic, but different threats: one supernatural and the other a little closer to his home.",15.720393,2171,"2016-01-23","Released",95,"Oriental DreamWorks, China Film Co., DreamWorks Animation, 20th Century Fox, ","China, United States of America, "
"156",0,0,"Barbie: Spy Squad","Barbie and her best friends Teresa and Renee transform from hard-working gymnasts to undercover secret agents. When their amazing gymnastics skills catch the eye of a top-secret spy agency, the girls are soon following clues to a gem-stealing cat burglar, using high-tech gadgets, glam disguises and cute robo-pets to save the day.",4.352162,47,"2016-01-15","Released",75,"Nickelodeon Network, ","United States of America, "
"157",10333,0,"Prach a broky","",0.022353,0,"2015-12-26","Released",NA,", , ","Czech Republic, "
"158",0,0,"Chibi Maruko-chan: The Boy from Italy","The story is about Hanawa's home had six friends come from different countries, under the request of the students, these foreign friends admitted Chibi Maruko and other student's home. Andrea from Italy, who lived in Maruko's home. Although they get along with a variety of cultures and backgrounds, they gradually became friends. Maruko and Andrea have developed a romantic love story...",0.037306,0,"2015-12-23","Released",NA,"Fizz Sound Creation, Nippon Animation, ","Japan, "
"159",0,0,"A Dog for Christmas","The entire family stays at Dave and Sandy's home for the holidays. Kassandra wants a puppy for Christmas, but Mom and Dad aren't ready for that. Will Santa grant Kassandra's only wish for Christmas?",0.374253,1,"2015-12-12","Released",89,"Be Your Own Hollywood, ","United States of America, "
"160",0,1510000,"SOS, Santa Claus or Everything Will Come True!","A little girl Sveta has only one New Year wish - to make peace between her parents.",0.021911,0,"2015-12-10","Released",87,"Echo Film (RU), ","Russia, "
"161",0,233755553,"Alvin and the Chipmunks: The Road Chip","Through a series of misunderstandings, Alvin, Simon and Theodore come to believe that Dave is going to propose to his new girlfriend in New York City - and dump them. They have three days to get to him and stop the proposal.",12.780057,591,"2015-12-17","Released",92,"TSG Entertainment, Fox 2000 Pictures, Regency Enterprises, Bagdasarian Productions, Sunswept Entertainment, ","United States of America, "
"162",0,0,"The Name You Carry","When Vlace is suspended for hitting a classmate, Sasha is called to come get his son at school and has no choice but to take him along on his delivery route. During this intimate journey, we discover what provoked Vlace's uncharacteristic act, as father and son find their way toward a new understanding.",0.059879,1,"2015-11-14","Released",17,"Les Films de L'Autre, ","Canada, "
"163",175000000,331926147,"The Good Dinosaur","An epic journey into the world of dinosaurs where an Apatosaurus named Arlo makes an unlikely human friend.",17.010303,2321,"2015-11-14","Released",93,"Pixar, ","United States of America, "
"164",0,0,"One Hell of a Plan","Two burglars release dozens of cats into a neighbourhood and start the dogs barking. They use the din to their advantage and dig up a bag of loot. However, the situation snowballs and turns into the worst night the burglars ever spent.",0.029223,0,"2015-11-04","Released",6,"Lunanime, Folimage, ","Belgium, France, "
"165",0,0,"Lo que nunca nos dijimos","Intimate story of a small family, starring Marian, only daughter of Dr. and Mrs. Di Mateo, who after several years of living in Mexico returns to his hometown Mendoza, because her father is dying; although the true intent of her return is to say what was sealed by the silence of the unspoken in an exemplary family as such as her mother claims to sustain.",0.021494,0,"2015-11-03","Released",90,"Instituto Nacional de Cine y Artes Audiovisuales (INCAA), Cineworld, ","Mexico, Argentina, "
"166",0,0,"Afternoon Class","He's trying to stay awake in an afternoon class.",0.09064,2,"2015-10-31","Released",4,", , ","South Korea, "
"167",0,0,"Cold of Kalandar","Mehmet is a man who lives with his two children, wife, and mother in a mountain village on Black Sea. He earns his bread by breeding a few animals, while looking for a mineral reserve on the mountains with a great passion and hope. However, his endless pursuit is perceived as useless by his mother and wife. Destroyed in search of a mineral reserve, his hope is renewed with the news of a competition. Mehmet will attend the bull fight that will be held in Artvin, so he dedicates his time to training the bull in the stable till the day of competition.",0.506443,5,"2017-03-23","Released",138,"TRT, Eurimages, KARAFILM, ","Turkey, Hungary, "
"168",0,0,"600 PS für zwei","",0.060847,0,"2015-10-22","Released",NA,"Wiedemann & Berg Television, ","Germany, "
"169",0,0,"Cosmic Scrat-tastrophe","Scrat struggles once again to protect his nut.",2.122484,54,"2015-11-06","Released",5,"Blue Sky Studios, 20th Century Fox, ",", , "
"170",99000000,246233113,"The Peanuts Movie","Snoopy embarks upon his greatest mission as he and his team take to the skies to pursue their arch-nemesis, while his best pal Charlie Brown begins his own epic quest back home.",10.251958,722,"2015-11-05","Released",88,"Twentieth Century Fox Animation, Blue Sky Studios, ","United States of America, "
"171",0,0,"Big Voice","BIG VOICE captures a tumultuous year in the life of a visionary high school choir teacher and his students as they overcome seemingly insurmountable obstacles to become one big voice in this inspiring musical documentary.",0.187405,4,"2015-10-18","Released",82,"Ravensong, LiveTribe, Pingvin Productions, ","United States of America, "
"172",0,0,"Guards of the Forest","A man continues to throw rubbish into the forest, to the great annoyance of both the forest ranger and the forest animals, but when he refuses to stop, more drastic measures have to come into use – and this is where the forest ranger luckily gets the help of a dog, a cat and a mouse, who have had enough of the litter lout.",0.090588,2,"2015-10-18","Released",12,"Animacijas Brigade, ","Latvia, "
"173",0,0,"The Red Herring","One sunny day in the Antarctic, a little fisher-penguin catches fish for his friends. They are impatient for more as always. Into this happy scene arrives a charming salesman. Dazzled by his confidence and his fish-shaped tie, the penguins follow him away, leaving the fisher-penguin alone. It’s not long before the group has returned, this time with a huge, heavy fishing machine. As it cranks into gear, the fisher-penguin looks at the ice worriedly…. this surely won’t end well…",0.177552,2,"2015-10-18","Released",7,"Ink and Light Films, ","Ireland, Finland, "
"174",0,0,"Ladybug","The Ladybug has been taken prisoner. Now she is living in a teensy tiny matchbox and plotting her escape.",0.058937,1,"2015-10-18","Released",3,"Soyuzmultfilm, ","Russia, "
"175",0,0,"Die Badewanne","The short film tells the story about three brothers who try to dive back into their childhood by re-enacting an old family picture.",0.071191,1,"2016-02-06","Released",13,", , ","Germany, Austria, "
"176",0,0,"Lift me up","A young lady, who recently lost her mother, faces the challenges of high school and her very strict step-father. Through personal growth, and an amazing dedication to dance, she learns to find the peace and happiness of family.",0.367717,10,"2015-10-04","Released",108,"North of Two, ","United States of America, "
"177",0,0,"Departure","An English mother and her teenage son spend a week preparing the sale of their remote holiday house in the South of France. Fifteen-year-old Elliot struggles with his dawning sexuality and an increasing alienation from his mother, Beatrice. She in turn is confronted by the realisation that her marriage to his father, Philip, has grown loveless and the life she knows is coming to an end. When an enigmatic local teenager, Clément, quietly enters their lives, both mother and son are compelled to confront their desires and, finally, each other.",1.608333,28,"2016-05-20","Released",109,"Motion Group Pictures, British Film Institute (BFI), Amaro Films, Connectic Studio, ","France, United Kingdom, "
"178",0,0,"Wind Through a Tree","In this poetic home movie, an unrelated family of four are connected by themes of loneliness and isolation",0.02,0,"2015-09-19","Released",10,", , ","Canada, "
"179",0,0,"Phantom Boy","An 11-year-old boy becomes an unlikely superhero when he discovers that he has the ability to leave his body and fly through walls.",2.007669,17,"2015-10-14","Released",84,"Lunanime, Coproducción Francia-Bélgica, Studio Folimage, ","France, "
"180",0,0,"The Visitor","Ten years after being thrown out of her parental home, Nur hears that her mother is at death's door. Taking her young daughter with her, Nur hurries back to her father's world to see, and reconcile with her mother before it is too late. While the universal theme of mother-daughter relationships lies at the centre of the film, this is underpinned by an allusive subtext of incest, one of most common but least addressed social problems in Turkey. The individual stories of the family members combine with a sense of hope fuelled by tragedy to paint a portrait of the socially disconnected.",0.075908,1,"2015-09-11","Released",127,"Atlanta Film, ","Turkey, "
"181",0,0,"Tracks","An amateur skateboarder is left to care for his girlfriend's young daughter on the day of a championship tournament.",0.058167,0,"2015-09-05","Released",18,", , ",", , "
"182",14000000,8306690,"Capture the Flag","When the brave and determined 12-year-old Mike Goldwing discovers that an eccentric billionaire plans to fly to the moon, steal its vast, valuable natural resources, and destroy the American flag planted by the Apollo XI astronauts during man's historic moon landing, the countdown to a spectacular adventure begins! Mike, teamed with his grandfather, best friends Amy and Marty, and a clever chameleon, blasts off on an incredible moon-bound mission, determined to thwart the billionaire's evil plan, capture the flag, and reunite his family.",7.265919,77,"2015-08-28","Released",94,"4 Cats Pictures, teleCinco Cinema, Telefónica Studios, Los Rockets La Película, Ikiru Films, Lightbox Animation Studios, ","Spain, "
"183",0,0,"Godless","Two brothers reconnect after the death of their parents.",0.801379,6,"2015-08-06","Released",90,"Malacca Pictures, ","United States of America, "
"184",14000000,98000000,"Bajrangi Bhaijaan","A young mute girl from Pakistan loses herself in India with no way to head back. A devoted man with a magnanimous spirit undertakes the task to get her back to her motherland and unite her with her family.",7.560716,186,"2015-07-17","Released",163,"Rockline Entertainments, Kabir Khan Films, Salman Khan Films, Eros International, ","India, "
"185",0,0,"Die kleinen Dinge","",0.054088,1,"2015-07-05","Released",NA,", , ","Germany, "
"186",0,0,"Goiabas","An apartment building in a small village, live human characters and funny puppets. The building moves a new family with their daughter Billie who love to discover the magical corners common building and especially the guava tree. However, there are those who are less like the guava tree, whose fruits fall directly in the territory and is rich mayor who decides to uproot the tree.",0.056787,1,"2015-07-02","Released",80,", , ","Israel, "
"187",0,0,"Family Party","On the 70th birthday of famous piano virtuoso Hannes Westhoff, a celebration is to take place at the patriarch's estate. For this occasion, his second wife Anne not only invited Westhoff's three sons Max, Fredrik and Gregor, but also their mother, Westhoff's ex-wife Renate. While Anne tries to maintain a friendly atmosphere, old conflicts resurface among the family. With tensions already high, things take a turn for the dramatic when son Max reveals shocking news.",0.222338,3,"2015-10-15","Released",91,"UFA Fiction, ","Germany, "
"188",74000000,1156730962,"Minions","Minions Stuart, Kevin and Bob are recruited by Scarlet Overkill, a super-villain who, alongside her inventor husband Herb, hatches a plot to take over the world.",14.822443,6159,"2015-06-17","Released",91,"Illumination Entertainment, Universal Pictures, ","United States of America, "
"189",0,0,"Growing Up Smith","In 1979, an Indian family moves to America with hopes of living the American Dream. While their 10-year-old boy Smith falls head-over-heels for the girl next door, his desire to become a ""good old boy"" propels him further away from his family's ideals than ever before.",1.115747,14,"2017-02-03","Released",102,", , ",", , "
"190",175000000,857611174,"Inside Out","Growing up can be a bumpy road, and it's no exception for Riley, who is uprooted from her Midwest life when her father starts a new job in San Francisco. Like all of us, Riley is guided by her emotions - Joy, Fear, Anger, Disgust and Sadness. The emotions live in Headquarters, the control center inside Riley's mind, where they help advise her through everyday life. As Riley and her emotions struggle to adjust to a new life in San Francisco, turmoil ensues in Headquarters. Although Joy, Riley's main and most important emotion, tries to keep things positive, the emotions conflict on how best to navigate a new city, house and school.",34.894833,9194,"2015-06-09","Released",94,"Pixar, ","United States of America, "
"191",0,0,"Scenes at the Sea","Sea. Road. One day from life of men and women. One year ago after losing child, they have been unable to understand the depth of this pain. Trying to find solace in each other, they realize that they do not know each other ...",0.051362,0,"2015-05-13","Released",27,"VKSR, ","Belarus, France, Russia, "
"192",190000000,209154322,"Tomorrowland","Bound by a shared destiny, a bright, optimistic teen bursting with scientific curiosity and a former boy-genius inventor jaded by disillusionment embark on a danger-filled mission to unearth the secrets of an enigmatic place somewhere in time and space that exists in their collective memory as ""Tomorrowland.""",26.271648,3639,"2015-05-19","Released",130,"Babieka, Walt Disney Pictures, A113, ","United States of America, "
"193",0,0,"Jack of the Red Hearts","A teenage con artist tricks a desperate mother into hiring her as a live-in companion for her autistic daughter.",1.840316,41,"2016-02-26","Released",102,"Sundial Pictures, ","United States of America, "
"194",0,0,"Martian","A little boy pulls out one Martian toy from a vending machine and it turns into a real alien who takes him to his planet, where he is surronded by the toys from the vending machine, but much bigger.",0.198877,1,"2015-05-04","Released",7,"State Culture Capital Foundation, Locomotive Productions, Jarve Studio, National Film Centre of Latvia, ","Estonia, Latvia, "
"195",0,0,"Belaseshe","A story of relationships that explores the intricacies of the married life, of life-long companionship, of promises and expectations and love.",0.122585,3,"2015-05-01","Released",141,"Windows Production House, ","India, "
"196",0,0,"The Gnomist","Deep in the forest of Overland Park, Kansas little gnomes made a home. But how did they get there? Experience the feel-good story of paying it forward, one tiny magical house at a time.",0.054875,1,"2015-04-24","Released",17,"Alpha Dog Productions, Herizon Productions, ","United States of America, "
"197",0,0,"Merry Xmas","The story of a mischievous father who calls his very busy kids to tell them that, after 55 years of marriage, he and their mom are getting divorced. Horrified by the news, the children prepare to fly home to stop the divorce and save their parent's marriage.",0.023059,0,"2015-04-19","Released",7,", , ","United States of America, "
"198",0,0,"Mother(s)","The 8-year-old Aida lives in an apartment in the Parisian suburb. The daily life of Aida and the whole family is overwhelmed when her father comes back from Senegal, their country of origin. Actually, he did not come back alone. He returned with the young Senegalese Rama whom he introduced as his second wife. Aida is very sensitive to her mother's distress. She decides then to get rid of the new visitor.",0.470613,1,"2015-09-11","Released",21,"Bien ou Bien Productions, ","France, "
"199",0,0,"Skateboarding's First Wave","Explore the origins of skateboarding culture through the lens of the 1965 Palisades Skateboard Team, who reinvented a childhood hobby into a sport, bringing it to the vanguard of popular culture. Features interviews with the team members reflecting on how the sport has changed, 50 years later.",0.02309,0,"2015-04-13","Released",18,"Mettersi Films, ","United States of America, "
"200",0,0,"The Law of the Jungle","A clever little monkey remembers to keep his wits about him when the bigger monkeys encroach on his bounty of bananas.",0.032575,0,"2015-04-11","Released",6,"Suivez mon Regard, Digit Anima, La Boîte Productions, Les Films du Nord, ","France, "
"201",0,0,"The Last Days Of Cinema","As cinemas in the city are closing their doors, the relationship between Leandro and his son Martín fades away. Leandro will try to redeem his past errors on time for Martín to be able to dream again.",0.01662,0,"2015-03-13","Released",24,"ACAR films, ","Spain, "
"202",0,0,"Waves from the Sky","Pedro, a bird who cannot fly in sync with his flock, decides to branch out on his own.",0.087939,2,"2015-03-01","Released",8,"Armadillo Film, ","Mexico, "
"203",0,0,"Girl on the Edge","A powerful true story about the journey of a troubled teenage girl who finds healing in the most unlikely of places, and who must choose to either invest in her own recovery or succumb to the trauma of her past.",1.389122,22,"2015-02-23","Released",100,"Jay Silverman Productions, ","United States of America, "
"204",0,0,"Gord's Brother","Gord's Brother is set in a world where monsters and humans co-exist, and follows the story of Gord and his monster brother as they run away to find a new home and search for the fabled City of Monsters.",0.13288,0,"2015-02-14","Released",15,", , ",", , "
"205",0,0,"Frozen Fever","On Anna's birthday, Elsa and Kristoff are determined to give her the best celebration ever, but Elsa's icy powers may put more than just the party at risk.",9.777585,820,"2015-03-09","Released",8,"Walt Disney Pictures, Walt Disney Animation Studios, ","United States of America, "
"206",95000000,543514353,"Cinderella","When her father unexpectedly passes away, young Ella finds herself at the mercy of her cruel stepmother and her daughters. Never one to give up hope, Ella's fortunes begin to change after meeting a dashing stranger in the woods.",25.518975,3279,"2015-03-12","Released",105,"Walt Disney Pictures, Genre Films, Beagle Pug Films, Allison Shearmur Productions, ","United Kingdom, United States of America, "
"207",0,0,"The Misplaced World","By chance Paul Kromberger discovers on the internet a photograph of the US opera diva Caterina Fabiani who is the spitting image of Evelyn, his dead wife. His unease and growing sense of alarm are transferred to his daughter, Sophie. Filled with curiosity, she leaves Germany and journeys across the Atlantic to make contact with this stranger.",0.715086,2,"2015-05-07","Released",101,"Tele-München, Schenk Productions, Clasart Film- und Fernsehproduktion, ","Germany, "
"208",0,59700000,"Shaun the Sheep Movie","When Shaun decides to take the day off and have some fun, he gets a little more action than he bargained for. A mix up with the Farmer, a caravan and a very steep hill lead them all to the Big City and it's up to Shaun and the flock to return everyone safely to the green grass of home.",12.179949,551,"2015-02-05","Released",85,"Aardman Animations, Anton Capital Entertainment (ACE), StudioCanal, ","France, United Kingdom, "
"209",0,0,"Ture the Dice","Imagine that a small piece of wood can determine such large fortunes for us humans. And a ladybug can off even fall in love in a red dice with black spots.",0.107799,1,"2015-01-24","Released",10,"Svenska Filminstitutet, ","Sweden, "
"210",0,0,"Addicted to Sheep","Set in the North Pennines, an intimate portrait of a year in the life of tenant hill farmers Tom and Kay Hutchinson as they try to breed the perfect sheep.",0.050592,1,"2015-01-01","Released",86,"Provenance Films, ","United Kingdom, "
