"","budget","revenue","title","overview","popularity","vote_count","release_date","status"
"84",2500000,0,"Rolli and the Secret Route","Rolli and little elf girl Juniper along with the rest of the rollis and other strange creatures lead peaceful and rollishly fun lives in their flourishing Rolli Village. One day the inquisitive friends Rolli and Juniper hear incredible news from Malcolm the Maggot: somewhere far away, beyond mountains, forests and the sea, lies a place called The Beginning of All Time. That’s where the storks always take off on their trips to deliver babies in small bundles to their new homes. Rolli and Juniper cannot help but become curious. Both of them have fallen into Rolli Village in a bundle from the sky, and especially Juniper has always wondered where she came from. The two friends decide to throw themselves into a joint adventure. They embark on a trip toward The Beginning of All Time in order to find the answer to life’s greatest secret.",0.035603,0,"2016-09-16","Released"
"85",0,0,"Hey Bunny","A misanthropist ex-hacker is suspected of sabotaging a famous happiness-research facility. He is forced to prove his innocence and stumbles into a wild adventure, during which he involuntarily becomes an idealistic activist, has to deal with strange, possibly supernatural rabbits and his crazy family - and regains a little belief in happiness.",0.53135,2,"2017-04-27","Released"
"86",0,0,"Your Mother and I","Johnna's dad changed the world. Or so he says. Whilst Johnna and her dad are talking, they can't seem to connect, each growing more and more frustrated with one another, revolving around one another in their own orbits.",0.044477,0,"2016-09-14","Released"
"87",75000000,632443719,"Sing","A koala named Buster recruits his best friend to help him drum up business for his theater by hosting a singing competition.",17.377995,3099,"2016-11-23","Released"
"88",0,0,"Good Luck, Orlo!","A baby has died. Orlo's parents are consumed with grief. In an attempt to make them happy and his family whole again, Orlo does something unexpected.",0.033694,0,"2016-09-10","Released"
"89",0,0,"Weirdos","Two Nova Scotian teens who hit the road in July 1976 accompanied by the laconic ghost of (the still-living) Andy Warhol.",0.700342,7,"2016-09-09","Released"
"90",0,0,"Indice 50","A family, composed of a strapping father, a mother with an authoritarian temper and an excited young boy, land on a crowded beach for their summer holidays. After struggling for several minutes to find a spot, the family, really organized, begin to settle themselves. However during that topping ritual, a fast and cunning mosquito is going to break the family chain. Owing to the little insect, their wonderful day will be transformed into a true hell.",0.30036,2,"2016-12-26","Released"
"91",0,0,"Mad World","An absentee father and his bipolar son are forced to live together as they struggle with a recent family tragedy. The tension and anxiety boil as they live and try to cope in a tiny apartment. As time passes, they realize their shared pain is not their only source of grief, as they find the outside world is a cruel and unjust place.",0.755298,4,"2016-10-13","Released"
"92",0,0,"Jesús","18-year-old Jesús lives with his stern, somewhat unaffectionate father in Santiago, Chile. When not doing drugs, having casual sex or simply slouching in front of the TV, Jesús and his friends perform in a K-pop boyband. But his routine is thrown into chaos one evening when he and his drunken posse viciously assault a young gay man and leave him for dead. It’s an act that propels Jesús into a profound moral crisis which have severe consequences.",0.106047,2,"2016-08-24","Released"
"93",1000,0,"Star David","12 y.o. Jewish girl Dinka studies at Machon (Jewish orthodox orphanage). Lone middle-aged Hana, the Machon headmistress, exerts best efforts to educate girls in the spirit of Jewish tradition and to protect them from the temptations of the outside world. Once Dinka has watched a boring b-movie on TV and felt in love with Hollywood actor David Travis, a muscular handsome moustachette. She decides to marry him by the Talmudic rules and writes letters to Hollywood.",0.289026,0,"2016-08-20","Released"
"94",60000000,69929545,"Kubo and the Two Strings","Kubo mesmerizes the people in his village with his magical gift for spinning wild tales with origami. When he accidentally summons an evil spirit seeking vengeance, Kubo is forced to go on a quest to solve the mystery of his fallen samurai father and his mystical weaponry, as well as discover his own magical powers.",17.718356,1349,"2016-08-18","Released"
"95",30000000,57814445,"Nine Lives","A stuffy businessman finds himself trapped inside the body of his family's cat.",8.67941,383,"2016-08-03","Released"
"96",65000000,143695338,"Pete's Dragon","Pete is a mysterious 10-year-old with no family and no home who claims to live in the woods with a giant, green dragon named Elliott. With the help of Natalie, an 11-year-old girl whose father Jack owns the local lumber mill, forest ranger Grace sets out to determine where Pete came from, where he belongs, and the truth about this dragon.",12.217703,931,"2016-08-10","Released"
"97",0,0,"A Field Day","Middle-aged Cheolgu is laid off with no advance notice. Looking for a new job is not easy and neither is the situation that his family members are in. A movie that takes a cheerful, positive look at life while maintaining the balance of a group drama involving diverse characters.",0.531784,0,"2018-03-22","Released"
"98",0,0,"<U+ADF9><U+C7A5><U+D310> <U+C694><U+AD34><U+C6CC><U+CE58> <U+C5FC><U+B77C><U+B300><U+C655><U+ACFC> 5<U+AC1C><U+C758> <U+C774><U+C57C><U+AE30><U+B2E4><U+B0E5>!","",0.03131,0,"2016-07-20","Released"
"99",0,0,"Manifest Destiny: The Lewis & Clark Musical Adventure","This musical comedy weaves together sharp satire and heartfelt storytelling into a grand adventure. Through ten original songs, the film follows gruff explorer William Clark and his naturalist companion Meriwether Lewis as they blaze a trail to the Western waters. Along the way, they encounter the wise Sacagawea, battle the elements, and find that President Thomas Jefferson has some surprises up his sleeve.",0.199258,0,"2016-07-13","Released"
"100",0,0,"VULKAN","",0.094623,1,"2016-07-08","Released"
"101",0,0,"Center of My World","A strange family: 17-year-old Phil lives with his mother and twin sister in an old mansion on the outskirts of town. When he returns from summer camp, the mood in the mansion has soured somehow. Phil doesn’t worry about it, hanging out with his best friend Kat instead. When he starts to feel attracted to a mysterious new student at school, Phil is plunged into emotional turmoil only exacerbated by the trouble at home.",4.13997,58,"2016-11-10","Released"
"102",105000000,408579038,"Ice Age: Collision Course","Set after the events of Continental Drift, Scrat's epic pursuit of his elusive acorn catapults him outside of Earth, where he accidentally sets off a series of cosmic events that transform and threaten the planet. To save themselves from peril, Manny, Sid, Diego, and the rest of the herd leave their home and embark on a quest full of thrills and spills, highs and lows, laughter and adventure while traveling to exotic new lands and encountering a host of colorful new characters.",33.988974,1631,"2016-06-23","Released"
"103",75000000,875457937,"The Secret Life of Pets","The quiet life of a terrier named Max is upended when his owner takes in Duke, a stray whom Max instantly dislikes.",6.131067,4222,"2016-06-18","Released"
"104",0,0,"Fishtales","After a shark attack leads to Cleo and Puffer's eight-legged octopus friend Ollie getting lost in the ocean, a fun-loving manta ray named Crash helps them search the sea to find their lost mate. Along their journey they meet all sorts of fascinating creatures of the deep and learn about each and every one of them during their aquatic adventure..",0.870217,4,"2017-06-22","Released"
"105",0,0,"Piper","A mother bird tries to teach her little one how to find food by herself. In the process, she encounters a traumatic experience that she must overcome in order to survive.",6.954033,657,"2016-06-16","Released"
"106",200000000,1028570889,"Finding Dory","Dory is reunited with her friends Nemo and Marlin in the search for answers about her past. What can she remember? Who are her parents? And where did she learn to speak Whale?",16.994496,5759,"2016-06-16","Released"
"107",0,0,"Thai Jashe!","Thai Jashe! is an upcoming urban Gujarati film written and directed by Nirav Barot. The film is about the struggles of a middle class man to achieve his goals in the metrocity Ahmedabad. The film stars Manoj Joshi, Malhar Thakar and Monal Gajjar.",0.377256,2,"2016-06-03","Released"
"108",135000000,245623848,"Teenage Mutant Ninja Turtles: Out of the Shadows","After supervillain Shredder escapes custody, he joins forces with mad scientist Baxter Stockman and two dimwitted henchmen, Bebop and Rocksteady, to unleash a diabolical plan to take over the world. As the Turtles prepare to take on Shredder and his new crew, they find themselves facing an even greater evil with similar intentions: the notorious Krang.",15.468518,1344,"2016-06-01","Released"
"109",170000000,299370084,"Alice Through the Looking Glass","In the sequel to Tim Burton's ""Alice in Wonderland"", Alice Kingsleigh returns to Underland and faces a new adventure in saving the Mad Hatter.",15.177441,2519,"2016-05-25","Released"
"110",0,0,"Best Friends Genetically Modified","Jackson's unhealthy eating habits lead to persistent nagging by his lady friend, which triggers Jackson to break off the relationship. Tony picks up the health baton and starts pressuring Jackson to take care of his body, emphasizing to him that the body is the temple of the Holy Spirit and that he cannot serve God with all his heart if his heart and other organs are laboring to fight off self induced toxin poisoning. Jackson takes sides in the ongoing battle for the right of people to choose their own medical treatment. He partners up with Tony and Julie to become a champion for those underdogs who fight against Big Pharma and the Monsantos of the world who reap a fortune as they seize power to run the lives of the little people and jeopardize the future of the planet in their attempt to misuse science and political science to usurp God.",0.042769,0,"2016-05-21","Released"
"111",0,0,"Import","In 1994, a young family of Bosnian refugees find themselves in a little Dutch village after receiving their residence permit. Absurd situations occur as they attempt to turn this new world into their home.",0.027059,0,"2016-05-20","Released"
"112",0,272132,"After the Storm","Ryota is an unpopular writer although he won a literary award 15 years ago. Now, Ryota works as a private detective. He is divorced from his ex-wife Kyoko and he has an 11-year-old son Shingo. His mother Yoshiko lives alone at her apartment. One day, Ryota, his ex-wife Kyoko, and son Shingo gather at Yoshiko's apartment. A typhoon passes and the family must stay there all night long.",5.035892,86,"2016-05-21","Released"
"113",0,0,"Dragón","",0.122212,1,"2016-05-16","Released"
"114",8000000,292279,"My Life as a Zucchini","After his mother’s death, Zucchini is befriended by a kind police officer, Raymond, who accompanies him to his new foster home filled with other orphans his age. There, with the help of his newfound friends, Zucchini eventually learns to trust and love as he searches for a new family of his own.",6.981279,390,"2016-10-12","Released"
"115",140000000,183345589,"The BFG","The BFG is no ordinary bone-crunching giant. He is far too nice and jumbly. It's lucky for Sophie that he is. Had she been carried off in the middle of the night by the Bloodbottler, or any of the other giants—rather than the BFG—she would have soon become breakfast. When Sophie hears that the giants are flush-bunking off to England to swollomp a few nice little chiddlers, she decides she must stop them once and for all. And the BFG is going to help her!",13.254985,1441,"2016-06-01","Released"
"116",73000000,349779543,"The Angry Birds Movie","An island populated entirely by happy, flightless birds or almost entirely. In this paradise, Red, a bird with a temper problem, speedy Chuck, and the volatile Bomb have always been outsiders. But when the island is visited by mysterious green piggies, it’s up to these unlikely outcasts to figure out what the pigs are up to.",16.111124,1344,"2016-05-11","Released"
"117",0,0,"Ace the Case: Manhattan Mystery","While her mother is away on business, a young girl home alone with her older brother witnesses her neighbor's kidnapping. But no one believes her--not her brother, not the cops. So she takes matters into her own hands putting her life at risk to save her neighbor.",1.697967,7,"2016-08-26","Released"
"118",0,0,"scratch on metal","Film about an Afghanistan-War-era multi-ethnic military family who struggle to preserve their daily existence in the face of selfish needs and psychological struggles.",0.06999,1,"2016-05-01","Released"
"119",0,0,"Sheep & Wolves","In a magical faraway land, in a picturesque little village nestled among green meadows and rolling hills, lives a flock of carefree sheep. But their pastoral and stress-free life is interrupted when a pack of wolves sets up camp in the nearby ravine.",3.857246,21,"2016-04-28","Released"
"120",0,0,"Fair Haven","A young man returns to his family farm, after a long stay in ex-gay conversion therapy, and is torn between the expectations of his emotionally distant father, and the memories of a past, loving relationship he has tried to bury.",1.90298,21,"2017-03-03","Released"
"121",0,116873,"Spark: A Space Tail","Spark, a teenage monkey and his friends, Chunk and Vix, are on a mission to regain Planet Bana - a kingdom overtaken by the evil overlord Zhong.",5.444363,23,"2017-04-14","Released"
"122",0,0,"After the Reality","The life of a contestant on a 'Bachelorette' style reality show is thrown into turmoil when the sudden death of his father forces him to quit the series prematurely and reconnect with his estranged sister at the family cabin.",0.367163,4,"2016-04-21","Released"
"123",1,1,"The Van","An animated documentary about the love and loss of a beloved 1992 Dodge van.",0.027484,0,"2016-04-17","Released"
"124",20000000,8821329,"Ratchet & Clank","Ratchet and Clank tells the story of two unlikely heroes as they struggle to stop a vile alien named Chairman Drek from destroying every planet in the Solana Galaxy. When the two stumble upon a dangerous weapon capable of destroying entire planets, they must join forces with a team of colorful heroes called The Galactic Rangers in order to save the galaxy. Along the way they'll learn about heroism, friendship, and the importance of discovering one's own identity.",9.308648,239,"2016-04-13","Released"
"125",0,0,"Homework","A young father, his twelve-year-old daughter, a night club, two secrets and a lie that will solve everything.",0.046873,0,"2016-04-13","Released"
"126",0,0,"Dating Daisy","Dating Daisy is a romantic comedy about the honest and crazy truth of dating in your twenties!  The story follows Michael and Daisy, two exes who decide to road trip home together for the holidays and get caught up in their crazy past.",0.251719,1,"2016-04-09","Released"
"127",0,0,"Lucky U Ranch","It's 1953, and 11-year-old Junior McCaully is ready to call it quits. Chubby, bullied, and stuck at an Arizona trailer court with his hardworking mom. Nothing prepares him for the arrival of Melissa, a sophisticated Hollywood girl who changes everything.",0.069044,1,"2016-04-09","Released"
"128",175000000,966550600,"The Jungle Book","A man-cub named Mowgli fostered by wolves. After a threat from the tiger Shere Khan, Mowgli is forced to flee the jungle, by which he embarks on a journey of self discovery with the help of the panther, Bagheera and the free-spirited bear, Baloo.",20.893818,3924,"2016-04-07","Released"
"129",18000000,88923251,"My Big Fat Greek Wedding 2","The continuing adventures of the Portokalos family. A follow-up to the 2002 comedy, ""My Big Fat Greek Wedding.""",7.914629,423,"2016-03-23","Released"
"130",0,0,"Un caballo llamado elefante","Two brothers sneak into a circus in order to free their grandfather's horse and fulfill his last wish.",0.104376,1,"2016-08-04","Released"
"131",0,0,"Open Season: Scared Silly","The humans and animals believe a werewolf is on the loose, and former hunter Shaw uses the opportunity to re-open the season. Boog, Elliot, and Mr. Weenie have to face their fears and find the werewolf to get the season closed permanently.",11.47887,83,"2016-03-08","Released"
"132",0,0,"Monster High: Great Scarrier Reef","Join the Monster High ghouls on an all new aquatic adventure as they dive deep into the crystal deep blue waters of the Great Scarrier Reef. When the ghouls get pulled in the school pool, they find themselves transported to a world of corals and florals - a wild underwater wonderland! But Lagoona is not there to see the sights - she's on a mission of the heart, as she realizes she has come home! She must confront her childhood nemesis and bully, come to terms with her own freaky flaws, win an aquatic dance extravaganza, and fight a terrible beast from the deep. So take the plunge - you won't believe what awaits you under the waves!",2.441419,15,"2016-02-12","Released"
"133",0,0,"Timber the Treasure Dog","A boy rises to the occasion with his best friend (a lovable talking dog) to save his home and family.",0.140539,3,"2016-05-26","Released"
"134",13500000,3342697,"Robinson Crusoe: The Wild Life","On a tiny exotic island, Tuesday, an outgoing parrot lives with his quirky animal friends in paradise. However, Tuesday can't stop dreaming about discovering the world. After a violent storm, Tuesday and his friends wake up to find a strange creature on the beach: Robinson Crusoe. Tuesday immediately views Crusoe as his ticket off the island to explore new lands. Likewise, Crusoe soon realizes that the key to surviving on the island is through the help of Tuesday and the other animals. It isn't always easy at first, as the animals don't speak ""human."" Slowly but surely, they all start living together in harmony, until one day, when their comfortable life is overturned by two savage cats, who wish to take control of the island. A battle ensues between the cats and the group of friends but Crusoe and the animals soon discover the true power of friendship up against all odds (even savage cats).",11.305966,106,"2016-02-04","Released"
"135",0,0,"Brother for a Day","Brother for a Day is a film about our city, our streets and our neighborhoods—a story that could happen anywhere. It tells the story of a thoroughly modern family of three members. In their struggle for money, the parents fail to devote much time or attention to their five-year-old daughter, Anja. They do not have the time or patience to explain things to her and they give her what she wants just to ‘buy some peace’. “Brother for a Day” at first glance appears to be a story of different nationalities; in fact, it refers to the divide between the child’s world and the world of adults.",0.053057,0,"2016-02-03","Released"
"136",0,0,"Rock'n'roll Will Never Die","Vince is a 13-year-old drummer. His father, Fred, is 48, and a faded guitarist and singer rock ""star."" He’s going to play with him one of his old tunes at his middle school summer party. The trouble is chain-smoker Fred doesn’t really have a voice any more. Besides, Fred is not really his father…",0.046624,0,"2016-02-01","Released"
"137",0,0,"Undercover Vampire Policeman","Thèo (17) is a teenager that is drawing and creating by himself and without any other incentive than his passion a series of underground comics called ""Undercover Vampire Policeman"". With her best friend and partner in crime (Ava) supporting him, he daydreams about leaving their world behind to be an illustrator.",0.093752,0,"2016-02-14","Released"
"138",0,3162153,"The Eagle Huntress","Follow Aisholpan, a 13-year-old girl, as she trains to become the first female in twelve generations of her Kazakh family to become an eagle hunter, and rise to the pinnacle of a tradition that has been typically been handed down from father to son for centuries.",6.156917,34,"2016-11-02","Released"
"139",5000000,5879736,"Captain Fantastic","A father living in the forests of the Pacific Northwest with his six young kids tries to assimilate back into society.",11.643568,2369,"2016-07-02","Released"
"140",145000000,521170825,"Kung Fu Panda 3","Continuing his ""legendary adventures of awesomeness"", Po must face two hugely epic, but different threats: one supernatural and the other a little closer to his home.",16.259104,2170,"2016-01-23","Released"
"141",0,0,"Barbie: Spy Squad","Barbie and her best friends Teresa and Renee transform from hard-working gymnasts to undercover secret agents. When their amazing gymnastics skills catch the eye of a top-secret spy agency, the girls are soon following clues to a gem-stealing cat burglar, using high-tech gadgets, glam disguises and cute robo-pets to save the day.",6.870237,47,"2016-01-15","Released"
"142",10333,0,"Prach a broky","",0.022353,0,"2015-12-26","Released"
"143",0,0,"Chibi Maruko-chan: The Boy from Italy","The story is about Hanawa's home had six friends come from different countries, under the request of the students, these foreign friends admitted Chibi Maruko and other student's home. Andrea from Italy, who lived in Maruko's home. Although they get along with a variety of cultures and backgrounds, they gradually became friends. Maruko and Andrea have developed a romantic love story...",0.066338,0,"2015-12-23","Released"
"144",0,0,"A Dog for Christmas","The entire family stays at Dave and Sandy's home for the holidays. Kassandra wants a puppy for Christmas, but Mom and Dad aren't ready for that. Will Santa grant Kassandra's only wish for Christmas?",0.057943,1,"2015-12-12","Released"
"145",0,1510000,"SOS, Santa Claus or Everything Will Come True!","A little girl Sveta has only one New Year wish - to make peace between her parents.",0.060619,0,"2015-12-10","Released"
"146",0,233755553,"Alvin and the Chipmunks: The Road Chip","Through a series of misunderstandings, Alvin, Simon and Theodore come to believe that Dave is going to propose to his new girlfriend in New York City - and dump them. They have three days to get to him and stop the proposal.",11.248899,590,"2015-12-17","Released"
"147",0,0,"The Name You Carry","When Vlace is suspended for hitting a classmate, Sasha is called to come get his son at school and has no choice but to take him along on his delivery route. During this intimate journey, we discover what provoked Vlace's uncharacteristic act, as father and son find their way toward a new understanding.",0.056547,1,"2015-11-14","Released"
"148",175000000,331926147,"The Good Dinosaur","An epic journey into the world of dinosaurs where an Apatosaurus named Arlo makes an unlikely human friend.",17.95763,2320,"2015-11-14","Released"
"149",0,0,"One Hell of a Plan","Two burglars release dozens of cats into a neighbourhood and start the dogs barking. They use the din to their advantage and dig up a bag of loot. However, the situation snowballs and turns into the worst night the burglars ever spent.",0.245986,0,"2015-11-04","Released"
"150",0,0,"Lo que nunca nos dijimos","Intimate story of a small family, starring Marian, only daughter of Dr. and Mrs. Di Mateo, who after several years of living in Mexico returns to his hometown Mendoza, because her father is dying; although the true intent of her return is to say what was sealed by the silence of the unspoken in an exemplary family as such as her mother claims to sustain.",0.020634,0,"2015-11-03","Released"
"151",0,0,"Afternoon Class","He's trying to stay awake in an afternoon class.",0.091445,2,"2015-10-31","Released"
"152",0,0,"Cold of Kalandar","Mehmet is a man who lives with his two children, wife, and mother in a mountain village on Black Sea. He earns his bread by breeding a few animals, while looking for a mineral reserve on the mountains with a great passion and hope. However, his endless pursuit is perceived as useless by his mother and wife. Destroyed in search of a mineral reserve, his hope is renewed with the news of a competition. Mehmet will attend the bull fight that will be held in Artvin, so he dedicates his time to training the bull in the stable till the day of competition.",0.440401,5,"2017-03-23","Released"
"153",0,0,"600 PS für zwei","",0.065066,0,"2015-10-22","Released"
"154",0,0,"Cosmic Scrat-tastrophe","Scrat struggles once again to protect his nut.",3.207014,54,"2015-11-06","Released"
"155",99000000,246233113,"The Peanuts Movie","Snoopy embarks upon his greatest mission as he and his team take to the skies to pursue their arch-nemesis, while his best pal Charlie Brown begins his own epic quest back home.",7.753343,722,"2015-11-05","Released"
"156",0,0,"Big Voice","BIG VOICE captures a tumultuous year in the life of a visionary high school choir teacher and his students as they overcome seemingly insurmountable obstacles to become one big voice in this inspiring musical documentary.",1e-06,4,"2015-10-18","Released"
"157",0,0,"Guards of the Forest","A man continues to throw rubbish into the forest, to the great annoyance of both the forest ranger and the forest animals, but when he refuses to stop, more drastic measures have to come into use – and this is where the forest ranger luckily gets the help of a dog, a cat and a mouse, who have had enough of the litter lout.",0.090588,2,"2015-10-18","Released"
