"","budget","revenue","title","overview","popularity","vote_count","release_date","status"
"1",280000,0,"Undertows","Seth’s world is falling apart around him, as his hatred towards his brother will cause him to make a bad choice that could lead to his death.",0.147882,0,"2019-11-26","In Production"
"2",0,0,"Untitled Lani Pixels Project","Evil forces have invaded an isolated island and have targeted Patrick and Susan's grandfather, Mr. Campbell. Guided by Jack, a charming Irish rogue, the siblings end up on a dangerous journey filled with magic and mystery.",1.227363,0,"2019-01-01","In Production"
"3",0,0,"Scraps","The story of a boy made of trash, built by his creator Gordon Grott as a surrogate for his estranged son. When Scraps comes to life one day and sees what a perfect family looks like, he decides to try and bond with the only father figure he has.",1.399118,1,"2018-04-23","Released"
"4",0,0,"Baba Yega: The Movie","",0.94594,1,"2018-03-28","Planned"
"5",17000000,269952634,"A Quiet Place","A family is forced to live in silence while hiding from creatures that hunt by sound.",50.695363,1070,"2018-04-05","Released"
"6",0,0,"Garfield: the Movie - James O'Donnell Edition","The Garfield Movie from 2004 gets given a fresh overhaul with all of Garfield's lines being replaced by James O'Donnell, the widely agreed human who most resembles Garfield. This is Garfield how it was meant to be seen.",0.778785,1,"2018-03-06","Released"
"7",500,0,"Ramekin","RAMEKIN tells the story of Emily (Jamie Saunders), a college girl in New York City coming to live in the spacious Upper West Side apartment of her recently-deceased grandmother. There she encounters a little white porcelain cup that slowly begins to control her life and demand the unthinkable.",0.28008,0,"2018-03-05","Released"
"8",0,0,"Two Piece","Ava is on the way to the beach with her mum Kelly and her little brother Wally, but before they go she needs to find a new swimsuit. At the age of 13, this task is nowhere near as simple as it sounds.",0.231876,0,"2018-02-17","Released"
"9",0,0,"A Kid Like Jake","A NYC couple navigate the competitive world of NYC kindergarten admissions while trying to understand what is best for their son.",7.335831,2,"2018-06-01","In Production"
"10",50000000,22900000,"Early Man","Set at the dawn of time when dinosaurs and woolly mammoths roamed the earth, Early Man tells the story of how one plucky caveman unites his tribe against a mighty enemy and saves the day.",32.764122,96,"2018-01-26","Released"
"11",0,0,"Dead Pigs","A pig farmer, a busboy, a salon owner, an expat architect and a jaded rich girl cross paths as thousands of dead pigs float down the Yangtze River toward Shanghai.",3.317065,0,"2018-01-19","Released"
"12",2469715,0,"CRUXMAN","",2.176272,0,"2018-01-19","Released"
"13",0,944348,"Enchanted Princess","A family comedy about a young Prince, who sets on a mission to find a missing Princess from the neighborhood kingdom. Along the journey, Prince meets a doopie dragon who joins him on an adventure, but Prince does not know that the dragon isn't who he says he is.",0.467719,0,"2018-01-01","Released"
"14",0,0,"Cool Cat: The Kids Superhero","Cool Cat is the Coolest Cat in the World. But Butch the Bully hates him and always tries to bully him, and Cool Cat shows kids how to win and be cool.",2.493417,0,"2018-01-01","Post Production"
"15",0,0,"Monky","Frank, 11 years old, finds one day's living monkey in the family garden. The monkey is called Monky. It's up to Franks family soon that Monky is not a regular monkey. Where does Monky come from and can she keep her from the village?",2.605391,0,"2017-12-22","Released"
"16",0,0,"I am William","William's father is dead and his mother is mentally ill, so he lives with his uncle Nils. Nils is on early retirement, making money by buying things cheap and selling them high. He has also accumulated a large debt and city's gangsters are on him, demanding that he pays it full.  William sets out to pay off the debt of his uncle - and perhaps his courage might impress Viola too, a girl from his class.",0.739721,1,"2017-12-21","Released"
"17",0,0,"A Level","After getting through the O/L Examination with outstanding results, Anuththara with his friends eagerly look forward to experience their final years in school as seniors in the A/L class. They befriend Ahinsa and the other new girls who join their school. Ahinsa draws everyone’s attention for her smartness as well as her cheerful yet mysterious behaviour. Her irregular school attendance and the rumours circulating about her, make the others suspect that there’s a hidden story behind her cheerfulness.",0.178211,1,"2017-12-18","Released"
"18",0,0,"95th Annual National Christmas Tree Lighting","On November 30, 2017 the National Park Service and National Park Foundation will present the annual National Christmas Tree Lighting. Popular entertainers and a United States military band add to the celebratory evening.",0.120617,0,"2017-11-30","Released"
"19",2000000,0,"Mayflower, Quiltshoe & The Rubens Brothers","When Kattilakoski family goes on a week-long Summer vacation to a rented cottage, the local police constables Bigbelly and Stronglass are joyful. Finally one week of peace! Their joy doubles when they win a rent-free summer cottage for one week. What they don't know is, that these two cottages are next to each other! When the truth comes out, the constables are forced to masquerade themselves to remain incognito. Unfortunately their alter egos, artistic Rubens brothers, become an instant hit for Mother Kattilakoski. Mayflower and Quiltshoe have instant doubts about Rubens; they must be escaped bandits instead. The girls set to prove their theory.",0.345387,0,"2017-11-24","Released"
"20",0,0,"Moomins and the Winter Wonderland","This winter is extraordinary; Moomintroll decides  to stay awake to explore the winter instead of hibernating as usually. And winters are certainly totally different than he had imagined. Strangest creatures wander amidst the snowdrifts; midwinter darkness surrounds the Moominvalley, and on top of that, an eccentric guest is soon to appear. This guest requires many measures, and is called Christmas, Hemulen tells to a surprised Moomintroll.",2.601673,3,"2017-11-23","In Production"
"21",0,0,"White Carnations","A single mother struggles with the futility of her relationship with her special needs son as her patience grows thin.",0.777286,0,"2017-11-20","Released"
"22",111000000,294764262,"Ferdinand","Ferdinand, a little bull, prefers sitting quietly under a cork tree just smelling the flowers versus jumping around, snorting, and butting heads with other bulls. As Ferdinand grows big and strong, his temperament remains mellow, but one day five men come to choose the ""biggest, fastest, roughest bull"" for the bullfights in Madrid and Ferdinand is mistakenly chosen.  Based on the classic 1936 children's book by Munro Leaf.",23.043009,689,"2017-12-09","Released"
"23",0,0,"Märta Proppmätt","The goldfish Märta Proppmätt (Meaty Märta) has a tendency to end up in situations where her hunger forces her to a dilemma. When the aquarium where she lives gets new inhabitants it becomes increasingly hard for Märta to eat and fart her way through life.",0.085932,0,"2017-09-22","Released"
"24",0,1735251,"Goodbye Christopher Robin","The behind the scenes story of the life of A.A. Milne and the creation of the Winnie the Pooh stories inspired by his son Christopher Robin.",13.249845,162,"2017-09-29","Released"
"25",70000000,123081555,"The LEGO Ninjago Movie","Six young ninjas are tasked with defending their island home of Ninjago. By night, they’re gifted warriors using their skill and awesome fleet of vehicles to fight villains and monsters. By day, they’re ordinary teens struggling against their greatest enemy....high school.",11.433415,239,"2017-09-21","Released"
"26",1400000,0,"The Secret Garden","Based on Frances Hodgson Burnett’s 1911 book, the story centers on Mary Lennox, a troubled, sickly, 10-year-old orphan who is sent to live with an uncle in England when her parents die in a cholera outbreak. Initially sour and rude, Mary begins to explore the grounds of her uncle’s estate and befriends a robin. After hearing of the eponymous walled garden, she sets out to find it, discovering it to be more magical than she ever could have imagined.",0.001537,0,"2017-09-09","Released"
"27",0,0,"<U+D638><U+BE44><U+C640> <U+B3D9><U+D654><U+B098><U+B77C> <U+B300><U+BAA8><U+D5D8>","",0.089574,0,"2017-09-05","Released"
"28",0,0,"Let Him Be a Basketball Player","Story of Ranta, always hungry, clumsy and infinitely tall teenage boy (so tall that he could tie a necktie for Giraffes). When the gym teacher at his school invites him to play for a basketball team, Ranta's world is turned upside down. So starts an exciting journey, full of unpredictable adventures with his funny friend/manager Smodlak by his side.",0.08766,0,"2017-09-14","Released"
"29",40000000,65146020,"The Nut Job 2: Nutty by Nature","When the evil mayor of Oakton decides to bulldoze Liberty Park and build a dangerous amusement park in its place, Surly Squirrel and his ragtag group of animal friends need to band together to save their home, defeat the mayor, and take back the park.",13.325158,175,"2017-08-11","Released"
"30",0,0,"The Lion Guard: The Rise of Scar","After using the Roar of the Elders in anger, Kion unwittingly summons the Pride Lands' greatest villain, Scar.",0.168575,1,"2017-07-29","Released"
"31",30000000,46372519,"The Son of Bigfoot","Teenage outsider Adam sets out on an epic and daring quest to uncover the mystery behind his long-lost dad, only to find out that he is none other than the legendary Bigfoot! He has been hiding deep in the forest for years to protect himself and his family from HairCo., a giant corporation eager to run scientific experiments with his special DNA. As father and son start making up for lost time after the boy's initial disbelief, Adam soon discovers that he too is gifted with superpowers beyond his imagination. But little do they know, HairCo. is on their tail as Adam's traces have led them to Bigfoot!",12.046134,81,"2017-07-27","Released"
"32",0,0,"The Jungle Bunch","Maurice may look like a penguin - but he's a real tiger inside! Raised by a tigress, he's the clumsiest kung-fu master ever. Along with his friends, The Jungle Bunch, he intends to maintain order and justice in the jungle, as his mother did before he. But Igor, an evil koala, wants to destroy the jungle once and for all—helped by his army of silly baboons.",4.35119,15,"2017-07-26","Released"
"33",0,0,"Shooting Girls","The Samrye Girl’s Middle School soccer club always loses. There’s no sufficient support for the club and to make matters worse, the main striker transfers to another school. Would it be feasible to make a miracle happen at the National Convention?",0.065355,0,"2017-07-15","Released"
"34",0,0,"Pokémon the Movie: I Choose You!","This is the story of how Ash and Pikachu first met. At first, Pikachu was disobedient towards Ash, but Ash only wanted to be friends with Pikachu. On the day they set out from Pallet Town, both of them saw a Ho-Oh flying and they made a vow to meet it.",14.747258,179,"2017-07-15","Released"
"35",0,0,"<U+0421><U+043A><U+0430><U+0437> <U+043E> <U+041F><U+0435><U+0442><U+0440><U+0435> <U+0438> <U+0424><U+0435><U+0432><U+0440><U+043E><U+043D><U+0438><U+0438>","",0.089401,0,"2017-07-06","Released"
"36",0,0,"Puppy!","The residents of Hotel Transylvania find their world turned upside-down when youngster Dennis gets a surprise monster-sized pet.",3.785028,14,"2017-07-28","Released"
"37",0,4870000,"The Big Bad Fox and Other Tales","The Big Bad Fox recounts the misadventures of a young clumsy Fox and a feisty little red Hen.  The Fox, both a little stupid and naïve, tries daily to devour the little Hen, without success. Tired of the repeated humiliation, the Fox is persuaded to steal the Hen’s eggs to raise and then eat. This plan seems perfect, until the moment the chicks hatch…",4.957378,42,"2017-06-21","Released"
"38",80000000,1031552585,"Despicable Me 3","Gru and his wife Lucy must stop former '80s child star Balthazar Bratt from achieving world domination.",18.663623,2977,"2017-06-15","Released"
"39",3400000,0,"Rip Tide","There comes a point in everyone’s life when you have to make a decision about the direction you’re going to take. For newly-18 American fashion model Cora, that time is now. She’s moved to an Australian coastal town to be with her favourite aunt, after a 'fashion faux pas’ back home.",9.327166,95,"2017-06-10","Released"
"40",0,0,"In a Heartbeat","A closeted boy runs the risk of being outed by his own heart after it pops out of his chest to chase down the boy of his dreams.",9.625608,409,"2017-06-01","Released"
"41",0,0,"La memoria de mi padre","",2.173448,1,"2017-05-23","Released"
"42",175000000,383925276,"Cars 3","Blindsided by a new generation of blazing-fast racers, the legendary Lightning McQueen is suddenly pushed out of the sport he loves. To get back in the game, he will need the help of an eager young race technician with her own plan to win, inspiration from the late Fabulous Hudson Hornet, and a few unexpected turns. Proving that #95 isn't through yet will test the heart of a champion on Piston Cup Racing’s biggest stage!",25.533063,1594,"2017-06-15","Released"
"43",0,0,"Porcupine Lake","During a hot and hazy summertime in northern Ontario, 13-year-old Bea wants a best friend more than anything else, but when she meets boisterous Kate, she gets more than she imagined. A story of bravery, small-town summer love, and the secret world of girls.",2.397054,0,"2017-05-21","Released"
"44",0,0,"Tea Pets","A group of tea pets—cute clay figurines that are good-luck charms for tea drinkers—embark on a magical animated adventure to find a fabled mystic.",2.422403,1,"2017-07-21","Released"
"45",22000000,40120144,"Diary of a Wimpy Kid: The Long Haul","A Heffley family road trip to attend Meemaw's 90th birthday party goes hilariously off course thanks to Greg's newest scheme to get to a video gaming convention.",6.728235,104,"2017-05-19","Released"
"46",0,0,"Raymond's 5","Raymond's 5 is a story following a middle-aged man, ""Raymond"" who has been told he has just 30 more days to live. Raymond goes on a journey around the country visiting the 5 people he feels he has done the most wrong by in his life.",1.31614,1,"2017-05-18","Released"
"47",0,0,"A Stork's Journey","Orphaned at birth and raised by storks, the teenage sparrow Richard believes he is one of them. But when the time comes to migrate to Africa, his stork family is forced to reveal his true identity and leave him behind in the forest, since he is not a migratory bird and would not survive the journey. Determined to prove he is a stork after all, Richard ventures south on his own. But only with the help of Olga, an eccentric owl with an imaginary friend and Kiki, a narcissistic, disco-singing parakeet, does he stand a chance to reach his goal and learn to accept who he really is.",5.540219,37,"2017-05-05","Released"
"48",0,0,"Qwerty","A grieving young inventor finds solace in repairing an antique typewriter.",0.079622,0,"2017-05-05","Released"
"49",0,0,"Fantastic Journey to Oz","The cunning and wicked Urfin wants to become ruler of Magic Land. With an army of wooden soldiers, he captures the Emerald City and renames it ti Urfinville. He is all but ready to celebrate victory, when his plans are ruined by an ordinary girl named Dorothy, who arrives in Magic Land just at the right time. She must return home, but not before she helps her friends - the Scarecrow, the Tin Man, and new-brave Lion - defeat Urfin. And in order to do that, they need to find out who he really is.",8.317291,2,"2017-04-20","Released"
"50",0,0,"Black Dog, Red Dog","Follows the life of Stephen Dobyns as he deals with life, women, and his move from journalism to poetry.",0.892269,2,"2017-04-05","Post Production"
"51",60000000,197183546,"Smurfs: The Lost Village","In this fully animated, all-new take on the Smurfs, a mysterious map sets Smurfette and her friends Brainy, Clumsy and Hefty on an exciting race through the Forbidden Forest leading to the discovery of the biggest secret in Smurf history.",13.888315,490,"2017-03-23","Released"
"52",4000,0,"La chica del bañador verde","",0.082256,1,"2017-03-17","Released"
"53",0,0,"Lou","A Pixar short about a lost-and-found box and the unseen monster within.",6.430518,84,"2017-06-16","Released"
"54",125000000,498814908,"The Boss Baby","A story about how a new baby's arrival impacts a family, told from the point of view of a delightfully unreliable narrator, a wildly imaginative 7 year old named Tim.",7.800983,3194,"2017-03-23","Released"
"55",0,0,"DAM! The Story of Kit the Beaver","DAM! The Story of Kit the Beaver is an animated film that’s not about your average beaver. It’s the tale of Kit, a very independent (and easily distracted) young beaver who loves to explore the sounds of the forest she lives in. Animated short with original orchestral score performed by The Toronto Symphony Orchestra.",0.044715,0,"2017-02-25","Released"
"56",160000000,1263521126,"Beauty and the Beast","A live-action adaptation of Disney's version of the classic tale of a cursed prince and a beautiful young woman who helps him break the spell.",83.426594,8274,"2017-03-16","Released"
"57",0,0,"Oskar's America","Oskar's deepest wish is to be able to ride on the prairie with his mother over summer break. But alas, everything turns out differently than expected and the 10-year-old is forced to spend his vacation on his grumpy grandfather's farm. Oskar's only friend is the outsider Levi, who talks with his pony. Together they hatch a plan to get away from their grim reality: they’ll row across the Atlantic to America in grandfather's boat!",0.068855,0,"2017-03-24","Released"
"58",0,0,"Beyond the Clouds","Teenager Amir is constantly dodging trouble while dealing drugs in the underbelly of Mumbai. Following a drug bust, he evades the cops and ends up on the doorstep of his estranged sister Tara. Complications from concealing Amir land Tara in jail, but she still sees her brother as her only hope of living in the outside world again. While their lives have been darkened by despair, hope may shine from beyond the clouds.",3.099878,3,"2018-04-20","Released"
"59",80000000,311950384,"The Lego Batman Movie","In the irreverent spirit of fun that made “The Lego Movie” a worldwide phenomenon, the self-described leading man of that ensemble—Lego Batman—stars in his own big-screen adventure. But there are big changes brewing in Gotham, and if he wants to save the city from The Joker’s hostile takeover, Batman may have to drop the lone vigilante thing, try to work with others and maybe, just maybe, learn to lighten up.",15.129469,2101,"2017-02-08","Released"
"60",0,0,"TRIO - The Hunt for the Holy Shrine","Multicuentas de Bravier: Tazzita, Paraleyeng, Scoobitops, betelchuse, rusakyra82, Fruititop, rorywilliams, DjVerneda, javi3381, francisgar, hipnos22, alex_dj_, juanchuloperron, akyra, juananlo, frvico...",1.66559,4,"2017-02-17","Released"
"61",0,0,"Subdued","After her divorce Mina is in need to financial and emotional supporting. She meets a guy and thinks that this is the man of her dreams. But things are not just as their first seem to be.",0.436442,3,"2017-02-01","Released"
"62",0,0,"Stonehead","10-year-old Shi Tou, the son of a migrant laborer, grows up alone with his grandmother. Sharing a reward with a classmate or waiting until his father returns, obeying his teacher or protecting his friend - which one should he choose?",0.161358,2,"2017-02-01","Released"
"63",0,0,"Rabbit School","Rabbit Max, a juvenile shoplifter, gets trapped in an old-fashioned school. With rabbit girl Emmy, he acquires Easter Rabbits' secret skills, battles a sneaky fox family and learns about friendship.",0.637042,3,"2017-03-16","Released"
"64",0,0,"Tesoros","Siblings Dylan and Andrea set off with their new friends on a marvelous journey of discovery in search of long lost pirate loot.",0.060014,0,"2017-02-01","Released"
"65",0,0,"Ghostbrothers","How do you know that someone is a ghost? You can't see his legs.",0.042353,0,"2017-01-31","Released"
"66",0,0,"Bitch","The provocative tale of a woman who snaps under crushing life pressures and assumes the psyche of a vicious dog. Her philandering, absentee husband is forced to become reacquainted with his four children and sister-in-law as they attempt to keep the family together during this bizarre crisis.",3.895439,17,"2017-01-20","Released"
"67",0,0,"Red Dog: True Blue","Explores the early events leading up to Red Dog's discovery on the road to Dampier, and his ultimate rise from ordinary dog to Australian legend.",3.943586,29,"2016-12-26","Released"
"68",0,0,"Survival Family","A world wide electrical outage occurs. Everything that requires electricity comes to a stop. Tokyo is nearly ruined. Yoshiyuki Suzuki (Fumiyo Kohinata) decides to escape from Tokyo with his family.",1.264761,8,"2017-02-11","Released"
"69",0,0,"Christmas with the Andersons","Drowning in tinsel and lights every Christmas, Michael and Caroline Anderson throw the year’s biggest party at their house. But this year, with Michael jobless and Caroline’s store struggling, that tradition may end. The Andersons decide to host a very different kind of party and, in the process, rediscover what’s most important about the holiday.",0.144595,1,"2016-12-09","Released"
"70",0,0,"I'll Be Home for Christmas","Jackie Foster, a dynamic Assistant District Attorney and single mom, is looking forward to wrapping up her latest case and spending Christmas with Gracie, her adorable and precocious, eight-year old daughter. But when Jackie’s estranged dad, Jack , a gruff retired police officer, unexpectedly shows up at her door, they will be forced to confront old wounds.",2.269413,24,"2016-11-27","Released"
"71",0,0,"Boxing Day: A Day After Christmas","Money is not necessarily the key to happiness. It can easily be considered man's worst downfall. Michael Adeyemi was destined to be a billionaire by the age of 35 and with money comes access to the fine things of life. Find out how Michael's desperate quest for fortune and success would cost him the number one thing money cannot buy - Family. Blinded by selfish ambitions, pride and appetite for greed leads him down a path of self-destruction, blinding him to the only thing that is worth saving. It all comes crashing down on ""Boxing Day"" where Michael is swept under a sea of adversities caused by none other than himself. Watch this downpour of self-inflicted wave of adversities with rippling effects that triggers thought provoking questions, of love, pain, pride and ultimate redemption - what if you never get that second chance?",2.353098,0,"2017-02-12","Released"
"72",150000000,643331111,"Moana","In Ancient Polynesia, when a terrible curse incurred by Maui reaches an impetuous Chieftain's daughter's island, she answers the Ocean's call to seek out the demigod to set things right.",5.596225,4844,"2016-11-23","Released"
"73",180000000,809342332,"Fantastic Beasts and Where to Find Them","In 1926, Newt Scamander arrives at the Magical Congress of the United States of America with a magically expanded briefcase, which houses a number of dangerous creatures and their habitats. When the creatures escape from the briefcase, it sends the American wizarding authorities after Newt, and threatens to strain even further the state of magical and non-magical relations.",29.73328,8153,"2016-11-16","Released"
"74",0,0,"The Geneva Convention","As Hakim is waiting for the bus after class, he is caught in a vendetta between teenagers. He is not exactly keen to get into a fight, but how can he possibly avoid an awaited confrontation?",0.146675,0,"2016-11-04","Released"
"75",0,0,"Loewie","One quiet autumn evening, Elisa gets a surprise visit from her grandfather. He tells her an enchanting Saint-Nicolas story...",0.069588,1,"2016-10-29","Released"
"76",0,0,"Las furias","",0.369842,4,"2016-11-11","Released"
"77",0,0,"Up in the Sky","Pottan is going to a riding camp, but ends up at a recycling center where she is taken care of by the strange staff. One day Pottan finds out that the staff are building a space rocket.",0.170936,0,"2016-10-21","Released"
"78",30000000,2351359,"Ballerina","Set in 1879 Paris. An orphan girl dreams of becoming a ballerina and flees her rural Brittany for Paris, where she passes for someone else and accedes to the position of pupil at the Grand Opera house.",14.037791,683,"2016-12-14","Released"
"79",0,0,"Tatu and Patu","",0.159624,0,"2016-10-19","Released"
"80",125000000,346864462,"Trolls","Lovable and friendly, the trolls love to play around. But one day, a mysterious giant shows up to end the party. Poppy, the optimistic leader of the Trolls, and her polar opposite, Branch, must embark on an adventure that takes them far beyond the only world they’ve ever known.",19.172778,1377,"2016-10-13","Released"
"81",111000000,296485718,"Miss Peregrine's Home for Peculiar Children","A teenager finds himself transported to an island where he must help protect a group of orphans with special powers from creatures intent on destroying them.",20.269633,4641,"2016-09-28","Released"
"82",0,0,"Heartland","A young Oklahoma artist, struggling with a recent death, finds escape in a reckless affair with her brother's girlfriend.",0.480946,8,"2016-09-24","Released"
"83",0,0,"One Hundred and Fifty Years of Life","A 90-year-old man struggles to care for his mentally handicapped son.",0.154146,2,"2016-09-22","Released"
