"","budget","revenue","title","overview","popularity","vote_count","release_date","status"
"158",0,0,"The Red Herring","One sunny day in the Antarctic, a little fisher-penguin catches fish for his friends. They are impatient for more as always. Into this happy scene arrives a charming salesman. Dazzled by his confidence and his fish-shaped tie, the penguins follow him away, leaving the fisher-penguin alone. It’s not long before the group has returned, this time with a huge, heavy fishing machine. As it cranks into gear, the fisher-penguin looks at the ice worriedly…. this surely won’t end well…",0.250141,2,"2015-10-18","Released"
"159",0,0,"Ladybug","The Ladybug has been taken prisoner. Now she is living in a teensy tiny matchbox and plotting her escape.",0.058937,1,"2015-10-18","Released"
"160",0,0,"Die Badewanne","The short film tells the story about three brothers who try to dive back into their childhood by re-enacting an old family picture.",0.071191,1,"2016-02-06","Released"
"161",0,0,"Lift me up","A young lady, who recently lost her mother, faces the challenges of high school and her very strict step-father. Through personal growth, and an amazing dedication to dance, she learns to find the peace and happiness of family.",0.893154,10,"2015-10-04","Released"
"162",0,0,"Departure","An English mother and her teenage son spend a week preparing the sale of their remote holiday house in the South of France. Fifteen-year-old Elliot struggles with his dawning sexuality and an increasing alienation from his mother, Beatrice. She in turn is confronted by the realisation that her marriage to his father, Philip, has grown loveless and the life she knows is coming to an end. When an enigmatic local teenager, Clément, quietly enters their lives, both mother and son are compelled to confront their desires and, finally, each other.",1.678681,28,"2016-05-20","Released"
"163",0,0,"Wind Through a Tree","In this poetic home movie, an unrelated family of four are connected by themes of loneliness and isolation",0.02,0,"2015-09-19","Released"
"164",0,0,"Phantom Boy","An 11-year-old boy becomes an unlikely superhero when he discovers that he has the ability to leave his body and fly through walls.",3.530485,17,"2015-10-14","Released"
"165",0,0,"The Visitor","Ten years after being thrown out of her parental home, Nur hears that her mother is at death's door. Taking her young daughter with her, Nur hurries back to her father's world to see, and reconcile with her mother before it is too late. While the universal theme of mother-daughter relationships lies at the centre of the film, this is underpinned by an allusive subtext of incest, one of most common but least addressed social problems in Turkey. The individual stories of the family members combine with a sense of hope fuelled by tragedy to paint a portrait of the socially disconnected.",0.079061,1,"2015-09-11","Released"
"166",0,0,"Tracks","An amateur skateboarder is left to care for his girlfriend's young daughter on the day of a championship tournament.",0.058167,0,"2015-09-05","Released"
"167",14000000,8306690,"Capture the Flag","When the brave and determined 12-year-old Mike Goldwing discovers that an eccentric billionaire plans to fly to the moon, steal its vast, valuable natural resources, and destroy the American flag planted by the Apollo XI astronauts during man's historic moon landing, the countdown to a spectacular adventure begins! Mike, teamed with his grandfather, best friends Amy and Marty, and a clever chameleon, blasts off on an incredible moon-bound mission, determined to thwart the billionaire's evil plan, capture the flag, and reunite his family.",7.767459,77,"2015-08-28","Released"
"168",0,0,"Godless","Two brothers reconnect after the death of their parents.",0.517121,6,"2015-08-06","Released"
"169",14000000,98000000,"Bajrangi Bhaijaan","A young mute girl from Pakistan loses herself in India with no way to head back. A devoted man with a magnanimous spirit undertakes the task to get her back to her motherland and unite her with her family.",7.560716,186,"2015-07-17","Released"
"170",0,0,"Die kleinen Dinge","",0.109994,1,"2015-07-05","Released"
"171",0,0,"Goiabas","An apartment building in a small village, live human characters and funny puppets. The building moves a new family with their daughter Billie who love to discover the magical corners common building and especially the guava tree. However, there are those who are less like the guava tree, whose fruits fall directly in the territory and is rich mayor who decides to uproot the tree.",0.056787,1,"2015-07-02","Released"
"172",0,0,"Family Party","On the 70th birthday of famous piano virtuoso Hannes Westhoff, a celebration is to take place at the patriarch's estate. For this occasion, his second wife Anne not only invited Westhoff's three sons Max, Fredrik and Gregor, but also their mother, Westhoff's ex-wife Renate. While Anne tries to maintain a friendly atmosphere, old conflicts resurface among the family. With tensions already high, things take a turn for the dramatic when son Max reveals shocking news.",0.159284,3,"2015-10-15","Released"
"173",74000000,1156730962,"Minions","Minions Stuart, Kevin and Bob are recruited by Scarlet Overkill, a super-villain who, alongside her inventor husband Herb, hatches a plot to take over the world.",13.828781,6156,"2015-06-17","Released"
"174",0,0,"Growing Up Smith","In 1979, an Indian family moves to America with hopes of living the American Dream. While their 10-year-old boy Smith falls head-over-heels for the girl next door, his desire to become a ""good old boy"" propels him further away from his family's ideals than ever before.",1.103642,13,"2017-02-03","Released"
"175",175000000,857611174,"Inside Out","Growing up can be a bumpy road, and it's no exception for Riley, who is uprooted from her Midwest life when her father starts a new job in San Francisco. Like all of us, Riley is guided by her emotions - Joy, Fear, Anger, Disgust and Sadness. The emotions live in Headquarters, the control center inside Riley's mind, where they help advise her through everyday life. As Riley and her emotions struggle to adjust to a new life in San Francisco, turmoil ensues in Headquarters. Although Joy, Riley's main and most important emotion, tries to keep things positive, the emotions conflict on how best to navigate a new city, house and school.",29.971792,9180,"2015-06-09","Released"
"176",0,0,"Scenes at the Sea","Sea. Road. One day from life of men and women. One year ago after losing child, they have been unable to understand the depth of this pain. Trying to find solace in each other, they realize that they do not know each other ...",0.055404,0,"2015-05-13","Released"
"177",190000000,209154322,"Tomorrowland","Bound by a shared destiny, a bright, optimistic teen bursting with scientific curiosity and a former boy-genius inventor jaded by disillusionment embark on a danger-filled mission to unearth the secrets of an enigmatic place somewhere in time and space that exists in their collective memory as ""Tomorrowland.""",26.202951,3636,"2015-05-19","Released"
"178",0,0,"Jack of the Red Hearts","A teenage con artist tricks a desperate mother into hiring her as a live-in companion for her autistic daughter.",2.039514,41,"2016-02-26","Released"
"179",0,0,"Martian","A little boy pulls out one Martian toy from a vending machine and it turns into a real alien who takes him to his planet, where he is surronded by the toys from the vending machine, but much bigger.",0.052231,1,"2015-05-04","Released"
"180",0,0,"Belaseshe","A story of relationships that explores the intricacies of the married life, of life-long companionship, of promises and expectations and love.",0.129694,3,"2015-05-01","Released"
"181",0,0,"The Gnomist","Deep in the forest of Overland Park, Kansas little gnomes made a home. But how did they get there? Experience the feel-good story of paying it forward, one tiny magical house at a time.",0.127189,1,"2015-04-24","Released"
"182",0,0,"Merry Xmas","The story of a mischievous father who calls his very busy kids to tell them that, after 55 years of marriage, he and their mom are getting divorced. Horrified by the news, the children prepare to fly home to stop the divorce and save their parent's marriage.",0.023134,0,"2015-04-19","Released"
"183",0,0,"Mother(s)","The 8-year-old Aida lives in an apartment in the Parisian suburb. The daily life of Aida and the whole family is overwhelmed when her father comes back from Senegal, their country of origin. Actually, he did not come back alone. He returned with the young Senegalese Rama whom he introduced as his second wife. Aida is very sensitive to her mother's distress. She decides then to get rid of the new visitor.",0.336152,1,"2015-09-11","Released"
"184",0,0,"Skateboarding's First Wave","Explore the origins of skateboarding culture through the lens of the 1965 Palisades Skateboard Team, who reinvented a childhood hobby into a sport, bringing it to the vanguard of popular culture. Features interviews with the team members reflecting on how the sport has changed, 50 years later.",0.032329,0,"2015-04-13","Released"
"185",0,0,"The Law of the Jungle","A clever little monkey remembers to keep his wits about him when the bigger monkeys encroach on his bounty of bananas.",0.032575,0,"2015-04-11","Released"
"186",0,0,"The Last Days Of Cinema","As cinemas in the city are closing their doors, the relationship between Leandro and his son Martín fades away. Leandro will try to redeem his past errors on time for Martín to be able to dream again.",0.031753,0,"2015-03-13","Released"
"187",0,0,"Waves from the Sky","Pedro, a bird who cannot fly in sync with his flock, decides to branch out on his own.",0.086065,2,"2015-03-01","Released"
"188",0,0,"Girl on the Edge","A powerful true story about the journey of a troubled teenage girl who finds healing in the most unlikely of places, and who must choose to either invest in her own recovery or succumb to the trauma of her past.",1.440815,22,"2015-02-23","Released"
"189",0,0,"Gord's Brother","Gord's Brother is set in a world where monsters and humans co-exist, and follows the story of Gord and his monster brother as they run away to find a new home and search for the fabled City of Monsters.",0.080962,0,"2015-02-14","Released"
"190",0,0,"Frozen Fever","On Anna's birthday, Elsa and Kristoff are determined to give her the best celebration ever, but Elsa's icy powers may put more than just the party at risk.",7.867094,820,"2015-03-09","Released"
"191",95000000,543514353,"Cinderella","When her father unexpectedly passes away, young Ella finds herself at the mercy of her cruel stepmother and her daughters. Never one to give up hope, Ella's fortunes begin to change after meeting a dashing stranger in the woods.",27.967536,3276,"2015-03-12","Released"
"192",0,0,"The Misplaced World","By chance Paul Kromberger discovers on the internet a photograph of the US opera diva Caterina Fabiani who is the spitting image of Evelyn, his dead wife. His unease and growing sense of alarm are transferred to his daughter, Sophie. Filled with curiosity, she leaves Germany and journeys across the Atlantic to make contact with this stranger.",1.518302,2,"2015-05-07","Released"
"193",0,59700000,"Shaun the Sheep Movie","When Shaun decides to take the day off and have some fun, he gets a little more action than he bargained for. A mix up with the Farmer, a caravan and a very steep hill lead them all to the Big City and it's up to Shaun and the flock to return everyone safely to the green grass of home.",12.609028,551,"2015-02-05","Released"
"194",0,0,"Ture the Dice","Imagine that a small piece of wood can determine such large fortunes for us humans. And a ladybug can off even fall in love in a red dice with black spots.",0.055158,1,"2015-01-24","Released"
"195",0,0,"Addicted to Sheep","Set in the North Pennines, an intimate portrait of a year in the life of tenant hill farmers Tom and Kay Hutchinson as they try to breed the perfect sheep.",0.050592,1,"2015-01-01","Released"
"196",0,0,"True Places Never Are","A boy trapped in sadness discovers a mysterious hole in one of the old books his grandfather left behind.",0.015315,0,"2015-01-01","Released"
"197",0,0,"The First Men","An overextended teacher bumps into a troubled student while at the mall with her mom.  An adaptation of Stacey Richter's Pushcart Prize winning short story.",0.016212,0,"2015-01-01","Released"
"198",0,0,"A Short Story","Focusing on the predicaments of those born with genetic defect causing dwarfism, the film is the love story between Khoka and Soma.",0.051821,1,"2015-01-23","Released"
"199",132000000,373552094,"Penguins of Madagascar","Skipper, Kowalski, Rico and Private join forces with undercover organization The North Wind to stop the villainous Dr. Octavius Brine from destroying the world as we know it.",24.501779,1708,"2014-11-22","Released"
"200",165000000,657818612,"Big Hero 6","The special bond that develops between plus-sized inflatable robot Baymax, and prodigy Hiro Hamada, who team up with a group of friends to form a band of high-tech heroes.",28.972359,7982,"2014-10-24","Released"
"201",0,0,"American Gladiators","Jean's little sister, Mae, may be sick, but Jean is sick of it...Mae is a bully and gets everything she wants, including Jean's pennant flag.",0.05138,1,"2014-10-11","Released"
"202",0,0,"Yellowbird","Yellowbird lives in the ruins of an old house. He lacks the confidence to leave his home, no matter how much Bug, his labybird friend, tries to convince him to go out into the world. Attempts to toughen him up have had little success, so Bug seizes an opportunity that leaves Yellowbird unexpectedly finding himself the new leader of the flock that is migrating to Africa. Still, lacking faith in his own abilities and with danger and imminent failure lurking around every corner, our feathered hero is forced to either find the strength required to work with the team or bow out and stay hidden away forever.",3.978384,16,"2014-11-06","Released"
"203",0,0,"Lava","The story follows the love story of two volcanoes, Uku and Lele. It features a song, ""Lava"", which is written by Murphy and performed by Kuana Torres Kahele and Napua Greig, who voice the two volcanoes.",8.184504,481,"2014-10-10","Released"
"204",0,0,"Horse Camp","What’s the matter with Kathy (Jordan Trovillion, Highland Park)? She’s your typical 17 year-old girl in search of something more in her life. It seems the only place she is going to find it is at Horse Camp. Her father Luke (Dean Cain, Lois &amp; Clark: The New Adventures of Superman) recognizes that she’s got it in her blood, a sensibility in her being - she understands horses just as much as they understand her. But at Horse Camp there is much more to learn, not only about horses, but about people and the many challenges of friendship.",0.525176,2,"2015-01-10","Released"
"205",0,0,"Felix and Meira","A young married woman from Montreal's Orthodox Jewish community finds freedom from the strictures of her faith through her relationship with a young man who is mourning the death of his estranged father.",0.990763,12,"2015-01-11","Released"
"206",0,0,"Barbie and the Secret Door","It's the ultimate fairytale musical! Barbie stars as Alexa, a shy princess who discovers a secret door in her kingdom and enters a whimsical land filled with magical creatures and surprises. Inside, Alexa meets Romy and Nori, a mermaid and a fairy, who explain that a spoiled ruler named Malucia is trying to take all the magic in the land. To her surprise, Alexa has magical powers in this world, and her new friends are certain that only she can restore their magic. Discover what happens when Alexa finds the courage to stand up for what's right and learns that the power of friendship is far more precious than magic.",2.857499,44,"2014-08-30","Released"
"207",0,0,"Ribbit","A frog who hates the water and jumping wishes that he could be like the other animals in the Amazon rainforest.",2.303794,16,"2014-06-21","Released"
"208",0,0,"Feast","This Oscar-winning animated short film tells the story of one man's love life as seen through the eyes of his best friend and dog, Winston, and revealed bite by bite through the meals they share.",7.884356,494,"2014-11-07","Released"
"209",145000000,609123048,"How to Train Your Dragon 2","The thrilling second chapter of the epic How To Train Your Dragon trilogy brings back the fantastical world of Hiccup and Toothless five years later. While Astrid, Snotlout and the rest of the gang are challenging each other to dragon races (the island's new favorite contact sport), the now inseparable pair journey through the skies, charting unmapped territories and exploring new worlds. When one of their adventures leads to the discovery of a secret ice cave that is home to hundreds of new wild dragons and the mysterious Dragon Rider, the two friends find themselves at the center of a battle to protect the peace.",24.27146,4016,"2014-06-12","Released"
"210",0,0,"The Longest Game","Meet Hal, 87; Charlie, 87 and Maurie, 87. Three of a group of friends who gather every day at one p.m. in the village of Dorset, Vermont to play a game called ""paddle tennis"". They have been playing together for years. Moving beyond paddle tennis, The Longest Game takes on the 'game' of life, the stories we tell and the underlying forces that connect us all.",0.342388,0,"2018-07-26","Released"
"211",0,0,"Snow","It is a crucial day in the home of the once affluent and respected, but now penniless, Vaziri family: they have to ward off debt collectors, delay foreclosure on their stately house, keep the lid tight on scandalous secrets, and hold on to the reputable image for long enough to honorably receive the long-awaited, moneyed suitor of their only daughter.",0.185058,1,"2014-03-23","Released"
"212",0,0,"Viktoria","Dreaming of the West, Boryana is determined not to have a child in communist Bulgaria. Nonetheless, her daughter Viktoria enters the world in 1979, curiously missing a belly button, and is declared the country’s Baby of the Decade. Pampered by her mother state until the age of nine, Viktoria’s decade of notoriety comes crashing down with the rest of European communism. But can political collapse and the hardship of new times finally bring Viktoria and her reluctant mother closer together",0.325157,5,"2014-09-17","Released"
"213",0,0,"The Nut Job","Surly, a curmudgeon, independent squirrel is banished from his park and forced to survive in the city. Lucky for him, he stumbles on the one thing that may be able to save his life, and the rest of park community, as they gear up for winter - Maury's Nut Store.",9.380641,415,"2014-01-17","Released"
"214",0,0,"Gartenfeind","",0.146892,1,"2014-01-01","Released"
"215",150000000,1274219009,"Frozen","Young princess Anna of Arendelle dreams about finding true love at her sister Elsa’s coronation. Fate takes her on a dangerous journey in an attempt to end the eternal winter that has fallen over the kingdom. She's accompanied by ice delivery man Kristoff, his reindeer Sven, and snowman Olaf. On an adventure where she will find out what friendship, courage, family, and true love really means.",29.891316,7074,"2013-11-27","Released"
"216",0,0,"Zip & Zap and the Marble Gang","Zip and Zap, two mischievous twins, were placed in the Esperanza, a school where the games are prohibited. There will found the Club of Marble, child resistance to challenge the authority of adults. Thanks to her intelligence, her courage and her unwavering faith in friendship, Zip and Zap and the rest of the club will discover a mysterious secret that is hidden in the school and live the most exciting adventure of their lives.",4.498495,20,"2013-10-04","Released"
"217",0,0,"My Boy","Impulse disorder patient Icheon fantasizes about playing with his brother Yucheon in the hospital. But to those who don’t know about his fantasies, Icheon is just a strange boy. His mother struggles with paying the hospital bills, and barely gets by, receiving help from her husband’s friend.",0.01395,0,"2014-04-10","Released"
"218",0,0,"The Return","It has been a year since his older brother has left and Willy, fifteen, is waiting impatiently for him to come home. He thinks he knows everything about Theo, but shortly after his return, he discovers a secret about him.",0.051044,1,"2014-12-20","Released"
"219",0,0,"Boy & the World","Suffering because of his father departure to the big city, a boy leaves his village and discovers a fantastic world dominated by bug-engines and strange beings. An unusual animation with various artistic techniques that portrays the issues of the modern world through the eyes of a child.",3.938392,87,"2014-01-17","Released"
"220",3000,0,"Queen for a Day","In Sara's class, the popular kids, also known as the kings and queens, are subjected to daily humiliations, which include having their pants pulled down or water thrown on them, but this is only a sign of their elevated status. Sara is the only blond and blue-eyed girl in her class, and she is completely overlooked by the kings and queens who do not have blond hair and blue eyes. She has a secret crush on one of the kings, who is way out of her league, and she doesn't have any friends either, but would like to become friends with Karen, also an outsider who aspires to a better status. One day, Sara eyes an opportunity to boost her popularity by humiliating herself and thereby become queen. Karen instantly becomes her friend, she seems to catch the eye of her kingly crush and popularity appears within her reach. However, her happiness is short-lived, and in the end she learns a far more valuable lesson than how to be queen for a day.",0.053129,0,"2013-09-06","Released"
"221",0,0,"Party Central","Mike and Sulley are back at Monsters University for a fun-filled weekend with their Oozma Kappa fraternity brothers. The gang is throwing their first party, but no one’s showing up. Luckily for them, Mike and Sulley have come up with a plan to make sure “Party Central” is the most epic party the school has ever seen.",3.011023,26,"2014-03-21","Released"
"222",76000000,970761885,"Despicable Me 2","Gru is recruited by the Anti-Villain League to help deal with a powerful new super criminal.",24.677955,5780,"2013-06-25","Released"
"223",0,0,"Get a Horse!","Mickey, Minnie, Horace Horsecollar, and Clarabelle Cow go on a musical wagon ride until Peg-Leg Pete tries to run them off the road.",5.077755,101,"2013-11-27","Released"
"224",0,0,"À pleines dents","",0.01097,0,"2013-06-07","Released"
"225",200000000,743559607,"Monsters University","A look at the relationship between Mike and Sulley during their days at Monsters University — when they weren't necessarily the best of friends.",15.211014,4723,"2013-06-20","Released"
"226",0,0,"Cool Cat Finds a Gun","Cool Cat and his friends find a gun and then Cool Cat shows kids the right thing to do if they find a gun or see someone at school that has one.",0.28945,0,"2013-05-01","Released"
"227",15000000,0,"Black to the Moon 3D","Blackie, the black sheep, is obsessed with going to the moon. Kanuto, the sheepdog, is obsessed with Blackie, but he will not hear of rockets. However, undertaking the trip just dreamed Blackie. Along the way are cows that are opera singers, gallant wolves, spiders illegal immigrants and a strange little group of dogs that have a rocket ready to take off. But Pinky, a huge pink sheep devilish character, prevents it.",0.582876,3,"2013-02-15","Released"
"228",135000000,585178928,"The Croods","The Croods is a prehistoric comedy adventure that follows the world's first family as they embark on a journey of a lifetime when the cave that has always shielded them from danger is destroyed. Traveling across a spectacular landscape, the Croods discover an incredible new world filled with fantastic creatures -- and their outlook is changed forever.",16.160822,2985,"2013-03-20","Released"
"229",200000000,491868548,"Oz: The Great and Powerful","Oscar Diggs, a small-time circus illusionist and con-artist, is whisked from Kansas to the Land of Oz where the inhabitants assume he's the great wizard of prophecy, there to save Oz from the clutches of evil.",11.513209,4076,"2013-03-07","Released"
"230",0,0,"Anina","Anina Yatay Salas is a ten-year-old whose name spells trouble: those three palindromes in a row are an ongoing source of teasing at school. When a playground fight results in mysterious punishment, Anina will learn to put her problems in perspective and empathize with others in this sweet little daydream of a tale.",1.431597,22,"2015-04-02","Released"
"231",0,0,"Ruby Red","Gwendolyn Shepherd is a normal 16-year-old, but her family holds a secret: A time-travel gene is expressed in the clan inherited, but not every member of the family is blessed with. Everyone is certain that Gwen's cousin Charlotte has the gene.  However, someday Gwendolyn suddenly finds herself in London at the end of the 19th century and realizes that it her, who was born a time traveler. While she is not very enthusiastic about it she will do everything possible to solve the ancient mysteries of the red ruby.",10.460797,464,"2013-03-14","Released"
"232",0,0,"Dinola","In the harsh mountainous countryside of Svaneti (Georgia) . Happiness is brief and the love of life of the Dina dies. Tradition says she must marry to the first man who offers his hand and leave her child..",0.009977,0,"2013-02-02","Released"
