"","budget","revenue","title","overview","popularity","vote_count","release_date","status"
"1",0,0,"This World Won't Break","A personal look into the life of a struggling musician, Wes Milligan. In a world of overnight successes, Wes begins to feel left behind and realizes it's too late to stop following the dream and too early in his career to be a legend.",1.12112,0,"2019-01-25","Post Production"
"2",1800000,0,"The Singer - Olavi Virta","Olavi Virta is a film about the all-time favourite singer in Finland. A man whose dreams were interrupted by war, a man who rose from poverty all the way to the top and became an artist that was dearly loved by the Finnish people. A man who performed both on stage and in films and who finally lost everything but his unique voice.",0.438706,0,"2018-10-05","In Production"
"3",300,0,"Conference Call","Jack and Judy are two students at the University Of Toronto. Jack is a filmmaker in his masters, with great potential but poor execution skills, while Judy is an overachieving but highly insecure literature student, in her last year of a PhD. They are brought together by a conference, which Judy is presenting at, and Jack is filming. We follow the ups and downs of their ensuing relationship, as they both learn more about each other and themselves through the process.",1.826242,0,"2018-06-08","In Production"
"4",0,0,"Whitney","Filmmaker Kevin Macdonald examines the life and career of singer Whitney Houston. Features never-before-seen archival footage, exclusive recordings, rare performances and interviews with the people who knew her best.",2.68836,0,"2018-07-06","Released"
"5",0,0,"Summer","Leningrad, one summer in the early eighties. Smuggling LP’s by Lou Reed and David Bowie, the underground rock scene is boiling ahead of the Perestroika. Mike and his beautiful wife Natasha meet with young Viktor Tsoï. Together with friends, they will change the destiny of rock’n’roll in the Soviet Union.",0.430847,2,"2018-06-07","Released"
"6",0,0,"Fiction and Other Realities","Fiction & Other Realities tells the story of Bobby, a Korean-American singer-songwriter who tries to find himself in a country his parents originally immigrated from. Featuring the music of singer-songwriter Big Phony, this music centered film takes us on a search for love and self-identity.",1.249236,1,"2018-05-05","Post Production"
"7",0,0,"Dirty Computer","The story of a young woman named Jane 57821, who is living in a totalitarian near-future society where citizens are referred to as 'computers.' 'Dirty Computer' explores humanity and what truly happens to life, liberty and the pursuit of happiness when mind and machines merge, and when the government chooses fear over freedom.",2.003656,5,"2018-04-23","Released"
"8",0,0,"Slave To The Grind","Grindcore is the worlds fastest most aggressively intense music. Fusing the anarchistic and leftist attitudes of the UK Punk scene with the speed and drunken aggression of American Death Metal, Grindcore continues to challenge and offend most listeners.",0.65499,0,"2018-04-21","Post Production"
"9",0,0,"Trawun=ReUnión","A musical journey through the poetry of the Mapuche poet Elicura Chihuailaf, in a project that proposes a Trawvn, a meeting between the Kalfu group and the compositive collaboration of renowned musicians, such as Francisca Valenzuela, Nano Stern, Joe Vasconcellos, Manuel García, Juanito Ayala , Tata Barahona and Pancho Sazo",0.581409,0,"2018-04-17","Released"
"10",0,0,"Lessons of War","Meeting with numerous musicians affected by war, Northern Irish singer-songwriter Matt McGinn explores how they use music, not only to address their past, but to shape their future.",0.587897,0,"2018-04-15","Released"
"11",0,0,"Baba Yega: The Movie","",0.94594,1,"2018-03-28","Planned"
"12",0,0,"The Royal Opera House: Verdi's Macbeth","Verdi’s life-long love affair with Shakespeare’s works began with Macbeth, a play he considered to be ‘one of the greatest creations of man’. With his librettist, Francesco Maria Piave, Verdi set out to create ‘something out of the ordinary’. Their success is borne out in every bar of a score that sees Verdi at his most theatrical: it bristles with demonic energy.",4.868,1,"2018-05-16","Released"
"13",2500,0,"How the Moon Fell from the Sky and No One Even Noticed","When best friends Benji (Peter Carroll) and Ruben (Nick Trivisonno) decide to make a film about the man on the moon, they don’t realize they’re signing up for the end of the world as they know it. But when a love triangle develops on set and the lines between reality and fantasy start to blur, the boys must reckon with their developing feelings for each other or face an uncertain future.  Produced by and starring high school students from Interlochen Arts Academy in Interlochen, Michigan, HOW THE MOON FELL FROM THE SKY AND NO ONE EVEN NOTICED is a testament to the power of young artists who work together to achieve what no one thought possible.",0.996379,0,"2018-03-24","Released"
"14",0,0,"What We Started","Bert Marcus and Cyrus Saidi present an informed and absorbing exploration of the history of EDM, boosted by an energetic soundtrack and anchored by the personal stories of legendary DJ Carl Cox and superstar newcomer Martin Garrix. Insights from numerous other DJs and musical talents like Moby, David Guetta, Paul Oakenfold and Usher help tell the often oppositional tales of old school vs. new school and mainstream vs. underground.",1.015685,0,"2018-03-23","Released"
"15",0,0,"Paradox","A loud Poem. A whimsical western tale of music and love.",1.459627,4,"2018-03-15","Released"
"16",0,0,"Season of the Devil","In the late 70s, a gang of militias under the control of the military, terrorizes a remote village in the Philippines. The poet/teacher/activist, Hugo Haniway, decides to find out the truth about the disappearance of his wife. A love story set in the darkest period of Philippine history, the Marcos Dictatorship. Based on real events and real characters.",0.690094,2,"2018-03-15","Released"
"17",0,0,"Shut Up and Play the Piano","The documentary follows Chilly Gonzales from his native Canada to late '90s underground Berlin, and via Paris to the world's great philharmonic halls. Diving deep into the dichotomy of Gonzales' stage persona, where self-doubt and megalomania are just two sides of the same coin.",0.324573,1,"2018-09-12","Released"
"18",0,0,"America's Musical Journey","",2.8,0,"2018-05-17","Released"
"19",4100,0,"Pink Feathers","Richard Rhodes, AKA Cookie MonStar, has been in the drag industry for 21 years. This Documentary follows the highs and lows of his successes and failures. It focuses on following your dreams, what it is to be a man and the pressures of life within the industry. This is an insight into the entertainment industry; shows you the underground and commercial drag scenes; asks you what it is to dream and inspires you to question yourself and your beliefs.",0.225638,1,"2018-02-02","Released"
"20",0,0,"Stammering Ballad","A young Chinese folk singer left his hometown to the big city, only to return to his musical traditions. On this journey, his humor, anger and powerful folk songs all comes from the rural life of past. That's the real taste of soil and dust.",0.274617,0,"2018-01-29","Released"
"21",0,0,"Ryuichi Sakamoto: Async at the Park Avenue Armory","In April 2017 Japanese composer, pianist and music producer Ryuichi Sakamoto made a guest appearance for two evenings in the Veteran’s Room, an intimate, 200-seater hall at the Park Avenue Armory in New York. Stephen Nomura Schible recorded this concert with his camera.",0.178834,0,"2018-01-27","Released"
"22",0,0,"Gorgorod","A short film based on the music album of Myron Fyodorov (Oxxxymiron). The plot is based on the story of a young and popular writer named Mark.",0.131221,0,"2017-11-21","Released"
"23",10,0,"Caracas Vice Vol. 2","Ryan the DEA will face again the most dangerous drug lord of Venezuela, this time with new friends, in 1983.",0.411183,1,"2017-11-18","Released"
"24",0,0,"Tim & Faith: Soul2Soul","Includes live performances from Tim McGraw and Faith Hill's 2017 Soul2Soul world tour, as well as an intimate look inside their relationship. Never before seen interviews are presented along side behind-the-scenes footage, capturing their chemistry on and off the stage. Directed and executive produced by the award-winning team of Dan Cutforth and Jane Lipsitz.",0.166743,0,"2017-11-17","Released"
"25",0,0,"Betty - They Say I'm Different","An aspiring songwriter from a small steel town, Betty Mabry Davis arrived on the scene to break boundaries for women with her daring personality, iconic fashion style and outrageous funk. She befriended Jimi Hendrix and Sly Stone, wrote songs for the Chambers Brothers and The Commodores and married Miles Davis - turning him from jazz to funk and then went on to ignite stages in the 70s with her sassy sexed up mix of hard rock and bluesy funk, inspiring artists from prince to Erykah Badu to Karen 0 and Peaches. Then she vanished...",0.295182,1,"2017-11-16","Released"
"26",0,0,"Sam Smith at the BBC","Sam Smith performs tracks from his latest album alongside some of his biggest hits, including Stay With Me and the Oscar-winning Writing's on the Wall, accompanied by his band and the BBC Concert Orchestra.",0.326109,0,"2017-11-09","Released"
"27",0,0,"Dreaming of a Jewish Christmas","An offbeat, irreverent musical documentary that tells the story of a group of Jewish songwriters, including Irving Berlin, Mel Tormé, Jay Livingston, Ray Evans, Gloria Shayne Baker and Johnny Marks, who wrote the soundtrack to Christianity’s most musical holiday. It’s an amazing tale of immigrant outsiders who became irreplaceable players in pop culture’s mainstream – a generation of songwriters who found in Christmas the perfect holiday in which to imagine a better world, and for at least one day a year, make us believe.",2.697932,0,"2017-11-05","Released"
"28",0,0,"Sitting","A down-and-out young woman takes a job delivering an unusual drug to high profile clients, sitting with them while they have life-altering experiences.",0.728062,0,"2017-11-01","Released"
"29",0,0,"Wildes Herz","",0.837372,1,"2018-04-12","Released"
"30",0,0,"Dance Fight Love Die: With Mikis On the Road","An intimate look into the life of composer Mikis Theodorakis from 1987 until 2017: comprising three decades, four continents, 100 locations and 600 hours of film material. The film interweaves personal moments with archive footage, documentary recordings and fictional pieces, all accompanied by Theodorakis’ music in jazz, classic, electro and rap versions.",2.608799,0,"2017-10-25","Released"
"31",0,0,"All In For The Gambler: Kenny Rogers Farewell Concert Celebration","This one-night-only concert event taping brings together fans, friends and music icons to celebrate Kenny Rogers’ final farewell to Nashville. Featuring performances by Dolly Parton, Alison Krauss, Chris Stapleton, Elle King, Idina Menzel, Jamey Johnson, Lady Antebellum, Lionel Richie, Little Big Town, Reba McEntire, The Flaming Lips, The Judds, Wynonna and Kenny Rogers along with many other special guests.",0.202429,0,"2017-10-25","Released"
"32",0,0,"Quinn Thomas","QT aka Quinn Thomas is an international pop star and CEO of ""Super Natural"" energy drink ‘Drink QT’. We Join QT as she journeys to South Korea to explore new ways in which we communicate through tastes and flavours using her research to inform a multi-sensory debut performance in Seoul.",0.09757,0,"2017-10-23","Released"
"33",5000,10000,"A Very Trite Fable: The Legacy Of Dermis Tatu","Two decades ago, Venezuela's power trio Dermis Tatú released their only album, ""La violó, la mató y la picó"" (""Raped her, killed her and cut her""). The band was an offspring from the separation of Sentimiento Muerto, and was formed by Carlos ""Cayayo"" Troconis (voice and guitar), Héctor Castillo (bass) and Sebastián Araujo (drums). The record is still considered by many as the most influential in the Venezuelan rock scene.  Twenty years later, Castillo and Araujo remember the stories behind the recording, as a group of the current generation of Venezuelan rockers, not only explain its influence and impact, but also play all the songs from the album, making them their own.",0.209017,1,"2017-10-21","Released"
"34",0,0,"Olaf's Frozen Adventure","Olaf is on a mission to harness the best holiday traditions for Anna, Elsa, and Kristoff.",14.246485,592,"2017-10-27","Released"
"35",0,0,"Here to be Heard: The Story of the Slits","The hitherto overlooked story of one of British music’s most influential and game-changing bands.",0.893108,0,"2018-04-18","Released"
"36",0,0,"Trouble No More","This very special film consists of truly electrifying video footage from Bob Dylan’s “born again” period, shot on the last leg of his ’79-’80 tour, much of it thought to have been lost for years and all newly restored.",0.146595,0,"2017-10-02","Released"
"37",0,0,"The Porchlight Sessions","A rare look at the inventiveness of the human spirit through reimagining the history of Bluegrass Music from Bill Monroe to today's musicians.",0.282832,0,"2017-09-28","Released"
"38",0,60330833,"My Little Pony: The Movie","A new dark force threatens Ponyville, and the Mane 6 – Twilight Sparkle, Applejack, Rainbow Dash, Pinkie Pie, Fluttershy and Rarity – embark on an unforgettable journey beyond Equestria where they meet new friends and exciting challenges on a quest to use the magic of friendship and save their home.",12.701979,99,"2017-10-05","Released"
"39",0,0,"Stooge","Stooge is a feature documentary about Robert Pargiter, Iggy Pop's No1 fan. It covers the three years leading up to his 50th birthday when he tries to track his hero down in a final absolution. His journey has taken him all over the world in search of redemption after years of struggling with addiction, of coping with depression, and of celebrating the communal lust that is Rock'n Roll.",0.168049,1,"2017-09-22","Released"
"40",0,0,"Anna and the Apocalypse","When the zombie apocalypse hits the sleepy town of Little Haven - at Christmas - teenager Anna and her high school friends have to fight, sing and dance to survive, with the undead horde all around them. Teaming up with her best friend John, Anna has to fight her way through zombified snowmen, Santas, elves and Christmas shoppers to get across town to the high school, where they'll be safe. But they soon discover that being a teenager is just as difficult as staying alive, even at the end of the world.  A girl and her friends must fight - and sing - their way through a zombie invasion to reach the supposed safety of their school, not knowing if their parents and friends will still be alive when they get there.",2.129057,1,"2017-09-22","Released"
"41",0,0,"Justin Timberlake: Rock in Rio 2017","Justin Timberlake performs 20 of his biggest hits, including ""Can't Stop the Feeling!"", ""Mirrors"", ""SexyBack"", and more...",0.734874,0,"2017-09-17","Released"
"42",0,0,"Long Time Running","A documentary chronicling The Tragically Hip during the emotional lead up through to the epic last show of the iconic Canadian band's now legendary 2016 tour.",3.083032,3,"2017-09-14","Released"
"43",300000,0,"Saving Dreams","A naive girl with dreams of stardom, marries a powerful man, who abuses her while running a foundation that protects abused women.",0.350174,0,"2017-09-24","Released"
"44",0,0,"Gaga: Five Foot Two","Go behind the scenes with pop provocateur Lady Gaga as she releases a bold new album and prepares for her Super Bowl halftime show.",7.419031,208,"2017-09-08","Released"
"45",0,0,"Nico, 1988","The muse of Andy Warhol, Christa Päffgen, stage name Nico, singer with the band Velvet Underground and a woman of legendary beauty. She gained a new lease of life after the story everyone knows, when she launched her solo career.",3.687268,12,"2017-10-12","Released"
"46",0,0,"Gurrumul","Blind from birth, Dr G Yunupingu found his identity through song and the haunting voice that has already become legend. His debut album introduced Australia to the Songlines and culture of his Elcho Island community, but now Dr G Yunupingu finds himself increasingly torn between city and country, present and past, self and the community to which he owes so much.",0.886088,0,"2018-04-26","Released"
"47",0,0,"The Night I Dance With Death","Jack is having a party with some friends. Disused, he decides to take a psychedelic drug. With a lighter mind, he enjoys the moment, his belly rejecting his visceral anguish as the evening progress. Arrives the time when he confronts a too big anxiety of which he cannot get rid of.",0.100513,0,"2017-08-11","Released"
"48",0,0,"Miro Jaroš: DVD pre (ne)poslušné deti 2","",0.072211,0,"2017-08-11","Released"
"49",0,0,"No Roads In","An abandoned homestead, twelve songs and five days to cut an album. A journey into how the power of music transforms our life.",0.112694,1,"2017-08-08","Released"
"50",0,0,"Adults","Two independent adult actresses attempt to find meaning in their work and relationships; one with her best friend, the other with her worst enemy.",0.099275,0,"2017-08-05","Released"
"51",0,0,"Will Work for Views: The Lo-Fi Life of Weird Paul","A film exploring the life of “Weird Paul.” After 30 years, 2000 videos, 800 songs, & 42 albums, he’s still not giving up on his dream.",0.196388,0,"2017-08-01","Released"
"52",0,0,"The Evil","""So who never thought about the Evil / saw herself in criminal nature"" - the film portrays, through an analog cutout and collage stopmotion, the surreal in the loss of innocence and the seduction by the forbidden.",0.184495,0,"2017-07-20","Released"
"53",0,0,"Hello Again","Ten lost souls slip in and out of one another's arms in a daisy-chained musical exploration of love's bittersweet embrace. A film adaptation of Michael John LaChiusa's celebrated musical, originally based on Arthur Schnitzler's play, La Ronde.",3.287116,1,"2017-11-08","Released"
"54",0,0,"Access All Areas","Four runaway teenagers are catapulted on a wild and uplifting road trip out of the city and across the water to a magical island music festival.",5.048751,3,"2017-10-20","Released"
"55",0,0,"The Latin Dream","Fernando ( Fernando Sosa) is a famous dancer of Caribbean dances. With his partner Sharon ( Tatiana Bonaguro) they are considered unbeatable in the world of acrobatic salsa, technique and for their perfectionism.But Fernando feels like a slave of a style label,, which forces him to act like the perfect dancer. The encounter with Carolina ( Shearley Alicea) , a very ordinary girl who comes from the downtown, will be the event which Fernando encounters the passional and spontaneous side of dance. It won't be easy to defeat the unscrupulous champions, but wit the power of love everything is possible.",0.35421,3,"2017-06-29","Released"
"56",0,0,"Becks","After a crushing breakup with her girlfriend, a Brooklyn musician moves back in with her Midwestern mother. As she navigates her hometown, playing for tip money in an old friend's bar, an unexpected relationship begins to take shape.",2.485999,0,"2017-06-15","Post Production"
"57",0,0,"Radiohead - NorthSide 2017","Radiohead performs at Denmark's NorthSide Festival on June 11, 2017.",0.058936,0,"2017-06-11","Released"
"58",3000,0,"<U+041F><U+043E><U+0441><U+043B><U+0435><U+0434><U+043D><U+044F><U+044F> <U+043B><U+044E><U+0431><U+043E><U+0432><U+044C>","",0.107309,1,"2017-06-09","Released"
"59",0,0,"<U+0412><U+0440><U+0435><U+043C><U+044F>, <U+043D><U+0430><U+0437><U+0430><U+0434>!","",0.115345,0,"2017-06-09","Released"
"60",15000,0,"Life According to Moskri","The late controversial hip-hopper, the founder of Prti Bee Gee rap group, Davor Bobic Moskri, suddenly returns to the world of the living. He's allowed to return as a 10 year old child, with a goal to win a ticket to paradise, by showing his followers from underground where the motto Hit the pot, win a jackpot leads.",0.212904,1,"2017-06-03","Released"
"61",0,0,"La Bouche","A man learns his daughter has been brutally murdered by her husband. Time stands still as he oscillates between the need for solace and his urge for revenge. A musical featuring Guinean percussion master, Mohamed Bangoura, “Red Devil”, loosely based on his own story.",2.641025,0,"2018-03-15","Released"
"62",0,0,"The Nothing Factory","One night, a group of workers realises that the administration is stealing machines and raw materials from their own factory. As they organize to survey the equipment and block the relocation of production, they are forced to stand at their posts with no work to do, as a form of retaliation, while negotiations over general lay-offs take place. The pressure leads to a breakdown of the workers along with the world around them.",2.963643,0,"2017-09-21","Released"
"63",0,0,"Kiss and Cry","Fifteen-year-old Sarah has returned to Colmar, where she has taken up high-performance figure skating and competition. The rivalry between the girls and the trainer's harsh words put her body to the test on the ice, while her adolescent desires distract her from her athletic ambitions.",0.970066,8,"2017-09-20","Released"
"64",0,0,"How to Talk to Girls at Parties","A couple of British 1970s teen-aged boys, Enn and Vic, go to a party to meet girls, only to find that the girls are very different from the boys' expectations.",5.772561,22,"2018-05-05","Released"
"65",0,0,"Barbara","A director wants to make a biopic about the female singer Barbara.",4.110576,36,"2017-09-06","Released"
"66",0,0,"Jeannette: The Childhood of Joan of Arc","France, 1425. In the midst of the Hundred Years’ War, the young Jeannette, at the still tender age of 8, looks after her sheep in the small village of Domremy. One day, she tells her friend Hauviette how she cannot bear to see the suffering caused by the English. Madame Gervaise, a nun, tries to reason with the young girl, but Jeannette is ready to take up arms for the salvation of souls and the liberation of the Kingdom of France. Carried by her faith, she will become Joan of Arc.",2.647853,5,"2018-03-15","Released"
"67",0,0,"So It Goes","Amidst many distractions, Samantha struggles to find her voice recording a new song. She encounters a mysterious stranger who reminds her of why she loves to create music.",0.584447,2,"2017-04-30","Released"
"68",0,0,"Whitney: Can I Be Me","The life and tragic death of Whitney Houston.",7.485445,81,"2017-04-24","Released"
"69",0,0,"Saturday Church","A 14 year old boy, struggling with gender identity and religion, begins to use fantasy to escape his life in the inner city and find his passion in the process.",3.067097,1,"2017-04-23","Released"
"70",0,0,"Taranta On the Road","",0.22165,3,"2017-08-24","Released"
"71",0,0,"Stuck","A musical about six strangers who find themselves stuck on the New York City subway.",2.109817,0,"2017-04-23","Released"
"72",0,0,"Totally Crazy","With “Totally Crazy”, the glamor, daring, and impertinence that are the very DNA of Crazy Horse Paris are showcased into a different, more immersive format. The driving desire of this show it to invite the audience to experience fabulous moments of complicity and sharing around iconic acts that have contributed to the Crazy Horse Paris legend.",0.083706,1,"2017-04-06","Released"
"73",0,0,"Shogun","BBC Threes shines a light on Joe Heron, aka Shogun, a nineteen year-old MC from Paisley, Scotland. With no connections - but plenty of talent - Shogun has racked up 1.75 million YouTube hits for his brand new track and supported acts such as Bugzy Malone and Pharaoh Monch.",0.090769,0,"2017-10-10","Released"
"74",0,725286,"May It Last: A Portrait of the Avett Brothers","An intimate portrait of the acclaimed North Carolina band The Avett Brothers, charting their decade-and-a- half rise, while chronicling their present-day collaboration with famed producer Rick Rubin on the multi-Grammy-nominated album “True Sadness.”",2.525091,4,"2017-09-12","Released"
"75",0,0,"Residente","After taking a DNA test, Latin America's most decorated artist – René Pérez (AKA Residente) – embarks on a global adventure to trace the footsteps of his ancestors and record his latest album.",0.848346,7,"2017-03-11","Released"
"76",0,0,"La Barracuda","Sinaloa hitchhikes into Texas to meet Merle, her half-sister by way of their dead country musician father. As the two get to know each other, Sinaloa's chaotic influence starts to unravel Merle's quiet, comfortable life. While the family music legacy brought Sinaloa to Austin, she won't leave without taking revenge against the people who stole her daddy away years ago.",2.856795,3,"2017-06-10","Released"
"77",0,0,"Lost Vegas Hiway","This is the story of touring musician, Jeff Mix, who finds himself at the Gateway Motel, in the  same city he got hitched in. That evening a gun shot rings out. Someone will lose their  life. With so many shady people, the shot could be meant for any one of them. The prostitute,  the motel manager, the mob guy, the con­man, the mysterious man in search of a woman  and her daughter.",2.393066,0,"2017-03-11","Released"
"78",10000000,443684,"Song to Song","In this modern love story set against the Austin, Texas music scene, two entangled couples — struggling songwriters Faye and BV, and music mogul Cook and the waitress whom he ensnares — chase success through a rock ‘n’ roll landscape of seduction and betrayal.",11.861161,326,"2017-03-17","Released"
"79",0,0,"Nechte zpívat Mišíka","",0.046204,0,"2017-03-08","Released"
