"","budget","revenue","title","overview","popularity","vote_count","release_date","status"
"80",0,0,"Lost in the Shuffle","The story of Sonny, a hopeful young performer with a sparkle in his eye and dreams of the spotlight. By some stroke of terrible fortune, Sonny arrives at the theater to find he's lost his ability to tap.",0.4032,0,"2017-03-05","Released"
"81",0,0,"Bodo","",1.89188,0,"2017-03-03","Released"
"82",0,0,"Something Like Summer","Something Like Summer traces the tumultuous relationship of Ben and Tim, secret high school sweethearts who grow over the years into both adulthood enemies and complicated friends.",3.320383,11,"2017-02-25","Released"
"83",0,0,"DAM! The Story of Kit the Beaver","DAM! The Story of Kit the Beaver is an animated film that’s not about your average beaver. It’s the tale of Kit, a very independent (and easily distracted) young beaver who loves to explore the sounds of the forest she lives in. Animated short with original orchestral score performed by The Toronto Symphony Orchestra.",0.044715,0,"2017-02-25","Released"
"84",0,0,"Robin Schulz - The Movie","",1.803805,0,"2017-02-24","Released"
"85",0,0,"Revolution of Sound - Tangerine Dream","‘Tangerine Dream is science fiction!’ declares band leader Edgar Froese who died in January, 2015 aged 70. For almost fifty years he and his band ‘Tangerine Dream’ explored sound and its effect on our emotions. This film about one of Germany’s first electronic bands kicks off with the young Berlin musicians who were as inspired by the space age of the 1960s, with its rocket launchings and visions of the future, as they were by their own heartbeat, on which Froese also based compositions. Aided by the Moog and other synthesisers Froese (and various band members) revolutionised popular music. His explorations took him into the worlds of classical, new and film music. He preferred to visualise moods rather than create clearly structured songs.  A blend of amateur footage, interviews with band members, relatives, friends and colleagues such as Jean-Michel Jarre that creates a comprehensive portrait of an artistic pioneer.",0.062735,0,"2017-02-14","Released"
"86",0,0,"Félicité","Félicité, a strong and proud woman, sings in bars in Kinshasa. She drifts away from reality when her 14-year-old son gets into an accident. In electric Kinshasa, she wanders in a world of music & dreams... until love unexpectedly brings her back to life.",2.671569,9,"2017-03-29","Released"
"87",0,11722,"Django","The story of Django Reinhardt, famous guitarist and composer, and his flight from German-occupied Paris in 1943.",4.423795,51,"2017-04-26","Released"
"88",0,0,"2+2=22 [The Alphabet]","Worn-down pavements, broken paving stones. Trees that jut out of the concrete, casting shadows on to crumbling façades. The centre of Tbilisi in the summer of 2013. Glimpses of side and main streets, over railings and under balconies, of an architectural cacophony. The voiceover spoken by Natja Brunckhorst reflects on the nature of streets and public spaces.",0.051667,0,"2017-02-09","Released"
"89",0,0,"You Are Teddybears","A humorous, vibrant music documentary introducing us to the faces behind the masks of the eccentric Swedish band Teddybears.",0.059294,0,"2017-01-30","Released"
"90",0,0,"The Invisible Hands","Maverick underground American/Lebanese musician and ethnomusicologist Alan Bishop (Sun City Girls and Sublime Frequencies), lands as a stranger in Cairo, soon after the 2011 uprisings, and teams up with three young Egyptian musicians for the translation of his old songs into Arabic. Under Bishop’s mentorship, this unlikely collaboration transforms into a band, The Invisible Hands.",0.043713,0,"2017-01-26","Released"
"91",10000000,248370,"Band Aid","A couple who can't stop fighting embark on a last-ditch effort to save their marriage: turning their fights into songs and starting a band.",7.851579,63,"2017-06-02","Released"
"92",0,0,"Long Strange Trip","The tale of the Grateful Dead is inspiring, complicated, and downright messy. A tribe of contrarians, they made art out of open-ended chaos and inadvertently achieved success on their own terms. Never-before-seen footage and interviews offer this unprecedented and unvarnished look at the life of the Dead.",2.427732,2,"2017-01-23","Released"
"93",0,0,"Rumble: The Indians Who Rocked the World","Documentary about the role of Native Americans in popular music history, a little-known story built around the incredible lives and careers of the some of the greatest music legends.",2.726502,1,"2017-09-22","Planned"
"94",0,0,"Give Me Future: Major Lazer in Cuba","In the spring of 2016, global music sensation Major Lazer performed a free concert in Havana, Cuba—an unprecedented show that drew an audience of almost half a million. This concert documentary evolves into an exploration of youth culture in a country on the precipice of change.",1.940513,1,"2017-01-21","Post Production"
"95",0,0,"Tokyo Idols","This exploration of Japan’s fascination with girl bands and their music follows an aspiring pop singer and her fans, delving into the cultural obsession with young female sexuality and the growing disconnect between men and women in hypermodern societies.",2.859148,11,"2017-01-20","Released"
"96",0,0,"Violeta más viva que nunca","",0.056,0,"2017-01-06","Released"
"97",0,0,"Writer's Block","Past her prime and afflicted with a severe case of writer's block, a veteran songwriter finds new inspiration in a bird that takes up residence outside her home.",0.038904,0,"2016-12-31","Released"
"98",0,0,"Sulukule Mon Amour","In Istanbul’s Sulukule district, two young women use dance to express their freedom.",0.090769,0,"2017-10-10","Released"
"99",0,0,"Dear Evan Hansen","All his life, Evan Hansen has felt invisible. But when a tragic event shocks the community and thrusts him into the center of a rapidly evolving controversy, Evan is given the opportunity of a lifetime: the chance to be somebody else.",0.117494,1,"2016-12-04","Released"
"100",0,0,"Eput the Movie","The story behind Finland's rock giants and their songs, and their love for performing, even from childhood, and also the story of two very different brothers trying to fit in the same band.",0.395989,1,"2016-12-02","Released"
"101",0,0,"IMT Smile a Lúcnica - Made in Slovakia","",0.074885,1,"2016-11-10","Released"
"102",0,0,"Nessuno ci può giudicare","",0.35799,0,"2017-06-05","Released"
"103",0,0,"Document: A Film About Malojian","Featuring legendary recording engineer Steve Albini, 'Document: A film about Malojian' captures the energy of a band at the top of their game, as they rush to complete their third album, ""This is Nowhere"", in just four days.",0.123494,1,"2016-10-15","Released"
"104",0,0,"Hollywood in Vienna 2016 - The Sound Of Space","Hollywood in Vienna« invited to an unforgettable musical journey to the fantastic vastness of space and time and honored the versatile Hollywood composer Alexandre Desplat.  The music of 2001: A SPACE ODYSSEY lead us to outer space and made us experience its infinite dimension. INTERSTELLAR, between the stars, we entered the infamous, global STAR WARS and were rescued by STAR TREK's spaceship »Enterprise«, leading us to faraway musical galaxies, where no man has gone, before. We got in CONTACT with extraterrestrials, GRAVITY pulled us back to earth and, finally, we fulfilled E.T.'s wish, to phone home.  Within the second part of the concert, we honored  the Oscar-, Golden Globe and Grammy winner Alexandre Desplat. His atmospheric melodies for HARRY POTTER, TWILIGHT, THE KING’S SPEECH, THE IMITATION GAME And THE GRAND BUDAPEST HOTEL amongst others let us virtually float through the universe.",0.048804,0,"2016-10-14","Released"
"105",0,0,"On the Road","North London band Wolf Alice have had a rise to prominence that might have been bends-inducing were it not for their tightness as a group. In summer of 2015, the deliciously dark, hook-and-riff-filled sound of their debut album, My Love Is Cool, inspired the NME to crown it: ""the debut of the decade"". As a measure of their impact, BAFTA-winning filmmaker Michael Winterbottom joined the band on the road, capturing 16 different gigs and daily life backstage.",0.078906,1,"2016-10-09","Released"
"106",0,0,"Score: A Film Music Documentary","Music is an integral part of most films, adding emotion and nuance while often remaining invisible to audiences. Matt Schrader shines a spotlight on the overlooked craft of film composing, gathering many of the art form’s most influential practitioners, from Hans Zimmer and Danny Elfman to Quincy Jones and Randy Newman, to uncover their creative process. Tracing key developments in the evolution of music in film, and exploring some of cinema’s most iconic soundtracks, 'Score' is an aural valentine for film lovers.",4.575193,28,"2017-03-16","Released"
"107",125000000,346864462,"Trolls","Lovable and friendly, the trolls love to play around. But one day, a mysterious giant shows up to end the party. Poppy, the optimistic leader of the Trolls, and her polar opposite, Branch, must embark on an adventure that takes them far beyond the only world they’ve ever known.",19.172778,1377,"2016-10-13","Released"
"108",0,0,"Country Crush","A city girl falls for a country boy who follows her to New York, but their romance may be over when she must choose between love and a music career.",0.784684,3,"2017-01-01","Released"
"109",450000,0,"Waterboys","WATERBOYS tells the funny and moving story of crime novelist Victor and his cello-playing son Zack. When they get thrown out by their women on the same day, the two men have to sort out themselves and their relationship during a turbulent trip to Scotland where Victor's latest book has to be promoted. A film about a father who needs to grow up and his son who should take life less seriously.",0.241519,5,"2016-10-02","Post Production"
"110",3000000,0,"Joseph DiDonato: Unstoppable Tour","Follow Joseph DiDonato on His First world tour.",0.067089,0,"2016-10-14","Post Production"
"111",0,0,"Leehom Wang's Open Fire Concert Film","Chinese-American pop sensation Leehom Wang performs two sold-out shows at Beijing's Bird's Nest stadium, in this electrifying concert documentary experience.",0.067155,1,"2016-09-15","Released"
"112",0,0,"Justin Timberlake + The Tennessee Kids","For Justin Timberlake it's the final two dates of his 20/20 Experience World Tour at the MGM Grand Garden Arena in Las Vegas. Surrounded by the 25 band members of The Tennessee Kids and featuring show-stopping performances from one of the highest-grossing tours of the decade, the film is a culmination of the singer’s 134 shows and 2 years on the road.",1.248553,18,"2016-09-13","Released"
"113",75000000,632443719,"Sing","A koala named Buster recruits his best friend to help him drum up business for his theater by hosting a singing competition.",17.377995,3099,"2016-11-23","Released"
"114",0,393970,"Chasing Trane","The film explores the global power and impact of the music of John Coltrane and reveals the passions, experiences and forces that shaped his life and revolutionary sounds.",0.562395,11,"2017-04-14","Released"
"115",1200000,0,"Born in Heinola","A story of five Finnish youth growing up during the devastating 90's recession. They live in the small, timber industrial town of Heinola. As the parents of these young teens struggle through hard economic times, the five very different youth meet by coincidence to form the punk band Apulanta (fertilizer). Nowadays Apulanta is one of the most famous bands in Finland.",1.008357,7,"2016-09-07","Released"
"116",0,0,"Gilda, No Me Arrepiento de Este Amor","The life and death of the tropical singer Gilda.",0.214564,4,"2016-09-15","Released"
"117",0,0,"Yesterday Was Everything","A band struggles to reconcile for a reunion tour a decade after a contentious break-up and a fatal accident.",0.047699,0,"2016-08-31","Released"
"118",0,0,"Conduct! Every Move Counts","'At the end of the day, it remains a secret why some can conduct and others can’t', Sir Georg Solti once said. CONDUCT! explores this secret. The struggle of five young artists for success at the International Conductors Competition in Frankfurt provides real-life drama that tests not only musical abilities but, above all, characters. CONDUCT! explores the secret of conducting with a unique intensity that culminates in a great showdown at Frankfurt’s Opera.",0.065501,0,"2016-08-28","Released"
"119",0,0,"Vladivostok Vacation","Once upon a time in Russia, communism fell and Rock 'n' Roll rose to power. One band reigned supreme and toured far and wide across the eastern earth, but never even left Russia - until now. They only have once chance, to not only rule Russia -but to become the best band in the West. The strategy is simple - get on the boat, create an album - and make new friends. All with hopes of finally becoming a household name in the United States. But sometimes fame is harder than just toppling a government.",0.369291,0,"2018-02-16","Released"
"120",0,0,"EMO the Musical","Ethan, a sullen high-school student whose life is defined by what he hates, finds love with a blindly optimistic Christian girl Trinity, much to the annoyance of his angst-filled band mates and her evangelistic brethren.",2.086508,15,"2017-05-04","Released"
"121",0,0,"Cilaos","To keep the promise she made to her dying mother, a young woman sets off to find  her father, a fickle man she has never known.  On the way, she discovers he is in fact dead, but, driven by the bewitching  rhythms of the Maloya, a Reunion Island ritual singing and musical tradition,  she does not abandon her goal: she must find her father.",0.100313,2,"2016-08-06","Released"
"122",0,0,"Death Metal","A metalhead gets passed down a satanic guitar that riffs to shreds.",0.28173,3,"2016-07-22","Released"
"123",0,0,"We Together","""A zombie is awakened.""  Short film by Henry Kaplan featuring music by Kerron Hurd.",0.041318,0,"2017-01-21","Released"
"124",0,0,"Poi E: The Story of Our Song","Written and directed by Tearepa Kahi (Mt Zion) and starring Maaka Pohatu (The Modern Maori Quartet, Two Little Boys) the film tells the story of musician Dalvanius Prime and the origin of the song “Poi E”, a ground-breaking fusion of 1980s pop and traditional Maori music. “Poi E”, composed by Dalvanius and Ngoingoi Pewhairangi and performed by the Patea Maori Club, remains the only song in Te Reo Maori to reach No 1 in the charts, over 30 years since its 1984 release.",0.09283,1,"2016-08-04","Released"
"125",0,0,"Manifest Destiny: The Lewis & Clark Musical Adventure","This musical comedy weaves together sharp satire and heartfelt storytelling into a grand adventure. Through ten original songs, the film follows gruff explorer William Clark and his naturalist companion Meriwether Lewis as they blaze a trail to the Western waters. Along the way, they encounter the wise Sacagawea, battle the elements, and find that President Thomas Jefferson has some surprises up his sleeve.",0.199258,0,"2016-07-13","Released"
"126",30,0,"So What If I Couldn't Take It","Four short, loosely connected stories of attempted suicide each with a very distinct visual style, based on the Jeffrey Lewis song of the same name. https://www.youtube.com/watch?v=E27_J-r4YWE",0.047765,0,"2016-10-22","Released"
"127",0,0,"VULKAN","",0.094623,1,"2016-07-08","Released"
"128",0,0,"Center Stage: On Pointe","In Center Stage: On Pointe, Jonathan Reeves (Gallagher) is tasked with infusing more contemporary styles and modernism into the American Ballet Academy, and enlists his his top choreographers Charlie (Radetsky), Cooper (Stiefel) and Tommy (Wormald) to recruit dancers to compete at a camp where the winners will be selected to join the Academy. Bella Parker (Muñoz), who has always lived in the shadow of her hugely successful sister Kate, finally gets her chance to step into the limelight as one of the dancers recruited for the camp. Chloe Lukasiak plays Gwen, a talented dance prodigy who competes at the camp.  - Denise Petski",1.651311,25,"2016-06-25","Released"
"129",0,0,"A Divorce Before Marriage","In 2007, five-piece rock and roll band I Like Trains were the toast of the music industry. They were signed to a major label and playing sold out tours around the world. A Divorce Before Marriage picks up the story five years later where, due to the decline of the music industry and a change in their fortune, the band are now in a very different position. Suddenly I Like Trains find themselves lost in a very different musical landscape as jobs, family and life start to take over, forcing them to question their childhood dreams and ambitions. Told over a period of 4 years, this is a coming of age story about a band stuck in the middle.",0.094702,1,"2016-06-25","Released"
"130",0,0,"Drum Corps International 2016 Tour Premeire","Live from Lucas Oil Stadium in Indianapolis, six corps perform to get the 2016 season under way. The Bluecoats, Boston Crusaders, Carolina Crown, Phantom Regiment, Cadets, and Cavaliers all show up to march in the sixth annual DCI Tour Premiere, broadcast in select cinemas nationwide on Thursday, June 23.",0.028728,0,"2016-06-23","Released"
"131",0,0,"Satie's ""Parade""","A Parade for three managers and four performers. Sketchy drawings in a neatly arranged palette, involving quotes from the French composer Erik Satie, set to the music of Parade performed by the Dutch Willem Breuker Kollektief",0.167937,1,"2016-06-13","Released"
"132",0,0,"Caminho dos gigantes","",0.06238,1,"2016-06-13","Released"
"133",0,0,"Opening Night","A failed Broadway singer who now works as a production manager must save opening night on his new production by wrangling his eccentric cast and crew.",2.457956,30,"2016-06-03","Released"
"134",0,0,"Inner Rap","Makulatura [which means both scrap paper and pulp fiction in Russian] is a duo of poets Evgeniy Alyokhin and Konstantin Speransky, who have been performing together since 2003. Blending classic literature references, mind-bending introspection, musings on modern love and an ironic attitude to their act, they create what faithful fans and listeners call “existential rap.”  The film follows Makulatura on tour through several Russian cities.",0.12031,0,"2016-06-03","Released"
"135",0,0,"London Town","A 14-year old boy’s life changes forever when his estranged mother introduces him to the music of The Clash in 1979 London.",1.435563,22,"2017-08-03","Released"
"136",0,0,"The Witcher 3: Wild Hunt concert","Experience the award winning music of The Witcher 3: Wild Hunt and both its expansions, Hearts of Stone & Blood Wine, in a never before seen way, performed live during Film Music Festival 2016 in Kraków, Poland.  Video Game Show — The Witcher 3: Wild Hunt concert was organized by CD PROJEKT RED in cooperation with Kraków Festival Office.",0.172455,1,"2016-05-30","Released"
"137",0,9496130,"Popstar: Never Stop Never Stopping","When his new album fails to sell records, pop/rap superstar Conner4real goes into a major tailspin and watches his celebrity high life begin to collapse. He'll try anything to bounce back, anything except reuniting with his old rap group The Style Boyz.",7.213862,478,"2016-06-03","Released"
"138",0,0,"Gimme Danger","No other band in rock'n'roll history has rivaled The Stooges' combination of heavy primal throb, spiked psychedelia, blues-a-billy grind, complete with succinct angst-ridden lyrics, and a snarling, preening leopard of a frontman who somehow embodies Nijinsky, Bruce Lee, Harpo Marx, and Arthur Rimbaud all rolled into one. There is no precedent for The Stooges, while those inspired by them are now legion.  The film will present the context of their emergence musically, culturally, politically, historically, and relate their adventures and misadventures while charting their inspirations and the reasons behind their initial commercial challenges, as well as their long-lasting legacy.",5.419648,38,"2016-10-28","Released"
"139",0,0,"Gutterdämmerung","The ""Devil's Evil Guitar"" has been removed from the world by the supreme being, and rock and roll is a thing of the past in this newly puritanical environment. But what happens when the guitar is sent back by Vicious, an angel punk?",0.698174,1,"2016-05-06","In Production"
"140",0,0,"Tini: The New Life of Violetta","Shot in Spanish and localized for markets around the world, “Tini – El Gran Cambio de Violetta” is set to thrill fans with everything they loved about the worldwide Violetta phenomenon including strong musical elements with new and original tracks, exciting choreography, compelling storylines, and intriguing characters. All made bigger and better for the big screen.  The film shows how taking the role in the TV series was a pivotal moment for Tini leading to a personal ‘coming of age story’ about the young actress. In a story that reflects the teen star’s own real life, Tini will leave behind the world depicted in Violetta, striking out alone and embarking on a brand new adventure over one endless summer that will define her as a person and see her emerge as a new artist.",6.835224,140,"2016-05-04","Released"
"141",0,0,"Lemonade","The second ""visual album"" (a collection of short films) by Beyoncé, this time around she takes a piercing look at racial issues and feminist concepts through a sexualized, satirical, and solemn tone.",3.321975,60,"2016-04-23","Released"
"142",0,0,"Bad Rap","The lives and careers of four Asian-American rappers trying to break into a world that often treats them as outsiders. Sharing dynamic live performance footage and revealing interviews, these artists will make the most skeptical critics into believers.",0.131805,3,"2016-04-16","Released"
"143",0,0,"A Fat Wreck","Fat Wreck Chords... The influential music label proud to say they've spent the past 25 years ""ruining punk rock"". A Fat Wreck tells the story of founders Fat Mike (of the legendary punk band NOFX) and his ex-wife Erin Kelly-Burkett, spanning the birth, growth, struggles, and survival of the Fat Wreck Chords label.",0.153842,3,"2016-04-15","Released"
"144",0,0,"The Seeker","A daughter's idyllic life is turned upside-down by immense tragedy. As she grows older, her cynicism and apathy towards her new reality is challenged by a reminder from the past that sets her on a pilgrimage that will define her.",0.072213,0,"2016-04-08","Released"
"145",85,0,"Yorimatã","A feature-length, creative documentary on the lives of Luhli and Lucina, two especially important artists in the alternative cultural scene during the 1970s. In a time when transgression, love and peace guided behavior, we discover the love of two women for art, their spiritual universe, their lives in community and their three-way relationship with photographer Luiz Fernando Borges da Fonseca.",0.060104,1,"2016-04-07","Released"
"146",0,0,"Hired Gun","A documentary film about session and touring musicians that are hired by well establish and famous bands and artists. These people may not be household names, but are still top notch performers!",0.79743,9,"2016-03-18","Released"
"147",0,0,"A Song For You: The Austin City Limits Story","From Willie Nelson to Wilco, Ray Charles to Radiohead, A Song For You: The Austin City Limits Story offers the ultimate backstage pass to 40 years of incredible music from the longest running music show in television history.",0.024853,0,"2016-03-17","Released"
"148",0,0,"The Art of Organized Noize","Organized Noize shaped the landscape of Hip Hop music with a distinct sound created in the confines of a dungeon. They're responsible for the careers of Outkast, CeeLo, Goodie Mob, and the Dungeon Family. This is the story of the Art of Organized.",1.397548,7,"2016-03-15","Released"
"149",0,0,"I Am The Blues","A musical journey through the swamps of the Louisiana Bayou, the juke joints of the Mississippi Delta and Moonshine soaked BBQs in the North Mississippi Hill Country. Visiting the last original blues devils, many in their 80's, still living in the deep south, working without management and touring the Chitlin' Circuit. Let Bobby Rush, Barbara Lynn, Henry Gray, Carol Fran, Lazy Lester, Bilbo Walker, RL Boyce, Jimmy 'Duck' Holmes, Lil Buck Sinegal, LC Ulmer and their friends awaken the blues in all of us.",0.031284,0,"2016-03-15","Released"
"150",0,0,"Goodnight Brooklyn - The Story of Death By Audio","Death By Audio, an underground art and music venue, is forced to close in 2014. The film focuses on the struggles of maintaining a community in the face of Brooklyn property development, hostile construction workers, and a one billion-dollar company.",0.130754,1,"2016-12-01","Released"
"151",0,0,"Alive and Kicking","Alive and Kicking gives the audience an intimate, insider’s view into the culture of the current swing dance world while shedding light on issues facing modern American society.",0.511602,5,"2017-04-07","Released"
"152",0,0,"The Man from Mo'Wax","The story of one teenager’s ambition to passionately pursue creating quality music at any cost and the friendships, fall outs, successes and failures that come with it. Spanning three decades with exclusive access to personal home footage, we get the rare opportunity to watch a boy become a man in the world of music. Witnessing him experience a whirlwind journey of personal and professional highs and lows. From the rapid rise of his record label Mo'Wax, to becoming a millionaire by the age of 21 and forming the super band UNKLE, with DJ Shadow. This is a profile of one man's constant battle between art and commerce and how to survive as he continually strives for more.",0.136753,0,"2017-10-13","Released"
