"","budget","revenue","title","overview","popularity","vote_count","release_date","status"
"153",0,0,"Honky Tonk Heaven: Legend of the Broken Spoke","The Broken Spoke has hosted country greats like George Strait, Willie Nelson, Ernest Tubb, Bob Wills, George Jones, and Roy Acuff. A profile of “the last of the true Texas dance halls” and the tenacious family keeping it alive amid rapid urban growth.",0.024706,0,"2016-03-13","Released"
"154",0,0,"These C*cksucking Tears","Patrick Haggerty, the gritty, fearless voice behind the world's first and only gay-themed country music album, 40 years after its release.",0.06054,1,"2016-03-12","Released"
"155",0,0,"BANG! The Bert Berns Story","Music meets the Mob in this biography of '60s hitmaker and 2016 Rock and Roll Hall of Fame inductee Bert Berns.",0.028565,0,"2016-03-11","Released"
"156",0,0,"Vince Giordano: There's a Future in the Past","Bandleader Vince Giordano keeps the Jazz Age alive with his 11-member band The Nighthawks, vintage musical instruments, and a collection of more than 60,000 original arrangements from the 1920s and '30s.",0.040027,0,"2017-01-13","Released"
"157",0,0,"Alice Beyond the Abyss","Multiforo Alicia is a space that constantly seeks to trigger rebellion, questioning, resistance, reflection and finally generate a self-managed organization for the inhabitants of Mexico City. It is the place where the others not within the market culture mainstream, fit in. This documentary tells us what it is and what´s the purpose of the existence of these kind of spaces.",0.023747,0,"2016-03-04","Released"
"158",0,0,"Freak","The short film to accompany Lana Del Rey's ""Freak"" tells a story of a California desert cult caught up in psychedelic drugs during a hot summer.",0.024986,0,"2016-02-09","Released"
"159",0,0,"Michael Jackson's Journey from Motown to Off the Wall","Director Spike Lee chronicles Michael Jackson's early rise to fame.",3.283829,38,"2016-02-06","Released"
"160",0,0,"The Most Dangerous Band In The World: The Story of Guns N’ Roses","Never-before-seen video footage of Guns N' Roses in their formative years, and how they climbed the charts from the gutters of Hollywood's Sunset Strip. The film tells the story of how the band came from playing bars on the Sunset Strip in Los Angeles to stadiums across the world and has been compiled from a host of exclusive interviews and the early footage of GNR fan and friend Marc Canter.  Interview subjects include Slash, drummer Steven Adler, former manager Vicky Hamilton, Whisky A Go Go owner Mario Maglieri.  Marc Canter has also said there is a full-cinema biopic (with actors) in the works.",0.083819,1,"2016-02-05","Released"
"161",0,0,"Young and Miserable or a Man Screaming Is Not a Dancing Bear","To start again. one has to destroy.",0.065265,0,"2016-01-29","Released"
"162",4000000,13624522,"Sing Street","A boy growing up in Dublin during the 1980s escapes his strained family life by starting a band to impress the mysterious girl he likes.",9.70989,882,"2016-03-11","Released"
"163",0,0,"We Are X","As glam rock's most flamboyant survivors, X Japan ignited a musical revolution in Japan during the late '80s with their melodic metal. Twenty years after their tragic dissolution, X Japan’s leader, Yoshiki, battles with physical and spiritual demons alongside prejudices of the West to bring their music to the world.",0.322496,4,"2016-03-12","Released"
"164",0,0,"MeTube 2: August sings Carmina Burana","The sequel to the 2013 short, August sings Carmen 'Habanera'. After Elfie and her nerdy son August successfully proved themselves on their home webcam in MeTube 1, the odd pair venture onto the street to present the biggest, boldest, and sexiest operatic flash mob the internet has ever witnessed!",0.195986,2,"2016-01-23","Released"
"165",0,0,"Eat that Question: Frank Zappa in His Own Words","Thorsten Schütte’s film is a sharply edited and energetic celebration of Zappa through his public persona, allowing us to witness his shifting relationship with audiences. Utilizing potent TV interviews and many forgotten performances from his 30-year career, we are immersed into the musician’s world while experiencing two distinct facets of his complex character. At once Zappa was both a charismatic composer who reveled in the joy of performing and, in the next moment, a fiercely intelligent and brutally honest interviewee whose convictions only got stronger as his career ascended.",0.301541,3,"2016-05-03","Released"
"166",0,0,"Yallah! Underground","Yallah! Underground follows some of today’s most influential and progressive artists in Arab underground culture from 2009 to 2013 and documents their work, dreams and fears in a time of great change for Arab societies.  In a region full of tension, young Arab artists in the Middle East have struggled for years to express themselves freely and to promote more liberal attitudes within their societies.  During the Arab Spring, like many others of this new generation, local artists had high hopes for the future and took part in the protests. However, after years of turmoil and instability, young Arabs now have to challenge both old and new problems, being torn between feelings of disillusion and a vague hope for a better future.",0.056483,1,"2015-12-15","Released"
"167",0,0,"Ouzeri Tsitsanis","During World War II in Greece, under the submission of Germans, one Christian, Giorgos, falls in love with a Jewish, Estrea, something completely forbidden. Can they and their families overcome all the obstacles, along with racial discriminations and hardship? The story mainly takes place in an ouzeria, in which Tsitsanis works, one of the greatest Greek composer, librettist and singer in the 20th century.",0.491445,4,"2015-12-03","Released"
"168",0,0,"Night Thoughts","Feature film directed by Roger Sargent to accompany Suede's seventh studio album 'Night Thoughts', with each track supported by different inter-linked stories of the highs and lows of Bryn's life. The world premiere took place at the London Roundhouse in November 2015.",0.02119,0,"2015-11-13","Released"
"169",0,0,"Don't tell Mom","A nocturnal education film, designed to help children develop their emotions and expressions as well as language and physical skills by enjoying singing and exercising with a big brother.",0.021251,0,"2015-11-01","Released"
"170",0,0,"Big Voice","BIG VOICE captures a tumultuous year in the life of a visionary high school choir teacher and his students as they overcome seemingly insurmountable obstacles to become one big voice in this inspiring musical documentary.",1e-06,4,"2015-10-18","Released"
"171",0,0,"Hollywood in Vienna 2015 - Tales of Mystery","At the very beginning of our journey we visit the gloomy estate Manderley from the well known Hitchcock classic REBECCA, before meeting the eccentric ADDAMS FAMILY in their dilapidated Viktorian Mansion. Subsequently, we get to know Ernest Menville, an undertaker, who shall help to renew the battered bodies of his immortal ex-wifes in DEATH BECOMES HER.  Our eerie tour then leads us to Disney's PHANTOM MANOR, the settlement of Cuesta Verde, in which a POLTERGEIST walks abroad, and the fabulous world of ALICE IN WONDERLAND. In the film set of PERFUME - THE STORY OF A MURDERER we will be bewitched by a perfect perfume and later on we find ourself in Paris, to reveal the enigmatic DA VINCI CODE. We then witness the curious transformation of BENJAMIN BUTTON, finally ending in the midst of THE OMEN, where the fallen angel casts a spell over us. In the second part of our concert we honor our these year’s laureate for the MAX STEINER FILM MUSIC ACHIEVEMENT AWARD 2015, James Newton Howard.",0.020004,0,"2015-10-16","Released"
"172",0,0,"Envy","Twelve images in 3,900 fragments. A hymn to the most universal of human emotions (in all its stroboscopic glory). Music by the Able Sea.",0.032528,0,"2015-10-03","Released"
"173",0,0,"We All Go the Same","In the timeless world of fairy tales, villains and victims are visited by a vengeful fairy who offers to shift the balance of power.",0.02,0,"2015-10-02","Released"
"174",0,0,"The Music of Strangers: Yo-Yo Ma and the Silk Road Ensemble","Follow several talented members of the ensemble as they gather in locations across the world, exploring the ways art can both preserve traditions and shape cultural evolution.",0.188014,4,"2016-06-10","Released"
"175",0,830129,"Born to Be Blue","Jazz legend Chet Baker finds love and redemption when he stars in a movie about his own troubled life to mount a comeback.",7.654913,77,"2015-09-13","Released"
"176",13000000,1646788,"I Saw the Light","Singer and songwriter Hank Williams rises to fame in the 1940s, but alcohol abuse and infidelity take a toll on his career and marriage to fellow musician Audrey Mae Williams.",7.003268,67,"2016-02-05","Released"
"177",0,0,"My Lonely Me","I am aged 7, I fear for my life. I run to a convent door. Cry for my Mother and Father. But they are no more... Now I am 21, locked in a swirling mist. Music is the only key that will unlock. My Lonely Me",0.018935,0,"2015-08-19","Released"
"178",28000000,201634991,"Straight Outta Compton","In 1987, five young men, using brutally honest rhymes and hardcore beats, put their frustration and anger about life in the most dangerous place in America into the most powerful weapon they had: their music.  Taking us back to where it all began, Straight Outta Compton tells the true story of how these cultural rebels—armed only with their lyrics, swagger, bravado and raw talent—stood up to the authorities that meant to keep them down and formed the world’s most dangerous group, N.W.A.  And as they spoke the truth that no one had before and exposed life in the hood, their voice ignited a social revolution that is still reverberating today.",13.975295,1695,"2015-08-13","Released"
"179",522360,0,"They Will Have to Kill Us First","In 2012, jihadists took control of northern Mali. They imposed one of the strictest interpretations of sharia law in history. On August 12th they banned music - radio stations destroyed, instruments burned and musicians facing torture, even death. Overnight, Mali’s most revered members of society – the musicians – were forced into hiding or exile. This film follows Mali’s musicians as they fight to keep music alive in their country. We witness fierce battles between the army and the jihadists, capture life over borders at refugee camps where money and hope are scarce, follow perilous journeys home to war ravaged cities, and for one band, Songhoy Blues, their path to international stardom.",0.055306,1,"2015-10-13","Released"
"180",18000000,41325328,"Ricki and the Flash","Meryl Streep stars as Ricki Rendazzo, a guitar heroine who made a world of mistakes as she followed her dreams of rock-and-roll stardom. Returning home, Ricki gets a shot at redemption and a chance to make things right as she faces the music with her family.",10.979583,351,"2015-07-10","Released"
"181",0,0,"Summerfestival 2015 - Yellow Claw","Yellow Claw full set",0.052941,1,"2015-07-04","Released"
"182",0,0,"Noiserv: Centro Cultural de Belém","",0.094914,0,"2015-06-29","Released"
"183",0,0,"FNAF: The Musical","Markiplier and Nathan Sharp discover a sinister secret about Freddy Fazbear's in this real life musical adaptation of Five Nights at Freddy's. Can Mark, Nate, and the FNAF cast survive Five Nights?",0.259587,2,"2015-06-26","Released"
"184",0,0,"2CELLOS - Back to the Roots","Luka Šulic and Stjepan Hauser along with the Zagreb Soloists performed two days in a row at the Lisinski Concert Hall presenting a classical music repertoire. During these unique music evenings, held on the 9th and the 10th of June, 2CELLOS showed how cello sounds while playing Vivaldi, Bach, Rachmaninov, Morricone, Zimmer ...",0.039568,0,"2015-06-09","Released"
"185",0,0,"Abby Singer/Songwriter","A has-been New York rock-star teams up with a wannabe filmmaker to destroy hipster culture in New York... if they don't destroy each other first.",0.08825,2,"2015-06-03","Released"
"186",0,0,"Ok Good","A documentary musical about life in the Russian outback somewhere near Vologda. It's a sound: music, a human voice, and silence.",0.062961,0,"2015-05-28","Released"
"187",0,8413144,"Amy","A documentary on the life of Amy Winehouse, the immensely talented yet doomed songstress. We see her from her teen years, where she already showed her singing abilities, to her finding success and then her downward spiral into alcoholism and drugs.",7.267907,568,"2015-07-03","Released"
"188",0,0,"Olly Murs: Never Been Better - Live at the O2","Be prepared for Olly Murs Live At The O2. Recorded May 7th at London's O2 Arena, this live film is one of 4 sold out shows at the venue and it features a duet with Robbie Williams on Olly's classic hit 'Troublemaker.'",0.076922,1,"2015-05-07","Released"
"189",0,0,"Salvation RMX","A youth choir and their director lift the spiritual life of a church and preacher.",0.040121,0,"2015-07-31","Released"
"190",0,0,"The Grace of Jake","Ex-inmate and wandering musician Jake travels to a small town in Arkansas intent on exacting revenge from his father, but begins to unravel a complicated family history as he befriends the locals.",0.062926,0,"2017-02-03","Released"
"191",0,135026,"Tumbledown","A young woman struggles to move on with her life after the death of her husband, an acclaimed folk singer, when a brash New York writer forces her to confront her loss and the ambiguous circumstances of his death.",4.03951,70,"2015-04-18","Released"
"192",0,0,"One More Time","Beautiful aspiring rock star Jude is stuck in a rut - relegated to recording commercial jingles and lost in a series of one night stands. When she is evicted from her Brooklyn apartment, she is forced to move into the Hamptons home of her wealthy - and selfish - father Paul Lombard, an over-the-hill, Sinatra-esque crooner angling for a musical comeback.",2.850937,25,"2016-04-08","Released"
"193",0,0,"Mavis!","A look at the life and music of legendary singer and civil rights activist, Mavis Staples.",0.496461,5,"2015-03-15","Released"
"194",0,0,"Cobain: Montage of Heck","The authorized documentary on late Guitar/lead singer Kurt Cobain from his early days in Aberdeen Washington to his success and downfall with Grunge band Nirvana.",6.337528,337,"2015-03-23","Released"
"195",0,0,"Fresh Dressed","Fresh Dressed chronicles the history of Hip-Hop | Urban fashion and its rise from southern cotton plantations to the gangs of 1970s in the South Bronx, to corporate America, and everywhere in-between. Supported by rich archival materials and in depth interviews with individuals crucial to the evolution of a way of life--and the outsiders who studied and admired them--Fresh Dressed goes to the core of where style was born on the black and brown side of town.",2.563478,17,"2015-06-26","Released"
"196",0,0,"Meat Loaf: In and Out of Hell","Documentary featuring an intimate profile of American rock legend Meat Loaf, spanning from his childhood of domestic violence, through a decade of rejection by record companies to global fame, bust-ups and a major comeback.",0.071113,1,"2015-01-09","Released"
"197",0,0,"Voice Of Apocalypse","Various people gather in a bar to celebrate the end of the world with one last bang. Unless a scientist who happens to be there can save them all…",0.015294,0,"2015-01-01","Released"
"198",0,0,"Grow: INFINITE's Real Youth Life","The growth story of Infinite like never seen before. Their youth drama starts now!  Infinite is now 4 years into their debut and have become a worldwide superstar with a world tour over 11 countries and 17 cities. However, they talk about the things they've kept bottled up inside and reflect on one another, even showing tears.  They've traveled a long road, will their passion for their dreams continue?",0.115181,1,"2014-12-04","Released"
"199",0,0,"Lord of the Dance: Dangerous Games","The final story of Michael flately lord of the dance series. Spectacular show",0.105028,2,"2014-11-24","Released"
"200",0,0,"ME!ME!ME!","An Japanese animated short film about an otaku fantasizing about fictional women in his bedroom before the thoughts take on a life of their own as they encapsulate his very being.",0.014146,0,"2014-11-21","Released"
"201",0,0,"I Dream Of Wires","An independent documentary film about the phenomenal resurgence of the modular synthesizer — exploring the passions, obsessions and dreams of people who have dedicated part of their lives to this esoteric electronic music machine. Inventors, musicians, and enthusiasts are interviewed about their relationship with the modular synthesizer — for many, it's an all-consuming passion.",0.827656,8,"2014-11-10","Released"
"202",0,0,"Seven Hearts","Seven lives, seven stories, one passion: Frevo. The collaborative writing of a piece which welcomes us to the world of seven great maestros of Pernambuco. Jose Menezes, Nunes, Clovis Pereira, Guedes Peixoto, Duda, Ademir Araujo and Edson Rodrigues - living legends of this rhythm that is an intangible heritage of Brazil. A journey through Frevo.",0.020192,0,"2014-10-30","Released"
"203",0,0,"Hollywood in Vienna 2014 - Comedy Tonight!","There were many reasons to be in a good mood in 2014! David Newman and the multiple Oscar and Grammy winning Film-Song specialist Randy Newman presented thecolorful world of film comedy!  This year the »MAX STEINER FILM MUSIC ACHIEVEMENT AWARD« was awarded to RANDY NEWMAN. The famous nephew of the ninefold Oscar-winner Alfred Newman is one of the most successful film scorers of our time. He is especially renowned and well beloved for his numerous film songs that brought him two OSCARS, 20 nominations for the Academy Award and eight nominations for the GOLDEN GLOBES. He is also winner of six GRAMMYS and three EMMYS as well as honorary member of the »Rock and Roll Hall of Fame« (since 2013).",0.014118,0,"2014-10-25","Released"
"204",0,0,"Gloria","Gloria never imagined that an audition for the music producer Sergio Andrade was going to change her life so drastically. King Midas not only brought her to stardom, but also to a dramatic story of love, heartbreak and betrayal. Based on the life story of  pop/rock singer Gloria Trevi.",1.995355,17,"2014-10-20","Released"
"205",0,0,"Summer '82: When Zappa Came to Sicily","In the feature documentary, Summer 82 - When Zappa Came to Sicily, filmmaker and Zappa fan Salvo Cuccia tells the behind-the-scenes story of Frank Zappa's star-crossed concert in Palermo, Sicily, the wrap-up to a European tour that ended in public disturbances and police intervention. Cuccia had a ticket to the concert but never made it.  Thirty years later, collaborating with Zappa's family, he re-creates the events through a combination of rare concert and backstage footage; photographs; anecdotes from family, band members, and concertgoers; and insights from Zappa biographer and friend Massimo Bassoli. The story is also a personal one, as Cuccia interweaves the story of Zappa's trip to Sicily with his own memories from that summer.",0.020248,0,"2014-10-05","Released"
"206",0,0,"The Dancer","A short life of a dance.",0.114401,0,"2014-10-01","Released"
"207",0,0,"Austin to Boston","Austin to Boston follows a group of talented musicians as they battle the elements in VW camper vans to tour for thousands of fans from Austin to Boston.",0.378148,10,"2015-06-12","Released"
"208",0,14612,"Encore","Many many words have been written and a few ingenious TV documentaries have been filmed about the great Russian rock band Auktyon, which recently celebrated 30 years of playing music. Everything is completely different in the case of the film Encore: it took seven years for the director, Dmitry Lavrinenko, to make it; he needed just that amount of time to capture the wayward grace still preserved by Fyodorov, Garkusha, Ozersky and their associates. If you look behind the powerful music facade, you find not a story of a band but chronicles of a voyage aimed at incredible, incomparable music. Encore shows how the songs which are now known by heart were composed; it also shows things generally left aside: pieces of everyday life, tour diaries, conversations, including the key phrase: ""You should not look at the liberty too much, you might feel dizzy.""",0.014695,0,"2014-09-18","Released"
"209",1000000,0,"Bang Bang Baby","A small town teenager in the 1960s believes her dreams of becoming a famous singer will come true when her rock star idol gets stranded in town. But a leak in a nearby chemical plant that is believed to be causing mass mutations threatens to turn her dream into a nightmare.",0.864838,8,"2014-09-08","Released"
"210",0,65460,"Eden","Paul, a teenager in the underground scene of early-nineties Paris, forms a DJ collective with his friends and together they plunge into the nightlife of sex, drugs, and endless music.",5.168597,49,"2014-11-19","Released"
"211",0,0,"I Am a Knife with Legs","On the run from an assassin, international rock star Bené hides out in Los Angeles and prepares for a showdown with death.",0.067927,1,"2014-07-25","Released"
"212",45000000,86165646,"Step Up All In","All-stars from the previous Step Up installments come together in glittering Las Vegas, battling for a victory that could define their dreams and their careers.",9.765249,857,"2014-07-16","Released"
"213",0,0,"The Who - Quadrophenia: Live In London 2013","Documenting their 8 July 2013 concert at London's Wembley Arena, the final show of their 2012-3 ""Quadrophenia and more"" tour.",0.014161,0,"2014-06-09","Released"
"214",0,0,"Beautiful Noise","BEAUTIFUL NOISE is an in-depth exploration of a music movement in the late twentieth century, a fascinating period when some innovative musicians mixed guitar noise into conventional pop song structures while maintaining a philosophy of letting the music speak for itself. Although many of the people interviewed are notoriously press shy they have opened up about their music and experiences from over 20 years ago, how they defied the rules and became sonic innovators that have inspired so many.",0.164682,4,"2014-05-17","Released"
"215",0,0,"We are Twisted Fucking Sister!","In 1984, American heavy metal band Twisted Sister became a global sensation. For 30 years, they been synonymous with hairspray, women's clothing and tasteless album covers. Until now. Ten years ago, director Andrew Horn was granted access to the archives of Twisted Sister founder Jay French and in We are Twisted fucking Sister he explores the decade that preceded their breakthrough.",1.011105,18,"2016-02-19","Released"
"216",0,0,"Moleman 3: Journey to the Surface","Moleman 3 is a documentary diary about a journey from the underground to the cultural surface.  Music styles and artists ignored by record labels and the mainstream media didn't have much chance of getting wide recognition back in the day. The digital revolution changed everything. The internet and digital technology, accessible to everyone, reshaped the music industry completely. The significance of record labels which controlled mainstream music has changed and decayed. For genres building themselves up from the bottom, success was once unimaginable without a record label and money. As of today, thanks to the digital revolution, it can easily be done.",0.138424,0,"2014-05-08","Released"
"217",0,0,"The National - Live at Sydney Opera House","Recorded on the forecourt of the Sydney Opera House on February 8th, 2014 with the assistance of Sydney Opera House Trust",0.012471,0,"2014-02-08","Released"
"218",0,0,"Nuke City","An experimental music video created as part of the Tunected project for Hungarian music producer Lank (Peter Golyan)",0.136877,1,"2014-02-03","Released"
"219",0,0,"Zipang Punk","Goemon Ishikawa steals a golden statue from Yukari Kukai with female thief Neko no Me Ogin, but Private Detective Shinkuro Akechi chases after Goemon Ishikawa  and Neko no Me Ogin. Detective Shinkuro Akechi discovers that there is a code hidden within the golden statue. The code reveals the location where gold is hidden. Meanwhile, outlaws gather under Goemon Ishikawa.",0.082802,0,"2014-01-29","Released"
"220",0,0,"20,000 Days on Earth","A semi-fictionalized documentary about a day in the life of Australian musician Nick Cave's persona.",7.477416,88,"2014-07-05","Released"
"221",0,0,"The Last Playlist","Aging record producer, Nick Silver sets out to prove he's still relevant by curating a playlist with multiple artists instead of an album with one artist. When his doctor tells him he'll be deaf in three months, he panics and begins speaking his memoirs into a video camera in bathroom mirrors all over Los Angeles.",0.023589,0,"2014-01-01","Released"
"222",0,0,"Tropico","""Tropico"" is a musical short film by Lana Del Rey, based on the classic biblical story of Adam and Eve. Using music from her 'Paradise' EP, the film is an exploration of redemption in modern LA; the land of gods and monsters.",1.708745,32,"2013-12-04","Released"
"223",0,0,"Every Everything: The Music, Life & Times of Grant Hart","In marked contrast to ""Color Me Obsessed,"" director Gorman Bechard's risky yet rewarding 2011 Replacements documentary that featured no songs or appearances by its subject matter, his upcoming ""Every Everything: the music, life &amp; times of Grant Hart"" doc completely flips the formula: It's 100% unfiltered, unrestrained Grant Hart. The former Husker Du co-songwriter/singer/drummer welcomes you into his world, immediately addresses any HD reunion possibilities in an old interview, and is shown wailing behind his kit during that renowned middle-American punk band's heyday.",0.010608,0,"2013-10-10","Released"
